attendance,clarityColor,easyColor,helpColor,helpCount,id,notHelpCount,onlineClass,quality,rClarity,rClass,rComments,rDate,rEasy,rEasyString,rErrorMsg,rHelpful,rInterest,rOverall,rOverallString,rStatus,rTextBookUse,rWouldTakeAgain,sId,takenForCredit,teacher,teacherGrade,teacherRatingTags,unUsefulGrouping,usefulGrouping
N/A,average,good,average,0,14421124,0,,good,3,PHYS486,"Follows Griffiths and assigns hard homework problems, but the tests are fair and straight forward and are open book, notes, homework, discussion, etc.  She's quite nice and willing to help you out when you need it.",05/07/2008,4,4.0,,4,Sorta interested,3.5,3.5,1,Yes,N/A,1112,N/A,,N/A,,people,people
N/A,good,average,good,0,12914039,0,,good,4,PHYS486,follows the textbook by griffiths,03/10/2007,2,2.0,,5,It's my life,4.5,4.5,1,Yes,N/A,1112,N/A,,N/A,,people,people
N/A,average,average,average,1,11210071,0,,average,3,PHYS212,"As with most physics lectures at UIUC, her's isn't worth going to. Loves pronouncing key terms awkwardly (e.g. CoooLOMS Law). Extremely boring, and the 90-minute duration is brutal. Go to all the discussions, run through 2 or 3 past hour exams, and read through all the lecture slides before the final, and you'll be fine.",12/19/2005,3,3.0,,2,Sorta interested,2.5,2.5,1,N/A,N/A,1112,N/A,,N/A,,people,person
N/A,good,average,good,0,3136531,0,,good,4,PHYCS212,No Comments,12/31/2004,3,3.0,,4,Sorta interested,4,4.0,1,N/A,N/A,1112,N/A,,N/A,,people,people
N/A,poor,average,poor,1,3109880,0,,poor,1,PHYS212,"Lectures were very hard to understand, and painful to sit through--she gave off the impression that she disliked teaching and did not want to be there.  No excitement about physics at all.",12/24/2004,3,3.0,,2,Really into it,1.5,1.5,1,N/A,N/A,1112,N/A,,N/A,,people,person
