attendance,clarityColor,easyColor,helpColor,helpCount,id,notHelpCount,onlineClass,quality,rClarity,rClass,rComments,rDate,rEasy,rEasyString,rErrorMsg,rHelpful,rInterest,rOverall,rOverallString,rStatus,rTextBookUse,rWouldTakeAgain,sId,takenForCredit,teacher,teacherGrade,teacherRatingTags,unUsefulGrouping,usefulGrouping
N/A,good,average,good,0,22090548,1,,good,5,MCB245,"Extremely cool TA. He makes the best jokes that really complement the learning. Also, he is pretty charming <3",08/28/2013,3,3.0,,5,It's my life,5,5.0,1,Yes,N/A,1112,N/A,,N/A,,person,people
N/A,good,average,good,0,21466576,0,,good,5,MCB245,Great TA! Very helpful and friendly! Made this class very enjoyable!,03/30/2013,2,2.0,,5,Sorta interested,5,5.0,1,Yes,N/A,1112,N/A,,N/A,,people,people
N/A,good,average,good,0,21260148,1,,good,5,MCB245,"Professor Jarman is HONestly the best TA I have EVER had through out college. He has helped me with just about any questions, even about my PSR. If that's not enough reason to take his class, he is also attractive and cute. I actually had bad expectations of this class due to what others told me, but Alan really helped spark interest in anatomy.",01/15/2013,3,3.0,,5,Meh,5,5.0,1,No,N/A,1112,N/A,,N/A,,person,people
N/A,good,poor,good,0,21034090,0,,good,5,MCB245,"Honestly, one of the best TA's that you will ever have. Always willing to help you no matter what.",12/12/2012,1,1.0,,5,It's my life,5,5.0,1,Yes,N/A,1112,N/A,,N/A,,people,people
N/A,good,average,good,0,21017118,0,,good,5,MCB245,"Awesome T.A. Didn't seem like he knew much in the beginning, but he is definitely on top of his game now. Really good looking too.",12/11/2012,3,3.0,,5,Low,5,5.0,1,Yes,N/A,1112,N/A,,N/A,,people,people
N/A,good,average,good,0,21004347,0,,good,5,MCB245,"Alan was great!!! He made the class so much fun (his jokes are memorable), and was great at helping and teaching us! He is extremely kind, and very cute lol. If you get the chance, you should definitely take him!",12/10/2012,3,3.0,,5,It's my life,5,5.0,1,Yes,N/A,1112,N/A,,N/A,,people,people
N/A,good,poor,good,0,20809932,0,,good,5,MCB245,"Such a sweet TA!  Wasn't that interested in the subject prior to attending the class, but somehow Professor Jarman makes the class so enjoyable!  If you have any questions, he is extremely helpful during his office hours, especially if it's one hon one. The bonus is that he is pretty attractive too =).  Alan's TA section is a must!",11/10/2012,1,1.0,,5,Sorta interested,5,5.0,1,Yes,N/A,1112,N/A,,N/A,,people,people
N/A,good,average,good,0,20628539,0,,good,5,MCB245,"Alan was really nice to everyone in class, and he's really cute too!!! <3",09/05/2012,3,3.0,,5,It's my life,5,5.0,1,Yes,N/A,1112,N/A,,N/A,,people,people
N/A,good,average,good,0,20622248,0,,good,5,MCB245,Great TA. Great sense of humor. Also has an amazing Baron Davis-esque beard!,09/01/2012,3,3.0,,5,It's my life,5,5.0,1,Yes,N/A,1112,N/A,,N/A,,people,people
