attendance,clarityColor,easyColor,helpColor,helpCount,id,notHelpCount,onlineClass,quality,rClarity,rClass,rComments,rDate,rEasy,rEasyString,rErrorMsg,rHelpful,rInterest,rOverall,rOverallString,rStatus,rTextBookUse,rWouldTakeAgain,sId,takenForCredit,teacher,teacherGrade,teacherRatingTags,unUsefulGrouping,usefulGrouping
N/A,poor,good,average,0,24779692,0,,poor,1,MATH285,"You should probably switch out of his class if you're in Math 285. You will be far better off with any other professor, even if you have to sign up for an 8 AM.",05/08/2015,4,4.0,,3,Meh,2,2.0,1,Yes,N/A,1112,Yes,,B+,,people,people
N/A,poor,good,poor,0,24646001,0,,poor,1,285,"Does not really speak English and has a great difficulty helping students understand the materials. If you have chances to switch another section, go for it.",04/22/2015,4,4.0,,1,Meh,1,1.0,1,No,Yes,1112,Yes,,N/A,,people,people
Not Mandatory,average,good,average,0,24626187,0,,poor,2,MATH285,"Doesn't teach out of the textbook assigned, not to mention the textbook is horrible at showing steps and giving clear explanations for problems.  Usually gives quiz and  test questions that require a ""deeper understanding"" of the concepts of the chapter which aren't entirely covered in the homework.  However, he is an easy grader of homework.",04/20/2015,4,4.0,,2,Sorta interested,2,2.0,1,Yes,N/A,1112,Yes,,Not sure yet,,people,people
N/A,average,average,average,0,21087092,0,,poor,2,MATH225,"Tumanov quite simply cannot lecture. About halfway through the semester, I attended class but stopped paying attention. His accent makes him hard to understand not that without it, he'd be able to lecture well anyway. If you do the homework and study you will do well, but with a different prof, that level of work would be a letter grade higher.",12/16/2012,3,3.0,,2,Sorta interested,2,2.0,1,Yes,N/A,1112,N/A,,N/A,,people,people
N/A,poor,average,average,0,18892942,0,,poor,1,MATH241,"You don't learn much from Tumanov as his explanations aren't great and he has a hard to understand accent. In addition to this, the book isn't exactly all that clear either. If you do end up taking this class, prepare to learn how to solve a specific problem for an exam rather than properly understanding the concepts. Generous curve though.",08/08/2011,3,3.0,,3,It's my life,2,2.0,1,Yes,N/A,1112,N/A,,N/A,,people,people
N/A,poor,good,poor,0,18666647,0,,poor,1,MATH241,A professor of absolutely appalling quality. I learnt nothing from the course. He was incomprehensible with a heavy accent. Attendance was horrible-no one showed up. TA's were not helpful. No extra credit despite numerous requests.. and exams of unpredictable difficulty. Overall Fail.,05/26/2011,4,4.0,,1,Meh,1,1.0,1,Yes,N/A,1112,N/A,,N/A,,people,people
N/A,average,average,average,0,18666620,0,,average,3,MATH241,"nice man, available for help. homework and quizzes every week. exams weren't too bad, and the grade curve was generous",05/26/2011,3,3.0,,3,Low,3,3.0,1,Yes,N/A,1112,N/A,,N/A,,people,people
N/A,average,average,average,0,18666615,0,,average,3,MATH241,"Nice person, available for help. homework and quizzes every week. exams weren't too bad and the grade curve was generous",05/26/2011,3,3.0,,3,Low,3,3.0,1,Yes,N/A,1112,N/A,,N/A,,people,people
N/A,poor,average,poor,0,18383705,0,,poor,1,MATH241,"one of the worst teacher one can have. Doesn't really speak English, and doesn't know how to teach either. No one ever goes to his lecture, you have to teach yourself. Exams are not that bad, have to do the previous exams",04/10/2011,3,3.0,,1,Meh,1,1.0,1,Yes,N/A,1112,N/A,,N/A,,people,people
N/A,average,good,average,0,17967589,0,,average,3,MATH241H,"He did poor job explaining the theory and he jumped a lot. However, his grading is pretty fair, and he almost tells us every problem on the test, so grade is not a problem. If you review the stuff after each class and make sure you get everything on the homework, then A is in your pocket.My little tip is: find an excellent study buddy!That helps me",12/16/2010,5,5.0,,3,Really into it,3,3.0,1,Yes,N/A,1112,N/A,,N/A,,people,people
N/A,average,average,average,1,17938824,0,,average,3,MATH241H,"You get used to the accent but that doesn't help the fact that when you ask him questions he doesn't understand and answers something else. In lecture he didn't use enough examples and does way too much proof which made the hw extremely hard. However, he gives reasonable tests and lots of partial credit! Very fair exams",12/14/2010,3,3.0,,2,Really into it,2.5,2.5,1,Yes,N/A,1112,N/A,,N/A,,people,person
N/A,average,good,average,0,17926608,0,,average,2,MATH241,"Cool accent, nice guy, available for help, not a very good teacher because he usually doesn't use good examples (just proofs). I took Math 241 Honors and he told us wat questions were gonna be on each test. Start the hw early and you should be fine",12/13/2010,4,4.0,,4,Sorta interested,3,3.0,1,Yes,N/A,1112,N/A,,N/A,,people,people
N/A,average,good,average,0,16334321,0,,average,3,MATH241,"HORRIBLE professor. Most math professors here are bad but I've never been so confused in a subject like with him. lecture was pointless he just outlined the book, my ta was also bad and a hard grader. test averages have been ~65%, homework is ridiculous along with quizzes and the book does not help any, moral of the story FIND A DIFFERENT PROFESSOR",11/09/2009,4,4.0,,2,Low,2.5,2.5,1,Yes,N/A,1112,N/A,,N/A,,people,people
N/A,average,good,average,0,15894379,0,,poor,2,MATH241,"Tumanov is your average UIUC math professor; and by average I mean bad at teaching, and foreign with a thick accent. That being a said, the accent is not impossible; my advice is to take a seat front and center. The lectures have too many proofs and not enough well explained examples. The tests are difficult, but not impossible.",05/25/2009,4,4.0,,2,Low,2,2.0,1,Yes,N/A,1112,N/A,,N/A,,people,people
N/A,good,average,good,0,15563525,0,,good,4,MATH241,"Good solid professor. Much better choice than the other professor(s) on campus. Calculus is difficult, there's no way around it, but he's very clear in examples and extremely thorough. Exams are not too difficult if you keep up with the hw and quizzes. Hw never due, but necessary to succeed.",03/24/2009,2,2.0,,4,Sorta interested,4,4.0,1,Yes,N/A,1112,N/A,,N/A,,people,people
N/A,poor,good,poor,0,15560417,0,,poor,1,MATH241,"Major beef is that he is extremely hard to understand. It honestly took me 3 weeks to get used to his accent. Meanwhile I had to study primarily from the book just to keep my head above water. He obviously knows his stuff, but teaches like he's the only one in the room, usually ignoring raised hands. Avoid if possible.",03/24/2009,4,4.0,,2,Really into it,1.5,1.5,1,Yes,N/A,1112,N/A,,N/A,,people,people
N/A,average,average,average,0,15289690,0,,good,3,MATH241,"Isn't really too hard to understand, and if you pay close attention in class the material becomes more coherent. He gives very difficult quizzes and tests, but there is a steep curve on final grades. Go to class for the examples but study the concepts from the book before hand.",12/29/2008,3,3.0,,4,Low,3.5,3.5,1,No,N/A,1112,N/A,,N/A,,people,people
N/A,poor,good,poor,0,14242904,0,,poor,1,MATH234,"He isn't very helpful, seems quite apathetic toward his students, and speaks in a funky accent.",04/04/2008,4,4.0,,1,Meh,1,1.0,1,Yes,N/A,1112,N/A,,N/A,,people,people
N/A,poor,good,poor,0,14198762,0,,poor,1,MATH234,"god awful. Doesn't know how to teach, and have a VERY strong accent. If you'd like to ACTUALLY learn math , I suggest you drop the minute you get in there. I regret I haven't chekced this before hand.",03/25/2008,5,5.0,,1,Meh,1,1.0,1,No,N/A,1112,N/A,,N/A,,people,people
N/A,poor,good,poor,0,13830978,0,,poor,1,MATH241,"Hard to understand, and not just because of accent/mediocre command of English language.  NOT good at explaining/teaching.  Hard exams, inadequate curve for class (class average for final exam was a D WITH the curve)  Aviod this guy if you can, but since U of I won't let you see your math prof. when you sign up, it's really just a matter of chance.",12/14/2007,5,5.0,,1,Meh,1,1.0,1,No,N/A,1112,N/A,,N/A,,people,people
