attendance,clarityColor,easyColor,helpColor,helpCount,id,notHelpCount,onlineClass,quality,rClarity,rClass,rComments,rDate,rEasy,rEasyString,rErrorMsg,rHelpful,rInterest,rOverall,rOverallString,rStatus,rTextBookUse,rWouldTakeAgain,sId,takenForCredit,teacher,teacherGrade,teacherRatingTags,unUsefulGrouping,usefulGrouping
N/A,good,poor,good,0,12538542,0,,good,5,STAT100,"He is a very funny and friendly teacher, but has times where he gets mad at the students either for not participating or making stupid mistakes on exams. He makes corny jokes that keep the class interesting, and provides worksheets which contain example that are exactly like test questions. He also gives extra credit and is a very lenient grader.",12/06/2006,1,1.0,,4,Sorta interested,4.5,4.5,1,No,N/A,1112,N/A,,N/A,,people,people
N/A,good,average,good,0,12393248,0,,good,5,STAT409,"Awesome professor. Makes class fun. He is strictly against curves, but offers extra credit opportunities to make up for it. Appreciates class participation and is always willing to help in and out of class.",11/10/2006,2,2.0,,5,It's my life,5,5.0,1,Yes,N/A,1112,N/A,,N/A,,people,people
N/A,good,poor,good,0,12324935,0,,good,5,STAT100,"Class is extremely easy if you are reasonably intelligent. Worksheets filled in during class are amazingly helpful. Overall very funny, hyper guy. Loves what he does which makes class enjoyable. Best professor I've had this year",10/27/2006,1,1.0,,5,Sorta interested,5,5.0,1,No,N/A,1112,N/A,,N/A,,people,people
N/A,good,average,good,0,12322460,0,,good,4,STATS100,awesome prof,10/26/2006,2,2.0,,5,Really into it,4.5,4.5,1,Yes,N/A,1112,N/A,,N/A,,people,people
N/A,good,poor,good,1,12241369,0,,good,5,MATH469,Best professor at U of I.  Great teaching skills.  Kept the material interesting and exciting.,09/20/2006,1,1.0,,5,It's my life,5,5.0,1,Yes,N/A,1112,N/A,,N/A,,people,person
N/A,good,average,good,0,12082971,0,,good,4,STAT400,"Overall a good professor and very knowledgable, but he speaks rather quietly and without a microphone, so get a seat up front. Has a tendency to flip out from time to time.",07/17/2006,2,2.0,,5,Sorta interested,4.5,4.5,1,N/A,N/A,1112,N/A,,N/A,,people,people
N/A,good,poor,good,0,11432535,0,,good,5,STAT408,"Some of the concepts in the class might be difficult, but Alex DEFINITELY deserves a 5 for helpfullness and clarity.  He goes above and beyond what is required and portrayed by the average professor.  He is MORE than willing to help with not only his classes but others in which he has knowledge as well.  The best professor I've had in my 4 yrs here",01/29/2006,1,1.0,,5,Really into it,5,5.0,1,N/A,N/A,1112,N/A,,N/A,,people,people
N/A,average,average,average,0,11113568,0,,average,3,STAT400,No Comments,12/10/2005,3,3.0,,3,Sorta interested,3,3.0,1,N/A,N/A,1112,N/A,,N/A,,people,people
