attendance,clarityColor,easyColor,helpColor,helpCount,id,notHelpCount,onlineClass,quality,rClarity,rClass,rComments,rDate,rEasy,rEasyString,rErrorMsg,rHelpful,rInterest,rOverall,rOverallString,rStatus,rTextBookUse,rWouldTakeAgain,sId,takenForCredit,teacher,teacherGrade,teacherRatingTags,unUsefulGrouping,usefulGrouping
N/A,good,average,good,0,16560357,0,,good,5,CMN260,"Amazing educator! By far, the best instructor I have ever had, or ever will have. Really fun and relevant class.",12/15/2009,2,2.0,,5,It's my life,5,5.0,1,Yes,N/A,1112,N/A,,N/A,,people,people
N/A,good,average,good,0,16251873,0,,good,5,CMN260,"She's great. Her notes are super clear, and if you study them the tests will be easy. She's funny, smart, and really loves teaching. Definitely take a class with her!",10/19/2009,2,2.0,,5,Low,5,5.0,1,No,N/A,1112,N/A,,N/A,,people,people
N/A,good,poor,good,0,15130183,0,,good,5,SPCM0102,Really really good! Would highly recommend her. She knows her stuff and teaches well.,12/08/2008,1,1.0,,5,Low,5,5.0,1,No,N/A,1112,N/A,,N/A,,people,people
N/A,good,poor,good,0,14215408,0,,good,5,SPCM230,"She's funny, hot, likeable, lenient and knows her stuff. What more could you ask for. Love her.",03/29/2008,1,1.0,,5,Sorta interested,5,5.0,1,Yes,N/A,1112,N/A,,N/A,,people,people
N/A,good,poor,average,0,13445570,0,,average,5,SPCM101,She pretty much will go for whatever any excuse you give her for any situation if she likes you and you seem credible,08/29/2007,1,1.0,,1,Really into it,3,3.0,1,No,N/A,1112,N/A,,N/A,,people,people
N/A,good,poor,good,0,12702683,0,,good,5,SPCM230,"yeah, she's a looker",12/31/2006,1,1.0,,5,Really into it,5,5.0,1,Yes,N/A,1112,N/A,,N/A,,people,people
N/A,good,poor,good,0,12305484,0,,good,5,SPCM230,"Great class! One of my favorites! Very interesting material, and even if the material wasn't interesting, I would still be at every class; coincidentally, &quot;Scott&quot; rhymes with &quot;hott&quot;.",10/22/2006,1,1.0,,5,It's my life,5,5.0,1,No,N/A,1112,N/A,,N/A,,people,people
N/A,good,average,good,0,12293218,0,,good,5,SPCM230,"Very nice, great teacher. interesting class. easy on the eyes",10/18/2006,2,2.0,,5,It's my life,5,5.0,1,Yes,N/A,1112,N/A,,N/A,,people,people
