attendance,clarityColor,easyColor,helpColor,helpCount,id,notHelpCount,onlineClass,quality,rClarity,rClass,rComments,rDate,rEasy,rEasyString,rErrorMsg,rHelpful,rInterest,rOverall,rOverallString,rStatus,rTextBookUse,rWouldTakeAgain,sId,takenForCredit,teacher,teacherGrade,teacherRatingTags,unUsefulGrouping,usefulGrouping
Mandatory,good,average,good,0,25801150,0,,good,5,CEE572,"too many homeworks, but v good knowledge of the subject",12/22/2015,3,3.0,,4,Really into it,4.5,4.5,1,Yes,N/A,1112,Yes,,A-,,people,people
N/A,poor,poor,poor,0,21695460,0,,poor,1,CEE572,"His class is boring and contributes no real content. Should be called ""story time with Amr."" His homework is unrelated to his lectures, as he gives only broad strokes in class, so you're on your own to figure out what he wants. Good luck getting help from him or his foreign TA's, as well. Wrote is own book, and it's just as useless as his lectures.",05/07/2013,1,1.0,,1,Sorta interested,1,1.0,1,No,N/A,1112,N/A,,N/A,,people,people
N/A,good,poor,good,0,19325703,0,,good,5,CEE572,Excellent Prof. Easy course,11/28/2011,1,1.0,,5,It's my life,5,5.0,1,Yes,N/A,1112,N/A,,N/A,,people,people
N/A,average,average,average,1,17252008,0,,average,3,CEE572,,05/22/2010,3,3.0,,2,Really into it,2.5,2.5,1,Yes,N/A,1112,N/A,,N/A,,people,person
N/A,average,good,average,0,15633911,0,,poor,2,CEE572,No Comments,04/10/2009,5,5.0,,2,It's my life,2,2.0,1,No,N/A,1112,N/A,,N/A,,people,people
