attendance,clarityColor,easyColor,helpColor,helpCount,id,notHelpCount,onlineClass,quality,rClarity,rClass,rComments,rDate,rEasy,rEasyString,rErrorMsg,rHelpful,rInterest,rOverall,rOverallString,rStatus,rTextBookUse,rWouldTakeAgain,sId,takenForCredit,teacher,teacherGrade,teacherRatingTags,unUsefulGrouping,usefulGrouping
N/A,good,average,good,0,21642433,0,,good,5,SPAN332,"Ann is such an amazing teacher. I really recommend taking her class, they are very practical. She genuinely cares about her students and the community. By far, best spanish class/professor I have ever had - maybe even best class I've taken at the university.",04/30/2013,2,2.0,,5,Really into it,5,5.0,1,Yes,N/A,1112,N/A,,N/A,,people,people
N/A,good,poor,good,0,17939708,0,,good,5,SPAN202,"One of the BEST Spanish teachers who taught one of the best classes I've ever had in Spanish. TAKE SPAN 202. It's VERY practical. You get to practice speaking with all the other students. She makes the class really comfortable. Show up to class for the participation, and there are a 9 assignments but they are pretty easy and practical. No exams :)",12/14/2010,1,1.0,,5,Sorta interested,5,5.0,1,Yes,N/A,1112,N/A,,N/A,,people,people
N/A,good,poor,good,0,13126526,0,,good,5,SPAN202,"This was a pretty easy class but at the same time it was pretty cool because you have to do some community work. Class only once a week, and there is a take home midterm and take home final. The professor is a very nice lady too.",05/08/2007,1,1.0,,5,Sorta interested,5,5.0,1,Yes,N/A,1112,N/A,,N/A,,people,people
N/A,good,average,good,0,12113621,0,,good,5,SPAN214225,She is amazingly nice and very understanding.,07/28/2006,2,2.0,,5,Sorta interested,5,5.0,1,N/A,N/A,1112,N/A,,N/A,,people,people
N/A,good,average,good,0,10664700,0,,good,5,SPAN,"Very intelligent woman.  She appreciates your efforts to improve and will bump your grade up for it.  Great person to do your letters of rec for grad school, etc.",10/30/2005,3,3.0,,5,Meh,5,5.0,1,N/A,N/A,1112,N/A,,N/A,,people,people
N/A,good,average,good,0,10442798,0,,good,5,SPANISH,No Comments,09/23/2005,2,2.0,,5,It's my life,5,5.0,1,N/A,N/A,1112,N/A,,N/A,,people,people
N/A,good,average,good,0,2585028,0,,good,5,SPAN232,Wonderful woman and professor. Class is enjoyable and I have learned more than in all of my other Spanish classes.,10/24/2004,2,2.0,,5,It's my life,5,5.0,1,N/A,N/A,1112,N/A,,N/A,,people,people
N/A,good,average,good,0,2045486,0,,good,5,SPAN225,"Incredibly nice, cultured woman.  The texts aren't the most exciting in the world, but if you must take a literature class, take it with Ann.",04/27/2004,2,2.0,,5,N/A,5,5.0,1,N/A,N/A,1112,N/A,,N/A,,people,people
