attendance,clarityColor,easyColor,helpColor,helpCount,id,notHelpCount,onlineClass,quality,rClarity,rClass,rComments,rDate,rEasy,rEasyString,rErrorMsg,rHelpful,rInterest,rOverall,rOverallString,rStatus,rTextBookUse,rWouldTakeAgain,sId,takenForCredit,teacher,teacherGrade,teacherRatingTags,unUsefulGrouping,usefulGrouping
Mandatory,good,good,good,0,26285172,0,,good,4,CMN101,"She's nice, and will definitely help you if you ask. However, she's pretty harsh on grading speeches - you will need to start practicing for them days before the actual presentation.",04/13/2016,4,4.0,,5,N/A,4.5,4.5,1,Yes,N/A,1112,Yes,,B,,people,people
Mandatory,good,average,good,0,25383532,0,,good,5,CMN101,"Went into cmn101 hating public speaking. Popp is a tough grader but she tells you exactly what you need to get an A. I did well in the class, but others didn't if they did not take her advice or prepare for speeches. Easy to get an A if you try. ",11/10/2015,3,3.0,,5,Sorta interested,5,5.0,1,Yes,N/A,1112,Yes,,A-,,people,people
Mandatory,poor,good,poor,0,22773264,0,,poor,1,CMN101,Terrible teacher. Do not take CMN 101 with her!!!!,01/20/2014,5,5.0,,1,Sorta interested,1,1.0,1,No,N/A,1112,N/A,,N/A,,people,people
N/A,good,poor,good,0,21717010,0,,good,5,CMN101,"Beth is an enthusiastic, caring professor who wants her students to succeed. She always gives constructive criticism as well as positive feedback. I was a horrible, nervous public speaker when I came into class, but the exercises helped me overcome that. As long as you follow the rubric you will do fine. She grades more on content than delivery.",05/09/2013,1,1.0,,5,Meh,5,5.0,1,Yes,N/A,1112,N/A,,N/A,,people,people
N/A,average,good,average,0,21043101,0,,poor,2,CMN101,"Hardest grader ever, don't expect a good  grade no matter how much work you put into an assignment. She will tell you to do something then mark you down for it on your speech. WORST TEACHER I'VE HAD IN COLLEGE. Drop if you get put in her public speaking class.",12/12/2012,5,5.0,,2,Sorta interested,2,2.0,1,Yes,N/A,1112,N/A,,N/A,,people,people
N/A,good,good,average,0,20843225,0,,good,5,CMN101,"She's very very very strict with the grades!! she said she would do nothing with the curve even when you are on the edge. She's really passionate to help but sometimes the guides become confusing. At the office hour she told me to move partC into partA of my outline, but in the end she reduced my grade and told me to cut the whole part A off.",11/15/2012,5,5.0,,2,Sorta interested,3.5,3.5,1,Yes,N/A,1112,N/A,,N/A,,people,people
N/A,good,good,average,0,19919487,0,,average,4,CMN101,Not a good teacher. She will grade really hard. Don't take her for speech,03/17/2012,4,4.0,,1,Meh,2.5,2.5,1,No,N/A,1112,N/A,,N/A,,people,people
