attendance,clarityColor,easyColor,helpColor,helpCount,id,notHelpCount,onlineClass,quality,rClarity,rClass,rComments,rDate,rEasy,rEasyString,rErrorMsg,rHelpful,rInterest,rOverall,rOverallString,rStatus,rTextBookUse,rWouldTakeAgain,sId,takenForCredit,teacher,teacherGrade,teacherRatingTags,unUsefulGrouping,usefulGrouping
N/A,poor,good,poor,0,18603650,1,,poor,1,PHY101,Avoid taking physics 101 with him at all costs.  I'm an A student and I got a C in his class because of the grading scale.  Unless you have a great TA (i didn't) I would NOT recommend taking this class! Gammie does not care about his students and makes this class way too hard for an introductory physics class!,05/15/2011,5,5.0,,1,Sorta interested,1,1.0,1,No,N/A,1112,N/A,,N/A,,person,people
N/A,average,average,average,0,18258303,0,,average,2,PHYS101,"Gammie was not a horrible professor. While he was not great at explaining some of the concepts in this class and was a boring lecturer, he was an approachable and nice guy. If you know how to do the past exam problems and how to apply the concepts, the tests are not horrible. It helps if you have a good TA. Quizzes are difficult, homework is easy.",03/08/2011,3,3.0,,3,Meh,2.5,2.5,3,No,N/A,1112,N/A,,N/A,,people,people
N/A,poor,good,poor,0,17221709,0,,poor,1,PHYS101,"This past semester in physics has been a terrible experience for me.  Gammie was not helpful, exams were tricky and not representative of what was taught in lecture",05/17/2010,5,5.0,,1,Sorta interested,1,1.0,1,No,N/A,1112,N/A,,N/A,,people,people
N/A,poor,good,poor,0,17207547,0,,poor,1,PHYS101,"horrible professor. can not teach to save his life. never connects w/ students. exams are not representative of material covered in discussion or past practice exams. earned a perfect score in practically everything but the exams and the final. i still don't understand why. there are curves, but don't let that fool you.",05/15/2010,5,5.0,,1,Really into it,1,1.0,1,No,N/A,1112,N/A,,N/A,,people,people
N/A,average,good,poor,0,17158402,0,,poor,2,PHYS101,too hard for physics 101!,05/09/2010,5,5.0,,1,Low,1.5,1.5,1,Yes,N/A,1112,N/A,,N/A,,people,people
N/A,average,good,poor,0,16029646,0,,poor,2,PHYS101,"I would NOT take physics with Gammie.  He's not that great and expects way to much from students taking an introductory physics class.  i'd recommend the community college, cause this guy can't teach",07/10/2009,5,5.0,,1,Low,1.5,1.5,1,No,N/A,1112,N/A,,N/A,,people,people
N/A,average,good,average,0,15953389,0,,poor,3,PHYS101,a word to the wise... STAY AWAY!,06/11/2009,5,5.0,,1,Meh,2,2.0,1,No,N/A,1112,N/A,,N/A,,people,people
N/A,average,good,poor,0,15932047,0,,poor,2,PHYS101,All the comments below are pretty accurate.  He was a horrible teacher and shouldn't be allowed to teach 101.,06/04/2009,5,5.0,,1,Sorta interested,1.5,1.5,1,No,N/A,1112,N/A,,N/A,,people,people
N/A,average,good,average,0,15923664,0,,average,3,PHYS101,"I guess I'm not the only one who thought this class was hard. I wanted to do well in it but I just couldn't. Everything about it was hard, except labs, which were super easy and just following directions. Gammie's lectures weren't enlightening but the little experiments were cool, yet useless.",06/02/2009,5,5.0,,2,Really into it,2.5,2.5,1,No,N/A,1112,N/A,,N/A,,people,people
N/A,average,good,poor,0,15889317,0,,poor,2,PHYS101,Gammie is really not that great.  The guest lecturer on the last day of class was way better than the professor for the course.  Very tough for a 101 level class.    Lecture is mandatory and useless.  Students are given equations with no explanation of how to use them.  I'd avoid him,05/23/2009,4,4.0,,1,Sorta interested,1.5,1.5,1,No,N/A,1112,N/A,,N/A,,people,people
N/A,average,good,poor,0,15862492,0,,poor,2,PHYS101,"Useless professor.  He makes the class way to hard for 101 level class (like previous comments say).  He should teach a higher level course, not an introductory one.  I hope he reads this so he knows what a terrible professor he is.",05/18/2009,5,5.0,,1,Low,1.5,1.5,1,No,N/A,1112,N/A,,N/A,,people,people
N/A,poor,good,poor,0,15861655,0,,poor,1,PHYS101,Terrible 101 class.  He teaches Physics 101 so that it is WAY to advanced for a 101 class.  I would advise taking this class at a community college.  You'll learn more and you'll avoid Gammie altogether,05/18/2009,5,5.0,,1,Really into it,1,1.0,1,No,N/A,1112,N/A,,N/A,,people,people
N/A,poor,good,poor,0,15825328,0,,poor,1,PHYS101,Reads off lecture slides and misleads students by giving them an equation sheet but then expecting them to derive equations on the test that are not apparent on the sheet. Too extreme for a non-physics major course. A physics major in 400 level couldn't solve some test problems. Crams a lifetime of physics into one semester. Final sucked/fast paced,05/13/2009,5,5.0,,1,Meh,1,1.0,1,No,N/A,1112,N/A,,N/A,,people,people
N/A,average,good,poor,0,15802816,0,,poor,2,PHYS101,Very boring lecturer.  Examples are not helpful in lecture because it's just Gammie deriving equations.  Homework is taken from the internet and not representative of exam questions.  The final exam is horrible.,05/09/2009,4,4.0,,1,Sorta interested,1.5,1.5,1,No,N/A,1112,N/A,,N/A,,people,people
N/A,average,average,average,0,15659644,0,,average,3,PHYS101,"Gammie is a standard 100 level professor.  Nothing too special, he basically reads off of his slides during lecture and seems pretty detached.  Some experiments were cool but lecture seems to drag.  I thought that the exams were a little tough for a physics 101 class, but they were curved.  On the plus side, Gammie is easy on the eyes. =)",04/16/2009,3,3.0,,3,Sorta interested,3,3.0,1,No,N/A,1112,N/A,,N/A,,people,people
N/A,good,average,good,0,15473780,0,,good,5,PHYS101,No Comments,02/19/2009,3,3.0,,4,Low,4.5,4.5,1,No,N/A,1112,N/A,,N/A,,people,people
N/A,good,average,average,0,15240124,0,,good,4,PHYS101,"He is fine. His lecture is clear and experiments are interesting. There are formula sheets in the exams. You don't have to memorize all of equations. Exams are not that hard. They are multiple choices and well-curved. Grading is quite fragmented, so you have to do well in all the parts: labs, quizzes, exams, homeworks, etc.",12/19/2008,2,2.0,,3,Sorta interested,3.5,3.5,1,No,N/A,1112,N/A,,N/A,,people,people
