attendance,clarityColor,easyColor,helpColor,helpCount,id,notHelpCount,onlineClass,quality,rClarity,rClass,rComments,rDate,rEasy,rEasyString,rErrorMsg,rHelpful,rInterest,rOverall,rOverallString,rStatus,rTextBookUse,rWouldTakeAgain,sId,takenForCredit,teacher,teacherGrade,teacherRatingTags,unUsefulGrouping,usefulGrouping
N/A,good,poor,good,0,26516871,0,,good,5,EPS201,One sick prof! He is a philosopher. Something I wish more professors considered!,05/09/2016,1,1.0,,5,N/A,5,5.0,1,Yes,N/A,1112,Yes,,N/A,,people,people
Mandatory,good,poor,good,1,26126141,1,,good,5,EPS201,"The class was an eye-opening experience, definitely a great start for anyone interested in education. Professor Higgins gives amazing lectures that cover a wide spectrum of educational philosophies, both regarding schools and personal development. The class requires a lot of reading, but each passage is carefully chosen to get you thinking.",03/09/2016,1,1.0,,5,It's my life,5,5.0,1,Yes,N/A,1112,Yes,,N/A,,person,person
Mandatory,good,average,good,2,26064891,0,,good,4,EPS201,"This is one of my first education classes at UIUC and I love it!! There is a lot of reading but not really any other homework and no tests. He just wants you to come and listen and open your mind. Even if you are confused by philosophy, Higgins is one of the most inspirational, intelligent professors I have ever had and I would highly recommend him",02/17/2016,2,2.0,,5,Really into it,4.5,4.5,1,Yes,N/A,1112,Yes,,A,,people,people
Mandatory,good,average,good,1,25662020,0,,good,4,EPS201,"Fantastic lectures on edu philosophy. Some other students were confused by the abstract-ness of the course content, but if you enjoy philosophy or non-concrete thought he's an excellent teacher. Very articulate and leads interesting discussions. ",12/12/2015,2,2.0,,5,Really into it,4.5,4.5,1,Yes,Yes,1112,Yes,,N/A,,people,person
Mandatory,poor,average,average,1,25281385,1,,poor,1,EPS202,Overall he's a really nice guy who is passionate about education but honestly he speaks so abstractly that he becomes impossible to follow. Definitely believes in the Socratic method of teaching...,10/22/2015,3,3.0,,3,Low,2,2.0,1,No,N/A,1112,Yes,,A,,person,person
Not Mandatory,average,average,average,1,24623633,0,,poor,2,EPS512,He is a nice and smart guy but this course does not nealy meet quality learning. I do not recommend to take this course. It's waste of time.,04/19/2015,3,3.0,,2,Sorta interested,2,2.0,1,No,N/A,1112,Yes,,Audit/No Grade,,people,person
N/A,poor,average,average,2,24513147,1,,poor,1,EPS512,"While he could be helpful if you asked, the most unpleasant  part of the class was his content. His course material and perspective was skimpy when it came to conveying diverse cultural perspectives. This made it difficult to learn during class because we often neglected other relevant insights.",03/28/2015,3,3.0,,3,Sorta interested,2,2.0,1,No,N/A,1112,Yes,,N/A,,person,people
