attendance,clarityColor,easyColor,helpColor,helpCount,id,notHelpCount,onlineClass,quality,rClarity,rClass,rComments,rDate,rEasy,rEasyString,rErrorMsg,rHelpful,rInterest,rOverall,rOverallString,rStatus,rTextBookUse,rWouldTakeAgain,sId,takenForCredit,teacher,teacherGrade,teacherRatingTags,unUsefulGrouping,usefulGrouping
N/A,average,average,average,0,20381691,0,,poor,3,GER212,"Compare to my previous German teachers she has a very strong American accent and makes many mistakes. We had to keep many deadlines, but she forgot to give us homework back. She was not available for addiotional help, always too busy. Overall a bad learning experience.",06/05/2012,2,2.0,,1,It's my life,2,2.0,1,No,N/A,1112,N/A,,N/A,,people,people
N/A,good,good,good,0,19728920,0,,good,5,GER212,"Crane has a sweet personality and is very passionate about German. If you want to really improve, I would recommend her. She spends a lot of time on more specific grammar, but it's worth it to sit through.",01/15/2012,4,4.0,,5,It's my life,5,5.0,1,Yes,N/A,1112,N/A,,N/A,,people,people
N/A,average,good,average,0,16931221,0,,good,3,GER102,"Make sure you review homework for tests. Participate and come to class, you will do fine",03/30/2010,4,4.0,,4,Really into it,3.5,3.5,1,Yes,N/A,1112,N/A,,N/A,,people,people
N/A,good,average,good,0,14196550,0,,good,4,GER102,"She wastes a lot of time on stuff that doesn't matter at all. As a result, we have to rush a lot of material before the test.",03/24/2008,2,2.0,,4,Sorta interested,4,4.0,1,Yes,N/A,1112,N/A,,N/A,,people,people
N/A,good,average,good,0,12607278,0,,good,5,GER101,Very enthusiastic and fun teacher.,12/14/2006,3,3.0,,5,Really into it,5,5.0,1,Yes,N/A,1112,N/A,,N/A,,people,people
N/A,good,average,good,0,11746396,0,,good,4,GER104,"she is a great teacher, be prepared for a lot of homework though. she's very passionate about what she does and is glad to help you understand material better if you don't get it at first. not a blow off class at all.",04/22/2006,3,3.0,,5,Really into it,4.5,4.5,1,N/A,N/A,1112,N/A,,N/A,,people,people
N/A,good,average,good,0,2258829,0,,good,5,GERM,"Take her class! Friendly, enthusiastic, and your German will improve a lot.",06/19/2004,3,3.0,,5,N/A,5,5.0,1,N/A,N/A,1112,N/A,,N/A,,people,people
