attendance,clarityColor,easyColor,helpColor,helpCount,id,notHelpCount,onlineClass,quality,rClarity,rClass,rComments,rDate,rEasy,rEasyString,rErrorMsg,rHelpful,rInterest,rOverall,rOverallString,rStatus,rTextBookUse,rWouldTakeAgain,sId,takenForCredit,teacher,teacherGrade,teacherRatingTags,unUsefulGrouping,usefulGrouping
Mandatory,average,average,average,0,25822172,0,,average,3,TAM211,He is a good professor in general. His lectures are kind of boring but there are iclicker points so I would encourage you all to go. The class has a lot of homework that is hard in my opinion. Exams can get a bit challenging.,12/25/2015,3,3.0,,2,Sorta interested,2.5,2.5,1,Yes,N/A,1112,Yes,,N/A,,people,people
Not Mandatory,poor,average,poor,1,25018198,0,,poor,1,ME212,"The worst professor I ever had.  Dry teaching style.  Unfortunately, it really just seems like he isn't very smart and as a result he has no ability to adjust his teaching style.  Professors like him are why ME at U of I will always be second rate.  Which is a shame because they are some really top notch professors there. ",07/05/2015,3,3.0,,1,Sorta interested,1,1.0,1,Yes,N/A,1112,Yes,,A,,people,person
N/A,good,average,good,0,24634498,0,,good,5,TAM211,Tortorelli knows what he's talking about and attempts to make that as clear as possible through his in-class examples. He records all of his lectures  and he is there to help with anything you need during office hours. He is incredibly patient. He also sounds exactly like Norm MacDonald... just sayin'.,04/21/2015,2,2.0,,4,Really into it,4.5,4.5,1,No,Yes,1112,Yes,,A,,people,people
N/A,average,good,average,0,23678069,0,,average,3,TAM211,"He's a dry lecturer, but he really knows what he's doing. Sometimes his sense of humor is hilarious, but it's hard to pay attention in his class.",10/21/2014,4,4.0,,3,Low,3,3.0,1,No,N/A,1112,Yes,,N/A,,people,people
N/A,average,good,average,1,21469273,1,,average,3,TAM212,"Really wasn't a fan. His lectures were among the most dry and dull that I've seen out there, and following the material (or even trying to) proved to be very difficult for me. That may be in part due to the nature of the class itself, but he certainly did nothing to contribute positively to me.",04/01/2013,4,4.0,,2,Low,2.5,2.5,1,No,N/A,1112,N/A,,N/A,,person,person
N/A,average,average,average,0,21226347,0,,average,3,TAM212,"I don't see what everybody's complaining about. The class was tough, but he def didn't make it worse. He used smartphysics for the hw which was great and gave a lot of opportunities for extra credit. The hw was about 10x harder than the tests and took HOURS (but at least it's not the other way around). Best example I've seen of an AVERAGE professor",01/07/2013,3,3.0,,3,Sorta interested,3,3.0,1,No,N/A,1112,N/A,,N/A,,people,people
N/A,good,good,good,0,19885834,0,,good,4,ME471,"Finite Element Analysis. Very hard class, homeworks and computer problems took many hours each week, exam was open book though.",03/06/2012,5,5.0,,4,Sorta interested,4,4.0,1,No,N/A,1112,N/A,,N/A,,people,people
N/A,good,good,average,0,17451679,0,,average,4,TAM212,"The homework was ridiculous (At least 8 hours a week), but he does a ton of examples in lecture and the exams weren't too bad.",07/26/2010,4,4.0,,2,Meh,3,3.0,1,No,N/A,1112,N/A,,N/A,,people,people
N/A,good,good,average,1,16839063,0,,good,5,TAM212,"The material was not difficult, just EXTREMELY boring. He was a good professor - he taught exactly what he tested us on. The homework was brutal - took at least 6 hours a week.",03/01/2010,4,4.0,,2,Low,3.5,3.5,1,No,N/A,1112,N/A,,N/A,,people,person
N/A,average,good,average,0,16575247,0,,average,3,TAM212,He sounds exactly like Norm Mcdonald.,12/16/2009,4,4.0,,3,Sorta interested,3,3.0,1,No,N/A,1112,N/A,,N/A,,people,people
N/A,good,good,good,0,16466003,0,,good,4,TAM212,"He does tons of examples.  It might be hard to get used to his style and notation, but once you do he is pretty helpful.  There is way too much homework for the credit given, but the exams were not hard at all.",12/03/2009,4,4.0,,4,Meh,4,4.0,1,No,N/A,1112,N/A,,N/A,,people,people
N/A,good,good,good,1,15806406,0,,good,4,TAM212,"Presents example problems well and is very helpful in office hours. My one problem with lectures is that his derivations didn't help my understanding one bit. Exams were much easier than in past semesters. Way too much homework though. When the homeworks got more difficult, I spend about 2 to 3 hours each set.",05/10/2009,4,4.0,,4,Low,4,4.0,1,No,N/A,1112,N/A,,N/A,,people,person
N/A,average,good,poor,0,15378615,0,,poor,2,TAM212,"One of those teachers that knows what he's talking about, but can't connect it to students. Everything is theoretical and he spends more time deriving equations than explaining how to use them. Online homework is very poorly set up w/ mistakes half the time and the tests were nothing like the homework or anything in class.",01/15/2009,4,4.0,,1,Meh,1.5,1.5,1,Yes,N/A,1112,N/A,,N/A,,people,people
N/A,average,good,average,1,15368342,0,,average,3,TAM212,Smart guy. lectures not needed if you read the book. TA's go to the help sessions so if they're decent enough there's no need to go to him directly. Not too bad if you put the work in.,01/13/2009,4,4.0,,3,Really into it,3,3.0,1,Yes,N/A,1112,N/A,,N/A,,people,person
N/A,poor,good,poor,0,15171356,0,,poor,1,TAM212,Worst professor EVER. AVOID AT ALL COSTS. It is quite clear that he could really care less about teaching/his students.,12/12/2008,5,5.0,,1,Low,1,1.0,1,Yes,N/A,1112,N/A,,N/A,,people,people
N/A,good,good,average,0,14228149,0,,good,4,TAM212,"He reminds me of David Hasselhof.  Good teacher, horrible class, mostly due to textbook.",04/01/2008,4,4.0,,3,Low,3.5,3.5,1,Yes,N/A,1112,N/A,,N/A,,people,people
N/A,average,average,average,0,13922072,0,,average,3,TAM212,He was alright at the beginning of the semester bc the material was fairly easy. But once the class got harder all he did was give us examples but never really set any general guidelines on HOW to solve a problem. Problems on exams were chosen from a long list so studying just meant memorizing every problem. Needs to learn to teach more effectively,12/29/2007,3,3.0,,3,Sorta interested,3,3.0,1,Yes,N/A,1112,N/A,,N/A,,people,people
N/A,good,average,good,0,13465638,0,,good,5,ENGR203,Great teacher. Good guy. Cares about his students.,09/08/2007,3,3.0,,5,It's my life,5,5.0,1,Yes,N/A,1112,N/A,,N/A,,people,people
N/A,average,good,average,0,13284703,0,,average,3,TAM212,"This guy is obviously very smart, but he can't teach for anything.  You can understand what he's saying (no accent or anything) but he's terrible at explaining things.",06/22/2007,5,5.0,,2,Low,2.5,2.5,1,Yes,N/A,1112,N/A,,N/A,,people,people
N/A,good,good,average,0,13175187,0,,average,4,TAM212,"Professor does not seem to care about his students.  His midterms were fairly easy, and his final was not bad.  Homework due every time that you walk in the classroom, but it's only two problems, and normally the homework only takes an hour to an hour half tops.  He knows the material but is not good at conveying.  I cannot recommend him as a prof.",06/07/2007,4,4.0,,2,Low,3,3.0,1,Yes,N/A,1112,N/A,,N/A,,people,people
