attendance,clarityColor,easyColor,helpColor,helpCount,id,notHelpCount,onlineClass,quality,rClarity,rClass,rComments,rDate,rEasy,rEasyString,rErrorMsg,rHelpful,rInterest,rOverall,rOverallString,rStatus,rTextBookUse,rWouldTakeAgain,sId,takenForCredit,teacher,teacherGrade,teacherRatingTags,unUsefulGrouping,usefulGrouping
N/A,good,average,good,0,20322102,0,,good,5,AE410,Bodony is an excellent teacher. He explains material so it can be intuitive and conceptually understood which is how I enjoy learning verses having to memorize equations or something. He is a nice guy and very helpful if you need it. He grades fairly and has good projects to practice material from class.,05/21/2012,3,3.0,,5,Really into it,5,5.0,1,No,N/A,1112,N/A,,N/A,,people,people
N/A,average,good,average,0,18587838,0,,good,3,ME412,Take his class if you are good in math....at times he teaches too fast..Exam was extremely difficult...cudn't follow even 1 out of the 3 questions in his midterm,05/12/2011,4,4.0,,4,Really into it,3.5,3.5,1,Yes,N/A,1112,N/A,,N/A,,people,people
N/A,good,good,good,0,17748761,0,,good,5,AE412,Homework makes you learn many things...,11/10/2010,4,4.0,,5,Sorta interested,5,5.0,1,Yes,N/A,1112,N/A,,N/A,,people,people
N/A,good,good,good,0,17513503,0,,good,5,AE312,"Homework was more challenging than any other class I've taken. Most assignments took between 10 and 15 hours, but one or two of them took 20+ hours and involved heavy MATLAB coding. HW is rewarding to complete, though, and also 40% of the grade. MATLAB skills are essential. Exams are difficult and require derivations from the governing eqns",08/15/2010,5,5.0,,5,It's my life,5,5.0,1,No,N/A,1112,N/A,,N/A,,people,people
N/A,good,good,good,0,16993435,0,,good,5,AE312,,04/14/2010,4,4.0,,5,Really into it,5,5.0,1,Yes,N/A,1112,N/A,,N/A,,people,people
N/A,good,good,good,0,14943425,0,,good,4,AE412,"Amazing lecturer. Homeworks were VERY difficult, but I came away with a sense of accomplishment when I was finished with them. Tests were fair.",11/05/2008,5,5.0,,4,It's my life,4,4.0,1,Yes,N/A,1112,N/A,,N/A,,people,people
