attendance,clarityColor,easyColor,helpColor,helpCount,id,notHelpCount,onlineClass,quality,rClarity,rClass,rComments,rDate,rEasy,rEasyString,rErrorMsg,rHelpful,rInterest,rOverall,rOverallString,rStatus,rTextBookUse,rWouldTakeAgain,sId,takenForCredit,teacher,teacherGrade,teacherRatingTags,unUsefulGrouping,usefulGrouping
N/A,good,good,good,0,16038854,0,,good,4,LER541,Quite charming.  I hear he's married though.  Too bad.,07/14/2009,4,4.0,,5,Low,4.5,4.5,1,Yes,N/A,1112,N/A,,N/A,,people,people
N/A,good,average,good,0,11958009,0,,good,4,ECON314,Had him for Labor Econ in 2002.  Then went on to grad school in econ... I still consider Darren to be the best econ teacher I had in college. He's easy on the eyes too.,05/30/2006,3,3.0,,5,It's my life,4.5,4.5,1,N/A,N/A,1112,N/A,,N/A,,people,people
N/A,good,average,good,0,11519394,0,,good,4,PUBPOL,Ratings are for the classes he taught at the University of Michigan while he was a visiting professor at the School of Public Policy.,02/25/2006,3,3.0,,4,Really into it,4,4.0,1,N/A,N/A,1112,N/A,,N/A,,people,people
N/A,good,good,good,0,11362376,0,,good,4,PUBPOL555,No Comments,01/13/2006,4,4.0,,5,Sorta interested,4.5,4.5,1,N/A,N/A,1112,N/A,,N/A,,people,people
N/A,good,average,good,0,3249792,0,,good,4,ECON,No Comments,01/19/2005,3,3.0,,4,Sorta interested,4,4.0,1,N/A,N/A,1112,N/A,,N/A,,people,people
