attendance,clarityColor,easyColor,helpColor,helpCount,id,notHelpCount,onlineClass,quality,rClarity,rClass,rComments,rDate,rEasy,rEasyString,rErrorMsg,rHelpful,rInterest,rOverall,rOverallString,rStatus,rTextBookUse,rWouldTakeAgain,sId,takenForCredit,teacher,teacherGrade,teacherRatingTags,unUsefulGrouping,usefulGrouping
N/A,good,average,good,1,23735626,1,,good,5,ECE110,very nice and explains clear. feel free to throw questions. ,11/03/2014,2,2.0,,5,Really into it,5,5.0,1,No,N/A,1112,Yes,,N/A,,person,person
Mandatory,good,average,good,4,23674489,0,,good,5,ECE110,The best teacher I've had in freshman year.,10/20/2014,2,2.0,,5,It's my life,5,5.0,1,No,N/A,1112,Yes,,A+,,people,people
N/A,good,average,good,2,23236391,0,,good,5,ECE210,"Varodayan knows the material very well, and clearly cared for all students in the class. All of his lectures were interesting, enjoyable, and were connected to real life applications. He is very fair in grading, very responsive, and will do whatever it takes for students to fully understand the material. Would definitely recommend taking his class.",05/13/2014,3,3.0,,5,It's my life,5,5.0,1,Yes,N/A,1112,N/A,,N/A,,people,people
Mandatory,good,average,good,1,22478850,1,,good,5,MATH410,"Very interesting class. Varodayan is a great professor, challenging and helpful. Easy to understand lecture, and midterms are generally not too difficult. He grades very generously and meticulously. Very fair grading system. Lectures are helpful and not boring.",12/09/2013,2,2.0,,5,Really into it,5,5.0,1,No,N/A,1112,N/A,,N/A,,person,person
N/A,good,poor,good,1,22403324,1,,good,5,ECE110,"Very enthusiastic about teaching the material, and easy to understand. He rushes through some of the material though",11/29/2013,1,1.0,,4,It's my life,4.5,4.5,1,Yes,N/A,1112,N/A,,N/A,,person,person
N/A,good,average,average,2,21857623,1,,good,4,ECE110,Good,06/03/2013,3,3.0,,3,Really into it,3.5,3.5,1,Yes,N/A,1112,N/A,,N/A,,person,people
