attendance,clarityColor,easyColor,helpColor,helpCount,id,notHelpCount,onlineClass,quality,rClarity,rClass,rComments,rDate,rEasy,rEasyString,rErrorMsg,rHelpful,rInterest,rOverall,rOverallString,rStatus,rTextBookUse,rWouldTakeAgain,sId,takenForCredit,teacher,teacherGrade,teacherRatingTags,unUsefulGrouping,usefulGrouping
N/A,good,average,good,0,11672000,0,,good,5,ACCY302,"He is pretty awesome but i think he left U of I.  He made what could potentially be a terrible class fun and interesting.  His tests and quizzes are tricky so definitely go to class, pay attention and study.  His quizzes and tests are pretty much cut and pasted portions of CPA exams.",04/07/2006,3,3.0,,5,It's my life,5,5.0,1,N/A,N/A,1112,N/A,,N/A,,people,people
N/A,average,good,average,0,11387117,0,,good,3,ACCY302,His quizes and tests are damn tricky. I got LOTS of stress during the semester. Concentrate on all the small details. it will be on his quizes and tests.,01/19/2006,4,4.0,,4,Sorta interested,3.5,3.5,1,N/A,N/A,1112,N/A,,N/A,,people,people
N/A,good,good,good,0,11134791,0,,good,4,ACCY302,"very fun guy. goes thru good examples in class and is always in a good mood. exams and quizzes are pretty tough and the grading of the case memos really sucks, but the class is curved in the end",12/13/2005,4,4.0,,4,Really into it,4,4.0,1,N/A,N/A,1112,N/A,,N/A,,people,people
N/A,good,average,good,0,10634267,0,,good,5,ACCY302,"He is COOL! However, his test is very tricky (simular to C.P.A test).",10/25/2005,3,3.0,,4,It's my life,4.5,4.5,1,N/A,N/A,1112,N/A,,N/A,,people,people
N/A,good,poor,good,0,1419380,0,,good,5,ACCY302,"No doubt about it, this guy one great teacher, and quite the looker to boot.",12/02/2003,1,1.0,,5,N/A,5,5.0,1,N/A,N/A,1112,N/A,,N/A,,people,people
N/A,good,poor,good,0,1419365,0,,good,5,ACCY302,"Girls, it's too bad he's off the market now....but his class is great anyway!  And you still get to stare at him all day, even if you can't take him home.  I've never learned so much in an accounting class!",12/02/2003,1,1.0,,5,N/A,5,5.0,1,N/A,N/A,1112,N/A,,N/A,,people,people
