attendance,clarityColor,easyColor,helpColor,helpCount,id,notHelpCount,onlineClass,quality,rClarity,rClass,rComments,rDate,rEasy,rEasyString,rErrorMsg,rHelpful,rInterest,rOverall,rOverallString,rStatus,rTextBookUse,rWouldTakeAgain,sId,takenForCredit,teacher,teacherGrade,teacherRatingTags,unUsefulGrouping,usefulGrouping
N/A,good,average,good,0,13446851,0,,good,5,HDFS105,He was an amazing professor. Always made sure we understood everything totally. Was more than willing to answer any questions. Gave 'exam freebies' on low attendance days as a bonus for showing up.,08/30/2007,2,2.0,,5,It's my life,5,5.0,1,Yes,N/A,1112,N/A,,N/A,,people,people
N/A,good,average,good,0,12571975,0,,good,5,HDFS105,He's EXTREMLY helpful and is very good with answering questions and explaing concepts.  He also helps with things outside of the classroom!,12/11/2006,2,2.0,,5,It's my life,5,5.0,1,Yes,N/A,1112,N/A,,N/A,,people,people
N/A,good,poor,good,0,12513777,0,,good,5,HDFS105,He rocks!,12/04/2006,1,1.0,,5,It's my life,5,5.0,1,No,N/A,1112,N/A,,N/A,,people,people
N/A,good,poor,good,0,11347202,0,,good,4,HDFS105,"really easy class, and he makes it fun. review sheets are different from tests even though he says they are similar.",01/11/2006,1,1.0,,4,It's my life,4,4.0,1,N/A,N/A,1112,N/A,,N/A,,people,people
N/A,good,poor,good,0,11165956,0,,good,4,HDFS105,"No big problems.  Boring subject, but he made it decent.",12/15/2005,1,1.0,,5,Low,4.5,4.5,1,N/A,N/A,1112,N/A,,N/A,,people,people
N/A,good,poor,good,0,10984901,0,,good,5,HDFS105,Easy class.  Easy exams.  Easy A.,11/25/2005,1,1.0,,5,Meh,5,5.0,1,N/A,N/A,1112,N/A,,N/A,,people,people
