attendance,clarityColor,easyColor,helpColor,helpCount,id,notHelpCount,onlineClass,quality,rClarity,rClass,rComments,rDate,rEasy,rEasyString,rErrorMsg,rHelpful,rInterest,rOverall,rOverallString,rStatus,rTextBookUse,rWouldTakeAgain,sId,takenForCredit,teacher,teacherGrade,teacherRatingTags,unUsefulGrouping,usefulGrouping
N/A,good,average,good,0,18252887,0,,good,5,MATH220,She was there when I needed her. Friendly and motivating.,03/06/2011,3,3.0,,5,Really into it,5,5.0,3,Yes,N/A,1112,N/A,,N/A,,people,people
N/A,good,average,good,0,15345719,0,,good,5,MATH285,I took this class online with her and found the help to be outstanding. The course was very well organized. Highly recommend.,01/09/2009,3,3.0,,5,It's my life,5,5.0,1,Yes,N/A,1112,N/A,,N/A,,people,people
N/A,poor,good,poor,0,14542261,0,,poor,1,MATH231,Useless. Didn't even know she was my instructor until the end of the class. Absolutley worthless. Never even gave me the test after the work was submitted. Did not answer questions posted on the discussion board. Do not take this class. It is based on a program call Mathematica. Will not help you understand the program.,05/31/2008,5,5.0,,1,Really into it,1,1.0,1,No,N/A,1112,N/A,,N/A,,people,people
N/A,good,average,good,0,10913045,0,,good,5,MATH242,I like the format of the class.,11/15/2005,3,3.0,,5,It's my life,5,5.0,1,N/A,N/A,1112,N/A,,N/A,,people,people
N/A,good,average,good,0,3790104,0,,good,5,MATH230,Great class. Teacher is very helpful,05/05/2005,2,2.0,,5,It's my life,5,5.0,1,N/A,N/A,1112,N/A,,N/A,,people,people
N/A,average,poor,average,0,2980045,0,,poor,3,MATH220CM,"The class is pointless. This professor's presence is absolutely unjustified. TAs do nothing. Do NOT take this class, take normal Math220 instead. You WILL waste your time, and learn nothing after five months.",12/10/2004,1,1.0,,1,It's my life,2,2.0,1,N/A,N/A,1112,N/A,,N/A,,people,people
