attendance,clarityColor,easyColor,helpColor,helpCount,id,notHelpCount,onlineClass,quality,rClarity,rClass,rComments,rDate,rEasy,rEasyString,rErrorMsg,rHelpful,rInterest,rOverall,rOverallString,rStatus,rTextBookUse,rWouldTakeAgain,sId,takenForCredit,teacher,teacherGrade,teacherRatingTags,unUsefulGrouping,usefulGrouping
N/A,good,average,good,0,21533201,0,,good,4,MATH225,"He started off being kind of bad at teaching, but he always strives to improve himself and let me say, he is a much better teacher than he was at the beginning of the semester. He's REALLY nice and he cares about his students a lot. Very reasonable person!",04/14/2013,2,2.0,,5,Really into it,4.5,4.5,1,No,N/A,1112,N/A,,N/A,,people,people
N/A,average,average,average,0,21517332,0,,good,3,MATH225,"Desmond tries really hard to get the concepts across to us, and he even has some pretty good jokes.  Matrix Theory can be pretty counterintuitive, but he tries his best to simplify it and does a good job.  Very laid back and VERY easily approachable. Easy class overall and fair exams (basically like the HW problems he assigns which aren't too bad)",04/11/2013,2,2.0,,4,Really into it,3.5,3.5,1,Yes,N/A,1112,N/A,,N/A,,people,people
N/A,good,poor,good,0,21464260,0,,good,4,MATH225,"The most laid back professor you'll meet. He's entertaining, willing to help and an overall joy to learn from. Class feels like a break more than a lecture",03/29/2013,1,1.0,,5,Sorta interested,4.5,4.5,1,No,N/A,1112,N/A,,N/A,,people,people
N/A,good,average,good,0,20799641,0,,good,5,MATH241,Desmond is a good teacher. He made Calc 3 very enjoyable as well.,11/08/2012,2,2.0,,5,Really into it,5,5.0,1,No,N/A,1112,N/A,,N/A,,people,people
N/A,good,average,good,0,20799633,0,,good,5,MATH241,"Desmond is very solid TA, he is really helpful in explaining problems I have and is a pretty nice guy if you ever talk to him. He grades very reasonable and is very straight forward about what will be on his test and gives good study guides.",11/08/2012,2,2.0,,5,Sorta interested,5,5.0,1,No,N/A,1112,N/A,,N/A,,people,people
N/A,good,poor,good,0,20698270,0,,good,5,MATH241,"Best professor/TA I've ever had!! (Mathematica section taught by lead TA and other random ta's). He gave us study guides, held review sessions, and had no problem helping with coding problems in class! He is also super nice and sweet. Made calc 3 enjoyable!",10/13/2012,1,1.0,,5,It's my life,5,5.0,1,Yes,N/A,1112,N/A,,N/A,,people,people
