attendance,clarityColor,easyColor,helpColor,helpCount,id,notHelpCount,onlineClass,quality,rClarity,rClass,rComments,rDate,rEasy,rEasyString,rErrorMsg,rHelpful,rInterest,rOverall,rOverallString,rStatus,rTextBookUse,rWouldTakeAgain,sId,takenForCredit,teacher,teacherGrade,teacherRatingTags,unUsefulGrouping,usefulGrouping
N/A,average,good,average,0,11419464,0,,average,2,PS201,I don't know how Prof. Pinderhughes managed to take such an interesting topic and make it mindnumbingly boring. I have never had a class where the professor tried to trick her students to such an extreme measure while taking a test. Great ta's though.,01/26/2006,4,4.0,,3,It's my life,2.5,2.5,1,N/A,N/A,1112,N/A,,N/A,,people,people
N/A,poor,good,poor,0,11367647,0,,poor,1,PS201,"Extremely hard class, unnecessarily hard.  Tests extremely hard, and yes, very ambiguous.  Course packet is enormous.  So many readings during the semester.  Not worth the time, take another class.",01/15/2006,4,4.0,,1,It's my life,1,1.0,1,N/A,N/A,1112,N/A,,N/A,,people,people
N/A,average,average,average,0,11112723,0,,poor,2,PS201,"Not very many topics covered, I thought it was going to be much more interesting.  I agree with others that test questions were ambiguous but she was not open to different interpretations or discussion.  Overall the class was extremely boring and not worth the time.  Pick another gen. ed if you can.",12/10/2005,3,3.0,,2,It's my life,2,2.0,1,N/A,N/A,1112,N/A,,N/A,,people,people
N/A,average,good,average,0,10566862,0,,poor,2,PSLLSAFRO201,"Just took her first exam of the semester, and it was unbelievably hard.  The mean of the first portion of the exam (mult. choice and T/F) was a D.  Refuses to change questions that are ambiguous.  A lot of reading (300 pages through first half of semester ONLY).",10/08/2005,4,4.0,,2,Really into it,2,2.0,1,N/A,N/A,1112,N/A,,N/A,,people,people
N/A,poor,good,poor,0,3698619,0,,poor,1,PSAFROLLS201,RUN.,04/24/2005,5,5.0,,1,It's my life,1,1.0,1,N/A,N/A,1112,N/A,,N/A,,people,people
N/A,poor,average,poor,0,3146210,0,,poor,1,PS201,No Comments,01/03/2005,3,3.0,,1,Sorta interested,1,1.0,1,N/A,N/A,1112,N/A,,N/A,,people,people
N/A,poor,good,poor,0,3121999,0,,poor,1,PSAFROLLS201,"Worst class ever.  Period.  HUGE coursepacket & book to read.  Exam questions came out of nowhere.  Ambiguously worded, still couldn't get them right even after reading.  Lectures always behind, yet discussion section continued on at scheduled pace.  No organization.",12/28/2004,5,5.0,,2,Really into it,1.5,1.5,1,N/A,N/A,1112,N/A,,N/A,,people,people
N/A,poor,good,poor,0,3107636,0,,poor,1,PS201,"Unclear, assigns long assignments.  Tests require an intimate knowledge of minute 500+ pages of reading for ambiguous questions.  Doesn't go over material in discussion.  Lectures fell behind by at least 5 days.  NOne of the material in lecture was on the test.",12/23/2004,5,5.0,,2,Meh,1.5,1.5,1,N/A,N/A,1112,N/A,,N/A,,people,people
N/A,poor,good,poor,0,2756700,0,,poor,1,POLISCI201,"the worst professor, espiecally for a freshman. disorganized and boring!",11/16/2004,4,4.0,,1,It's my life,1,1.0,1,N/A,N/A,1112,N/A,,N/A,,people,people
