attendance,clarityColor,easyColor,helpColor,helpCount,id,notHelpCount,onlineClass,quality,rClarity,rClass,rComments,rDate,rEasy,rEasyString,rErrorMsg,rHelpful,rInterest,rOverall,rOverallString,rStatus,rTextBookUse,rWouldTakeAgain,sId,takenForCredit,teacher,teacherGrade,teacherRatingTags,unUsefulGrouping,usefulGrouping
N/A,good,average,good,0,14857087,0,,good,4,KINES247,"If you go to class, takes notes and listen you will have no problem passing this class.  Professor McAuley is fun, loves talking about sports and don't be late to his class or you'll get embarrassed in front of the whole class.",10/08/2008,2,2.0,,5,Really into it,4.5,4.5,1,No,N/A,1112,N/A,,N/A,,people,people
N/A,good,average,good,0,13809352,0,,good,4,KIN247,"Dr. McAuley is hilarious!  His stupid jokes actually make you want to come to class!  If you want to do well on the short-answer exams, you have to memorize his definitions verbatim.  The class isn't that bad.  It's actually pretty fun.",12/12/2007,2,2.0,,4,Really into it,4,4.0,1,No,N/A,1112,N/A,,N/A,,people,people
N/A,good,average,average,0,12513576,0,,good,4,KIN247,Fun guy. Interacts with his students and actually remembers names from people in lecture. Didn't like that he teaches right off powerpoint.,12/04/2006,2,2.0,,3,Really into it,3.5,3.5,1,No,N/A,1112,N/A,,N/A,,people,people
N/A,good,average,good,0,12309980,0,,good,5,KIN247,"awesome prof.  great sense of humor and often calls people out in class.  you have to go to every class, he doesn't post his notes online, but classes are very interesting and his teaching style is really easy to learn from.  don't bother buying the text book, you're supposed to read it but nothing is on the exams that he doesn't cover in class",10/24/2006,3,3.0,,5,Really into it,5,5.0,1,No,N/A,1112,N/A,,N/A,,people,people
N/A,average,good,average,0,12224007,0,,average,3,KINES247,"Great professor. Very british sense of humor and speaks with a touch of an british accent. Class is pretty challenging with all short answer essay exams, no multiple choice exams. He makes the lecture material interesting however.",09/10/2006,4,4.0,,3,Sorta interested,3,3.0,1,No,N/A,1112,N/A,,N/A,,people,people
