attendance,clarityColor,easyColor,helpColor,helpCount,id,notHelpCount,onlineClass,quality,rClarity,rClass,rComments,rDate,rEasy,rEasyString,rErrorMsg,rHelpful,rInterest,rOverall,rOverallString,rStatus,rTextBookUse,rWouldTakeAgain,sId,takenForCredit,teacher,teacherGrade,teacherRatingTags,unUsefulGrouping,usefulGrouping
N/A,good,average,good,0,18844199,0,,good,5,CMN101,"Prof Chupp graded a fairly hard in the beginning of the course, but it was to push us to be better. I got an A, and had to work at it. Overall,she was an excellent prof and she will make you a better public speaker.",07/23/2011,3,3.0,,5,Sorta interested,5,5.0,1,Yes,N/A,1112,N/A,,N/A,,people,people
N/A,good,good,good,0,18177216,0,,good,5,CMN111,"Elizabeth was a great professor. I took a ton out the class. I don't think elizabeth grades hard, in fact more generous than I anticipated. She lets you know exactly what she wants, if you follow her guidelines exactly you will succeed. Print everything she uploads, she puts it up for a reason! Highly recommend her, my skills increased dramatically",01/24/2011,4,4.0,,5,It's my life,5,5.0,1,Yes,N/A,1112,N/A,,N/A,,people,people
N/A,good,average,good,0,17859255,0,,good,5,CNM111,"Great profesor, very clear, simi-hard grading scale.",12/04/2010,2,2.0,,4,Really into it,4.5,4.5,1,Yes,N/A,1112,N/A,,N/A,,people,people
N/A,good,average,good,0,17794153,0,,good,4,CMN111,"she is a very good teacher and is pretty clear about what she wants. However, she grades kind of hard. Take this class with her, but be aware of the fact that this class will not be provide an &quot;easy A&quot;",11/19/2010,3,3.0,,5,Sorta interested,4.5,4.5,1,No,N/A,1112,N/A,,N/A,,people,people
N/A,good,average,good,0,17329866,0,,good,5,CMN101,"Mrs. Chupp was an awesome teacher. If you have the opportunity to take the class with her, do it! She is very clear with what she wants and how she grades the speeches. She has a great level of interest in the class herself so it will keep you into it. My favorite teacher of my freshman year.",06/13/2010,2,2.0,,5,Sorta interested,5,5.0,1,No,N/A,1112,N/A,,N/A,,people,people
