attendance,clarityColor,easyColor,helpColor,helpCount,id,notHelpCount,onlineClass,quality,rClarity,rClass,rComments,rDate,rEasy,rEasyString,rErrorMsg,rHelpful,rInterest,rOverall,rOverallString,rStatus,rTextBookUse,rWouldTakeAgain,sId,takenForCredit,teacher,teacherGrade,teacherRatingTags,unUsefulGrouping,usefulGrouping
N/A,good,average,good,0,14581771,0,,good,5,ATMS120,"This course wasn't as easy as I had anticipated. It requires a fair amount of reading as well as work. The material is pretty compact and the exams require a good amount of studying. However, Snodgrass is a very good instructor and tries to make his class exciting. His lectures can sometimes get a little boring; most of the time he makes class fun.",06/13/2008,3,3.0,,5,Sorta interested,5,5.0,1,Yes,N/A,1112,N/A,,N/A,,people,people
N/A,good,poor,good,0,14389849,0,,good,4,ATMS120,"Prof. Snodgrass made ATMS 120 one of those classes you actually enjoy going to. He is very excited to teach, which is sometimes unusual to see out of professors. He had to rush through some material, but made things that were normally above my head understandable. Homework and quizzes were pretty easy as long as you do the reading Buy the book.",05/02/2008,1,1.0,,5,Sorta interested,4.5,4.5,1,Yes,N/A,1112,N/A,,N/A,,people,people
N/A,good,average,good,0,14373727,0,,good,5,ATMOS120,Snodgrass is the best Professor that I yet. He keep you interested in the material. He seemed to be very interested in the material. The test as long as you went to class the tests were pretty easy.,04/30/2008,3,3.0,,4,It's my life,4.5,4.5,1,Yes,N/A,1112,N/A,,N/A,,people,people
N/A,good,good,good,0,14220675,0,,good,5,ATMS120,"Great professor, but talks extremely quickly through material.  Very interested in material and wants students to do well.  Offers a lot of extra help.  Difficult exams, but will help you if you are struggling",03/31/2008,4,4.0,,5,Meh,5,5.0,1,Yes,N/A,1112,N/A,,N/A,,people,people
N/A,good,average,good,0,14213250,0,,good,5,ATMS120,"The class is easy and interesting, especially with Snodgrass teaching it. He's super funny, smart, interesting, and cute. Too bad he's married haha. I'm going to miss him.",03/28/2008,2,2.0,,5,Sorta interested,5,5.0,1,No,N/A,1112,N/A,,N/A,,people,people
N/A,good,average,good,0,14016772,0,,good,5,ATMS120,"Snoddy is a very effective teacher as well as a very funny, likable guy.  He is very approachable and his notes are clear.  He's also a hottie.",01/17/2008,3,3.0,,5,It's my life,5,5.0,1,Yes,N/A,1112,N/A,,N/A,,people,people
N/A,good,poor,good,0,13996972,0,,good,5,ATMS120,"Very fun and very interesting class.  Snodgrass is captivating and very enthusiastic about his subject.  You'll forget about the time.  Be sure to always go to lecture, because your attendance will add points to your grade, and you'll need his notes for the exams.",01/14/2008,1,1.0,,5,It's my life,5,5.0,1,No,N/A,1112,N/A,,N/A,,people,people
N/A,good,average,good,0,13969101,0,,good,5,ATMS120,"Excellent professor, very enthusiastic.  TAKE THIS CLASS!",01/09/2008,2,2.0,,5,Really into it,5,5.0,1,Yes,N/A,1112,N/A,,N/A,,people,people
N/A,good,poor,good,0,13942179,0,,good,5,ATMS120,"About 45% of your grade is based on easy assignments.  Eric was super enthusiastic and tried to make lecture fun, even though I still managed to sleep through half of it.  Don't blow off exams, but overall it's an easy A if you pay attention and take notes w/ the powerpoints.  And I agree, he's definitely a cutie.",01/03/2008,1,1.0,,5,Low,5,5.0,1,Yes,N/A,1112,N/A,,N/A,,people,people
N/A,good,average,good,0,13907569,0,,good,4,ATMS120,"Professor Eric was a great teacher. He was so enthusiastic about this subject and as a result, I also really liked learning about this subject that I did not have much interest or knowledge in before.  He also really wants to have students do well.  He gives so many office hours and offered chances for students to raise their grades in a fair way.",12/25/2007,3,3.0,,5,Really into it,4.5,4.5,1,Yes,N/A,1112,N/A,,N/A,,people,people
N/A,good,average,good,0,13889054,0,,good,5,ATMS120,"Professor Snodgrass is a little cutie. He is seriously the nicest guy and best teacher. He explains everything very clearly and has a lot of enthusiasm teaching everything. All of his notes are online, but he gives you points for coming to class which are quite helpful because they do add up and help your grade in the end.",12/21/2007,2,2.0,,5,Really into it,5,5.0,1,No,N/A,1112,N/A,,N/A,,people,people
N/A,good,average,good,0,13828499,0,,good,5,ATMOS120,"Really good professor! Class was not mandatory, but points were given for in class worksheets (easy though). He is very energetic and enjoys teaching, which makes the class even better. He is a really nice guy and very helpful.",12/13/2007,2,2.0,,5,Meh,5,5.0,1,Yes,N/A,1112,N/A,,N/A,,people,people
N/A,good,average,good,0,13786414,0,,good,4,ATMS120,"Eric is soo funny, loves to show Youtube videos even if they are goofy weather videos.  Very sincere, very helpful in anyway he can be.  Grading is pretty nice, he gives some extra credit and makes life seem pretty relaxing!! I definitely recommend him! He's fun and I'm going to miss that class!!",12/10/2007,2,2.0,,5,Low,4.5,4.5,1,Yes,N/A,1112,N/A,,N/A,,people,people
N/A,good,average,good,0,13710941,0,,good,4,ATMOS120,"He's hot, funny and very excited about weather. There is a bit of challenge problems, online quizzes and ALE's, but the discussion boards are a great help. Though he speeds through lecture slides, the class is very laid back. All in all Snodgrass doesn't care about how much he challenges you, he just wants you to be as excited about the subject as",11/28/2007,2,2.0,,4,Low,4,4.0,1,No,N/A,1112,N/A,,N/A,,people,people
N/A,good,poor,good,0,13645486,0,,good,4,ATMS120,"Eric is a very enthusiastic teacher. He is also very helpful on the class discussion board, and he will curve the tests if there are not enough A's. You should be able to get an A in here if you are at class (lots of attendance points are available) and do a little studying. Not much reading is involved (10-20 pages per week).",11/13/2007,1,1.0,,5,Sorta interested,4.5,4.5,1,Yes,N/A,1112,N/A,,N/A,,people,people
N/A,good,poor,good,0,13621978,0,,good,4,ATMOS120,"He is very enthusiastic about what he is teaching and genuinely wants his students to be enthusiastic about it too. Very easy if you go to class, pay attention, and study for tests.",11/08/2007,1,1.0,,5,Sorta interested,4.5,4.5,1,Yes,N/A,1112,N/A,,N/A,,people,people
N/A,good,average,good,0,13616271,0,,good,5,ATMS120,"Great Great Great professor. Enthusiastic, and makes long lectures seem short. Really nice guy too.",11/07/2007,2,2.0,,5,Sorta interested,5,5.0,1,No,N/A,1112,N/A,,N/A,,people,people
N/A,good,average,good,0,13608262,0,,good,5,ATMS120,He makes things so easy,11/06/2007,3,3.0,,5,Really into it,5,5.0,1,Yes,N/A,1112,N/A,,N/A,,people,people
N/A,average,average,average,0,13607464,0,,good,3,ATMS120,Eric's a pretty cool teacher and he explains things well.  It's a good Gen Ed to take.,11/06/2007,3,3.0,,4,Really into it,3.5,3.5,1,Yes,N/A,1112,N/A,,N/A,,people,people
N/A,good,poor,good,0,13313857,0,,good,5,ATMSC,"Great class, very easy and the information is fun.  Eric is able to present it in a very fun and interesting way and you can tell he loves teaching the class.  Easy A.",07/06/2007,1,1.0,,5,Really into it,5,5.0,1,Yes,N/A,1112,N/A,,N/A,,people,people
