attendance,clarityColor,easyColor,helpColor,helpCount,id,notHelpCount,onlineClass,quality,rClarity,rClass,rComments,rDate,rEasy,rEasyString,rErrorMsg,rHelpful,rInterest,rOverall,rOverallString,rStatus,rTextBookUse,rWouldTakeAgain,sId,takenForCredit,teacher,teacherGrade,teacherRatingTags,unUsefulGrouping,usefulGrouping
N/A,good,average,good,0,15860005,0,,good,4,PSYCH100,amazing / fun class!,05/18/2009,3,3.0,,5,Really into it,4.5,4.5,1,Yes,N/A,1112,N/A,,N/A,,people,people
N/A,good,average,good,0,15534404,0,,good,5,PSYCH100,"He is AMAZING! He breaks everything down and is always willing to help. Even though I had the class at 8 am, it was my favorite class because of how interesting he made it! He shows you-tube videos all throughout class! PICK HIM!!!!",03/15/2009,3,3.0,,5,Low,5,5.0,1,Yes,N/A,1112,N/A,,N/A,,people,people
N/A,good,average,good,0,15395099,0,,good,5,PSYCH100,"The only downfall of this class was that i had it at 8am.. He has great energy, good stories and really cares. Read and study for quizzes, GO TO CLASS even if early!",01/20/2009,3,3.0,,4,Really into it,4.5,4.5,1,Yes,N/A,1112,N/A,,N/A,,people,people
N/A,good,good,good,0,15142235,0,,good,5,PSYCH100,Pick him! You won't regret!!,12/09/2008,4,4.0,,5,It's my life,5,5.0,1,Yes,N/A,1112,N/A,,N/A,,people,people
N/A,good,average,good,0,15140524,0,,good,4,PSYCH100,Very nice and interested in students. A very fun/memorable class.,12/09/2008,3,3.0,,5,Really into it,4.5,4.5,1,Yes,N/A,1112,N/A,,N/A,,people,people
N/A,good,average,good,0,14937480,0,,good,5,PSYCH100,Very interesting and friendly,11/04/2008,3,3.0,,5,Really into it,5,5.0,1,No,N/A,1112,N/A,,N/A,,people,people
N/A,good,good,good,0,13702502,0,,good,5,PSYC100,No Comments,11/26/2007,4,4.0,,5,Really into it,5,5.0,1,Yes,N/A,1112,N/A,,N/A,,people,people
N/A,good,good,good,0,13656582,0,,good,4,PSYCH100,No Comments,11/14/2007,4,4.0,,5,Low,4.5,4.5,1,No,N/A,1112,N/A,,N/A,,people,people
