attendance,clarityColor,easyColor,helpColor,helpCount,id,notHelpCount,onlineClass,quality,rClarity,rClass,rComments,rDate,rEasy,rEasyString,rErrorMsg,rHelpful,rInterest,rOverall,rOverallString,rStatus,rTextBookUse,rWouldTakeAgain,sId,takenForCredit,teacher,teacherGrade,teacherRatingTags,unUsefulGrouping,usefulGrouping
N/A,good,average,good,0,25842782,0,,good,4,CEE406,"The homeworks for this class are very difficult, so try to find a partner. The material is super boring, but pay attention because you WILL be asked about small details. Also a PC laptop is required for the class to do the HWs. Macs will not work. The tests are not long, but study every detail because that's what half the questions are.",12/29/2015,3,3.0,,4,Meh,4,4.0,1,Yes,N/A,1112,Yes,,B+,,people,people
Not Mandatory,poor,average,poor,0,25073065,0,,poor,1,CEE310,"Hard to understand. Super boring. Didn't learn anything. And if the test is open book, forget about it, super hard. ",07/28/2015,3,3.0,,1,Meh,1,1.0,1,Yes,N/A,1112,Yes,,N/A,,people,people
Not Mandatory,good,average,good,0,23195669,0,,good,4,CEE598,Above Average,05/08/2014,2,2.0,,5,Really into it,4.5,4.5,1,Yes,N/A,1112,N/A,,A+,,people,people
N/A,good,average,average,0,22262668,0,,good,4,CEE310,He is not bad. He knows what he is talking about. I do not know why everyone hates him so much. Give him a break. Any professor would seem bad after you have had Dan Work for the first half of the class.,11/05/2013,3,3.0,,3,Sorta interested,3.5,3.5,1,Yes,N/A,1112,N/A,,N/A,,people,people
N/A,average,average,average,0,21159989,0,,average,3,CEE310,"Lectures are pretty boring; just reads off ppt slides, throws in a few anecdotes. The lecture slides could have been more useful in doing the homework. Exams were a bit long, but open book open note. Overall good class.",12/23/2012,3,3.0,,3,Sorta interested,3,3.0,1,Yes,N/A,1112,N/A,,N/A,,people,people
N/A,good,average,good,0,17888264,0,,good,4,CEE310,"He was fine; not great but not terrible.  Basically just reads off the powerpoint slides, but he def knows what he's talking about.  I dunno why everyone says he keeps them late; we got let out on time every single day.",12/08/2010,2,2.0,,4,Really into it,4,4.0,1,No,N/A,1112,N/A,,N/A,,people,people
N/A,average,poor,poor,0,17451694,0,,poor,2,CEE310,"Unbelievable... He is the only prof. I've ever had that runs class past the bell every single lecture.  He is totally unapologetic about it too.  In fact, he gets angry when people leave a minute or two after the bell.  His exams are easy and the homework is easy (when it isn't so blurry from being copied so many times that you can't read it.)",07/26/2010,1,1.0,,1,Really into it,1.5,1.5,1,No,N/A,1112,N/A,,N/A,,people,people
N/A,poor,poor,poor,0,17087609,0,,poor,1,CEE310,Awful.  Lets class out late every single lecture.  Every. single. time.  Then he whines when people try to leave at the bell.,04/29/2010,1,1.0,,1,Really into it,1,1.0,1,No,N/A,1112,N/A,,N/A,,people,people
N/A,average,average,poor,0,16465819,0,,poor,2,CEE310,"He runs over every single lecture then he complains when people want to leave.  He has made me late for an exam because he started yelling at me when I tried to leave 2 minutes after the bell.  He knows what he's talking about, but he is very very boring and he doesn't work for the student at all.  The homeworks he assigns are unreadable.",12/03/2009,2,2.0,,1,Really into it,1.5,1.5,1,No,N/A,1112,N/A,,N/A,,people,people
