attendance,clarityColor,easyColor,helpColor,helpCount,id,notHelpCount,onlineClass,quality,rClarity,rClass,rComments,rDate,rEasy,rEasyString,rErrorMsg,rHelpful,rInterest,rOverall,rOverallString,rStatus,rTextBookUse,rWouldTakeAgain,sId,takenForCredit,teacher,teacherGrade,teacherRatingTags,unUsefulGrouping,usefulGrouping
N/A,good,good,good,0,12267505,0,,good,5,PS347,An incredibley intelligent man. Can be crass and a bit biased at times. A wonderful lecturer. THE authority on modern Middle East politics here at the U of I.,10/05/2006,4,4.0,,4,Really into it,4.5,4.5,1,Yes,N/A,1112,N/A,,N/A,,people,people
N/A,average,average,average,0,11727562,0,,average,2,PS220,"He is a terrific lecturer, very engaging. However, his grading came out of nowhere and that could be good or bad depending on the amount of sucking up you do.",04/19/2006,3,3.0,,4,It's my life,3,3.0,1,N/A,N/A,1112,N/A,,N/A,,people,people
N/A,good,average,good,0,11227286,0,,good,4,PS347,"Malekafzali is a good guy, however his teaching style is biased. Expect US bashing.  He has admitted himself that he has trouble separating his Iranian views from his Doctoral view.  Yet, his biased slant might be good since it shows the other side which American media doesn't present.  Lastly, his map quizzes are harder than they should be.",12/20/2005,3,3.0,,4,Sorta interested,4,4.0,1,N/A,N/A,1112,N/A,,N/A,,people,people
N/A,good,good,good,0,10897116,0,,good,4,PS304,"He is really nice and interesting, in my opinion. His exams are not difficult if you go to class. Just make sure to do the readings!! PS 304 is probably the easiest 300 level poly sci, TAKE IT!",11/14/2005,4,4.0,,4,Really into it,4,4.0,1,N/A,N/A,1112,N/A,,N/A,,people,people
N/A,good,average,good,0,10884298,0,,good,4,PS347,"He knows what he's talking about when it comes to this class. You can't go to sleep, but you'll be glad you didn't. He has a lot of insight into the subject matter.",11/11/2005,3,3.0,,5,It's my life,4.5,4.5,1,N/A,N/A,1112,N/A,,N/A,,people,people
N/A,good,good,average,0,10632683,0,,good,4,PS220,"This class has an unnecessary amount of effort associated with it...the reading isn't too bad, but you HAVE to go to every lecture and take damn good notes...b/c you'll be screwed on the exams otherwise.  he's too picky when it comes to exams (he'll ask REALLY specific questions)  overall, if you can take the class w/ someone else...do it :(",10/24/2005,4,4.0,,3,Sorta interested,3.5,3.5,1,N/A,N/A,1112,N/A,,N/A,,people,people
N/A,poor,average,poor,0,10591626,0,,poor,1,PS220,"Just don't take the class. You won't learn anything.  This professor is extremely eccentric, irritating, and he wouldn't last a day if he actually worked in government, outside of academia.",10/15/2005,3,3.0,,1,It's my life,1,1.0,1,N/A,N/A,1112,N/A,,N/A,,people,people
