attendance,clarityColor,easyColor,helpColor,helpCount,id,notHelpCount,onlineClass,quality,rClarity,rClass,rComments,rDate,rEasy,rEasyString,rErrorMsg,rHelpful,rInterest,rOverall,rOverallString,rStatus,rTextBookUse,rWouldTakeAgain,sId,takenForCredit,teacher,teacherGrade,teacherRatingTags,unUsefulGrouping,usefulGrouping
N/A,poor,average,poor,0,18857342,0,,poor,1,CMN111,"I really didn't like his class. He tells a lot of jokes, sure, but sometimes it made it hard to take him seriously. He is kind of immature to be teaching undergads in my opinion.",07/27/2011,2,2.0,,1,It's my life,1,1.0,1,No,N/A,1112,N/A,,N/A,,people,people
N/A,good,average,good,0,17642365,0,,good,4,CMN112,"Francis is the man! He made a miserable class fun and entertaining...even at 8 in the morning. He loves playing the devil's advocate with everyone, but it makes for good debates. I would definitely recommend him.",10/09/2010,2,2.0,,5,Meh,4.5,4.5,1,No,N/A,1112,N/A,,N/A,,people,people
N/A,good,poor,good,0,16458038,0,,good,5,CMN111,This guy is hilarious. He makes tons of jokes and keeps the class entertaining. I haven't opened the book yet and I have an A. I recommend everyone to take him.,12/02/2009,1,1.0,,5,It's my life,5,5.0,1,No,N/A,1112,N/A,,N/A,,people,people
N/A,good,average,good,0,16338570,0,,good,4,CMN112,"Francis is such a jolly guy, he always has jokes to tell the class. He's nice however he sticks to the syllabus and rules. He's a fair grader, but he is not easily persuaded. Just make sure you give good speeches and topics and follow what he says. Got an A!",11/09/2009,3,3.0,,4,Sorta interested,4,4.0,1,Yes,N/A,1112,N/A,,N/A,,people,people
N/A,good,average,good,0,15197829,0,,good,5,SPCM111,"He was an awesome teacher! Really knows what he is talking about, grades fairly, and always offers help. He is really funny and as long as you do the work, its a pretty easy class and he makes it fun. Highly recommend this teacher.",12/15/2008,2,2.0,,5,Sorta interested,5,5.0,1,No,N/A,1112,N/A,,N/A,,people,people
