attendance,clarityColor,easyColor,helpColor,helpCount,id,notHelpCount,onlineClass,quality,rClarity,rClass,rComments,rDate,rEasy,rEasyString,rErrorMsg,rHelpful,rInterest,rOverall,rOverallString,rStatus,rTextBookUse,rWouldTakeAgain,sId,takenForCredit,teacher,teacherGrade,teacherRatingTags,unUsefulGrouping,usefulGrouping
N/A,poor,good,poor,10,23220944,0,,poor,1,MATH231,"She's horrible. GET OUT NOW! She refuses to curve anything even when the average grade if failing, and then she blames it on all her students that it's their fault their grades are so bad. She never says what's going to be on a test. She gives practice problems that she says may not have to do with anything on the test. so unfriendly",05/11/2014,5,5.0,,1,Low,1,1.0,1,Yes,N/A,1112,N/A,,N/A,,people,people
Mandatory,good,poor,good,0,23149191,10,,good,5,MATH231,nice professor,05/02/2014,1,1.0,,5,It's my life,5,5.0,3,Yes,N/A,1112,N/A,,B+,,people,people
Not Mandatory,poor,good,poor,6,23147385,0,,poor,1,MATH231,"Her teaching methods are terrible. Some exam problems never appear on worksheets/homework. PatrickJMT on YouTube is your hero if you get stuck with her. But then again, math 231 is hard with most of the professors at uiuc.",05/02/2014,4,4.0,,1,Meh,1,1.0,1,Yes,N/A,1112,N/A,,N/A,,people,people
Not Mandatory,poor,good,poor,4,23142366,0,,poor,1,MATH231,"Difficult to follow, exams are very difficult. Avoid. If you do somehow unfortunately get her, be prepared to rely on Youtube and the text very heavily.",05/01/2014,5,5.0,,1,Really into it,1,1.0,1,Yes,N/A,1112,N/A,,N/A,,people,people
Not Mandatory,poor,good,poor,5,23142330,0,,poor,1,MATH231,"Really bad at teaching.. As someone else noted, first few weeks was filled with a lot of attentive students, then slowly people stopped showing up. People either went to a different Math 231 lecturer's class or just gave up entirely. AVOID AT ALL COSTS. If you do get her, be prepared to rely completely on YouTube and the textbook.",05/01/2014,5,5.0,,1,It's my life,1,1.0,1,Yes,N/A,1112,N/A,,N/A,,people,people
N/A,poor,good,poor,5,22779305,0,,poor,1,MATH285,HORRIBLE TEACHER! Very hard to understand and doesn't explain anything well.,01/21/2014,5,5.0,,1,Meh,1,1.0,1,Yes,N/A,1112,N/A,,N/A,,people,people
Not Mandatory,poor,good,poor,4,22509259,0,,poor,1,MATH241,"she's not clear with what she is teaching. The lecture hall was full during the first few weeks. Slowly, nobody goes for class anymore. She spent so much time reviewing things that students already know instead of explaining new and harder topics. Don't choose her for this class!!!!",12/11/2013,5,5.0,,1,Meh,1,1.0,1,Yes,N/A,1112,N/A,,N/A,,people,people
