attendance,clarityColor,easyColor,helpColor,helpCount,id,notHelpCount,onlineClass,quality,rClarity,rClass,rComments,rDate,rEasy,rEasyString,rErrorMsg,rHelpful,rInterest,rOverall,rOverallString,rStatus,rTextBookUse,rWouldTakeAgain,sId,takenForCredit,teacher,teacherGrade,teacherRatingTags,unUsefulGrouping,usefulGrouping
N/A,good,good,good,0,24439832,0,,good,4,CPSY4336W,He's wonderful. Very clear in the lectures and describing material presented. Make sure to write down what he says because test material often contained information he briefly said. The class is designed so you get a B- or a B but if you ask for help he's more than willing.,03/06/2015,4,4.0,,4,Really into it,4,4.0,1,No,N/A,1112,Yes,,N/A,,people,people
N/A,good,average,good,0,19146143,0,,good,4,PSYC326,"Genuinely nice guy. He knows a lot about the material when people ask questions. Very approachable. Exams were more difficult than expected, but all exam material is in his lectures-no need to read the book. One of my favorite professors because he's actually kind and seems like he wants to be in class",11/02/2011,3,3.0,,4,Really into it,4,4.0,1,No,N/A,1112,N/A,,N/A,,people,people
N/A,average,average,average,0,18456575,0,,average,3,PSYC216,"This class was boring. but if you went to class, you got extra credit. the tests were challenging.",04/23/2011,3,3.0,,3,Sorta interested,3,3.0,1,Yes,N/A,1112,N/A,,N/A,,people,people
N/A,average,good,average,0,17861732,0,,average,2,PSYC216,don't like hime.,12/04/2010,5,5.0,,3,Low,2.5,2.5,1,No,N/A,1112,N/A,,N/A,,people,people
N/A,average,good,average,0,16926022,1,,average,3,PSYCH326,"Great speaker, though dull lectures. Attend class for activities. Study even the most seemingly trivial parts of the notes (names of experimenters, not just concepts), try not to daydream in lecture.",03/29/2010,4,4.0,,3,It's my life,3,3.0,1,No,N/A,1112,N/A,,N/A,,person,people
N/A,good,average,good,0,13798024,0,,good,5,PSYCH326,"Great Prof; knows his material; extremely friendly and great speaker; give plenty of extra-credit, but you have to come to class to take advantage of it",12/11/2007,2,2.0,,5,Sorta interested,5,5.0,1,No,N/A,1112,N/A,,N/A,,people,people
N/A,good,average,good,0,11989603,0,,good,5,PSYCHDEVREL,"Great Class, Well Taught",06/09/2006,3,3.0,,4,It's my life,4.5,4.5,1,N/A,N/A,1112,N/A,,N/A,,people,people
N/A,good,good,good,0,11367688,0,,good,5,PSYCH290494,"Get into his relationship lab as a 290 or 494.  It is extremely interesting, and you get advanced credit.  Definitely worth your time/energy.",01/15/2006,4,4.0,,5,It's my life,5,5.0,1,N/A,N/A,1112,N/A,,N/A,,people,people
