attendance,clarityColor,easyColor,helpColor,helpCount,id,notHelpCount,onlineClass,quality,rClarity,rClass,rComments,rDate,rEasy,rEasyString,rErrorMsg,rHelpful,rInterest,rOverall,rOverallString,rStatus,rTextBookUse,rWouldTakeAgain,sId,takenForCredit,teacher,teacherGrade,teacherRatingTags,unUsefulGrouping,usefulGrouping
Mandatory,poor,good,poor,2,24839298,0,,poor,1,MATH444,"Awful. Mean, difficult, unclear, unhelpful. There is no clear flow to the class just theorem after theorem. He makes mistakes and does not make sense while lecturing, then gets mad at the class for not understanding. Avoid.",05/15/2015,5,5.0,,1,Low,1,1.0,1,Yes,N/A,1112,Yes,,N/A,,people,people
N/A,poor,good,poor,0,15364010,0,,poor,1,MATH415,"This is the worst teacher possible. He would often erase everything he had taught for most of a lecture, saying &quot;oh wait this is wrong.&quot; AVOID AT ALL COSTS",01/13/2009,5,5.0,,1,Meh,1,1.0,1,No,N/A,1112,N/A,,N/A,,people,people
N/A,poor,good,poor,0,14945123,0,,poor,1,MATH220,"DOES NOT SPEAK ENGLISH!  Avoid if it all possible - most teachers who don't speak English compensate by making the class rather easy. He compensates by being a MASSIVE JERK.  Often will not answer questions in class; if he does, he berates you for, God forbid, wanting to understand one step before moving on to the next.  Worst teacher I ever had.",11/05/2008,5,5.0,,1,Meh,1,1.0,1,Yes,N/A,1112,N/A,,N/A,,people,people
N/A,poor,good,poor,0,14203612,0,,poor,1,MATH241,DROP THIS CLASS IMMEDIATELY,03/26/2008,5,5.0,,1,Sorta interested,1,1.0,1,Yes,N/A,1112,N/A,,N/A,,people,people
N/A,poor,good,poor,0,14186050,0,,poor,1,MATH241,avoid at all costs,03/20/2008,5,5.0,,1,Low,1,1.0,1,No,N/A,1112,N/A,,N/A,,people,people
N/A,poor,good,poor,0,14004723,1,,poor,1,MATH241,"if you get him- GET OUT!!!! he is probably the worst professor ever... even the math advisors complain about him... my grade dropped an entire letter grade after the final and many people have complained about this same problem... seriosuly, get anotehr professor - if ur stuck- know ur definitions!!!",01/15/2008,4,4.0,,1,Meh,1,1.0,1,Yes,N/A,1112,N/A,,N/A,,person,people
N/A,average,good,average,0,13985574,0,,average,3,MATH241,He should not be teaching any class. He focuses on the conceptual aspects on the Exams even though the HW was all about doing problems. Average on the Final waas 42.5%. Definitions and Theorem are always on the exams. He is very condescending and belittles you when you asked questions in Lecture. So be precise using Math terminology when asking q's,01/12/2008,5,5.0,,2,Meh,2.5,2.5,1,Yes,N/A,1112,N/A,,N/A,,people,people
N/A,average,good,poor,0,13940731,0,,poor,2,MATH241,"Simply the worst teacher. He hates his students and writes sarcastic responses to those who email him for help, advice or questions. He will make mistakes all over the board and then hastily fix them half way through confusing the class. I had an 87 but the final was ridiculous and killed it to a C",01/03/2008,5,5.0,,1,Meh,1.5,1.5,1,No,N/A,1112,N/A,,N/A,,people,people
N/A,average,good,poor,0,13883265,0,,poor,2,MATH241,"Terrible.  Even if you know how to solve problems with calculus 3, you will still probably get a C because his exams are mostly definitions and proofs.  He spends most of his lecture time proving theoroms rather than actually showing you how to solve problems using the theoroms. The average for the final was 43%.  Enough said.",12/20/2007,5,5.0,,1,Sorta interested,1.5,1.5,1,Yes,N/A,1112,N/A,,N/A,,people,people
N/A,average,average,average,0,13818577,0,,average,3,MATH241,He prefers to teach theorems and definitions in lecture and then have TA's show you how to solve actual problems. Go to class and write down all theorems and definitions... memorize them... and you should do well on the tests... at least I did... I got A's on my tests...,12/13/2007,2,2.0,,3,Low,3,3.0,1,Yes,N/A,1112,N/A,,N/A,,people,people
N/A,average,good,poor,0,13816128,0,,poor,2,MATH241,Studying for the first exam we asked the TA what he would do in our place. He responded &quot;I would dorp the class.&quot;,12/12/2007,5,5.0,,1,Meh,1.5,1.5,1,Yes,N/A,1112,N/A,,N/A,,people,people
N/A,poor,good,poor,0,13720881,0,,poor,1,MATH241,"The definition of a bad teacher, drop if at all possible. If you are stuck with him pray that you have a good TA, without them, you will fail. Also, do the homework/read the book.",11/29/2007,5,5.0,,1,Sorta interested,1,1.0,1,Yes,N/A,1112,N/A,,N/A,,people,people
N/A,poor,good,poor,0,13688717,0,,poor,1,MATH241,Horrible teacher. Tests have very little to do with the material that has been taught. It's easier learning from the book.  Basically... avoid him at all costs.,11/21/2007,5,5.0,,1,Really into it,1,1.0,1,Yes,N/A,1112,N/A,,N/A,,people,people
N/A,poor,good,poor,0,13663223,0,,poor,1,MATH241,"HORRIBLE teacher! just try to AVOID him! his exam is 50% theorem and definition, if he ask you to state the def of something, don't try to put theorem instead! you will get &quot;a line&quot; or a &quot;0&quot; for it w/ NO partial credit at all!!! also his hw is looonnng like a minimum of 3 pages each. lecture sucks, he just restate the theorem and def from book!",11/15/2007,5,5.0,,1,Meh,1,1.0,1,No,N/A,1112,N/A,,N/A,,people,people
N/A,average,average,average,0,13653138,0,,poor,2,MATH241,He wants to see you fail.  He lets you drop a midterm just in case you miss one he can say no retakes.  Just try answering one of his questions in class.  I dare you.  He will shoot you down and it will be pretty funny.  His tests are not too hard though.,11/14/2007,2,2.0,,2,Meh,2,2.0,1,No,N/A,1112,N/A,,N/A,,people,people
N/A,poor,good,poor,0,13651546,0,,poor,1,MATH241,Terrible Prof. who doesn't really care to help.  You are better off trying to learn the material just from the text book then from him,11/14/2007,5,5.0,,1,Meh,1,1.0,1,Yes,N/A,1112,N/A,,N/A,,people,people
N/A,poor,good,poor,0,13649244,0,,poor,1,MATH241,"Igor is an absolutely terrible professor, if you can't get into another section, either wait and take the class a different semester or try and take it over the summer. It is not worth the pain that is his class. He is the most rude professor I have ever met and is very demeaning towards the students. Tests are ridiculous.",11/14/2007,5,5.0,,1,Meh,1,1.0,1,Yes,N/A,1112,N/A,,N/A,,people,people
N/A,poor,good,poor,0,13649127,0,,poor,1,MATH241,"He is by FAR the worst teacher in the world.  Dont ever take a class with Igor.  If its not possible to aviod him, wait and take the class later.",11/14/2007,5,5.0,,1,Sorta interested,1,1.0,1,Yes,N/A,1112,N/A,,N/A,,people,people
N/A,poor,good,poor,0,13640447,0,,poor,1,CALC241,Igor is the worst teacher I have had in my life. His accent isn't terrible but adds to my dislike. His lectures do not flow together at all. He just writes stuff on the board and does not explain what you would use it for. I would rather take a class at 6 am if they offered one with a different teacher. Avoid at all costs.,11/12/2007,5,5.0,,1,Sorta interested,1,1.0,1,Yes,N/A,1112,N/A,,N/A,,people,people
N/A,poor,good,poor,0,13618104,0,,poor,1,MATH241,"It is very difficult to understand this professor, due to his strong accent and soft voice. He basically just proves theorems in his classes, and hardly if ever teaches how to apply them. Even in exams, 50% of them involves giving direct definitions of theorems and how to prove them, instead of giving proper math questions as they should be. He als",11/08/2007,5,5.0,,1,Meh,1,1.0,1,Yes,N/A,1112,N/A,,N/A,,people,people
