attendance,clarityColor,easyColor,helpColor,helpCount,id,notHelpCount,onlineClass,quality,rClarity,rClass,rComments,rDate,rEasy,rEasyString,rErrorMsg,rHelpful,rInterest,rOverall,rOverallString,rStatus,rTextBookUse,rWouldTakeAgain,sId,takenForCredit,teacher,teacherGrade,teacherRatingTags,unUsefulGrouping,usefulGrouping
N/A,average,average,average,0,20316882,0,,poor,2,MACS100,I knew her exams were going to be BS when her own TA said he told Glennon to stop making the test super tricky. Some of the questions comes from the things she said verbally in class which is really hard to get because she talks so fast . But the good thing is she retired so there will be another teacher with MACS 100 .,05/20/2012,2,2.0,,2,Low,2,2.0,1,No,N/A,1112,N/A,,N/A,,people,people
N/A,good,poor,good,0,20217367,0,,good,5,MACS100,"Glennon really isn't that bad and is extremely nice if you get to know her. Her tests questions are mainly from the lecture notes but the readings are also required if you want to do well. Overall, this was one of the easier classes that I have had during my 4 years at U of I.",05/07/2012,1,1.0,,5,It's my life,5,5.0,1,Yes,N/A,1112,N/A,,N/A,,people,people
N/A,average,average,average,0,19830304,0,,average,3,MACS100,"Glennon is a babe. Her tests are mainly from lecture notes. If you pay attention and take good notes you will be more than fine in this class. You also get to watch awesome movies and shows like The Truman Show, Little Miss Sunshine, Beavis & Butthead, and a little bit of South Park. Most of the negative remarks are from slackers.",02/15/2012,2,2.0,,3,Low,3,3.0,1,Yes,N/A,1112,N/A,,N/A,,people,people
N/A,good,average,average,0,19830286,0,,good,4,MACS100,"I really don't see why she is getting all of this negative criticism...I mean she does initially come off as a bi*** but her tests are straight from the lecture (JUST PAY ATTENTION IN CLASS) and the movies we watched were pretty funny (The Truman Show, Little Miss Sunshine, etc.) I studied the day before my first exam and ended up wit",02/15/2012,2,2.0,,3,Low,3.5,3.5,1,Yes,N/A,1112,N/A,,N/A,,people,people
N/A,average,good,average,0,19829213,0,,poor,2,MACS100,I am currently in the class and getting ready for Exam 1 today. I already don't like her or the class. She picks all these old time movies that are not interesting. I don't know what to study for this exam and she is super boring. Thinking about dropping this class and taking a second 8 week course. Any suggestions ?,02/15/2012,4,4.0,,2,Low,2,2.0,1,No,N/A,1112,N/A,,N/A,,people,people
N/A,good,average,average,0,19727396,0,,average,4,MACS100,"Glennon does not know how to teach a gen ed. Tests were trickier than needed. Attendance is required. The title of this course makes it seem like a breeze, but effort is a must if you want to get an A. I got an A but I had to push myself to study for a course I did not think I would devote much time to. Look for a better option in a gen ed",01/14/2012,3,3.0,,2,Low,3,3.0,1,No,N/A,1112,N/A,,N/A,,people,people
N/A,average,good,average,0,19303080,0,,poor,2,MACS100,"Do not take this class. Glennon mostly talked about how much she hated Jersey Shore and discussed extremely radical viewpoints of the media that were very disagreeable. If you want to take a class that you will hate, try MACS 100. Definitely not what I was expecting. The film projects are pointless and her exams are impossible to study for.",11/23/2011,4,4.0,,2,Really into it,2,2.0,1,No,N/A,1112,N/A,,N/A,,people,people
N/A,poor,good,poor,0,19176003,0,,poor,1,MACS100,MACS100 was okay. You have to attend lecture for clicker questions. Her tests are way too difficult for a 100 level class. She gives you a study guide but half of the material isn't on the test. Don't take this course if you're looking for an easy gen ed. This class isn't worth the GPA drop.,11/07/2011,4,4.0,,2,Low,1.5,1.5,1,No,N/A,1112,N/A,,N/A,,people,people
N/A,good,good,average,0,18779886,0,,good,4,MS356,"Ivy was pretty cool.  I learned a bunch and she was very enthusiastic.  She's oddly cute in a older woman kinda way.  Even though the class was pretty difficult, I think of her quite fondly.  One of those professors you remember as tough but sincere.  Ivy is great.",06/30/2011,5,5.0,,3,It's my life,3.5,3.5,1,Yes,N/A,1112,N/A,,N/A,,people,people
N/A,average,good,average,0,17925331,0,,average,3,GWS356,"This woman takes her PhD WAY too seriously. Yes, she IS intelligent. However, intelligence coupled with hypocrisy is hard to admire. While on the one hand she emphasizes the absurdity of institutional power, on the other, she insists on being addressed as &quot;Dr.&quot; Thus reinforcing that which she criticizes. She is full of incongruent attitudes.",12/13/2010,4,4.0,,2,It's my life,2.5,2.5,1,Yes,N/A,1112,N/A,,N/A,,people,people
N/A,good,average,good,0,17275435,0,,good,4,MS410,Learned a lot about ethics.  Course is hard at first but she is interested in topic and makes ideas clear.,05/27/2010,3,3.0,,4,Sorta interested,4,4.0,1,Yes,N/A,1112,N/A,,N/A,,people,people
N/A,average,good,poor,0,16453153,0,,poor,2,MS356,"This professor is highly unorganized, yet is a very hard grader. She does not know how to work with basic technology and takes several weeks to grade things! She assigned 3 tests, 2 papers, and 1 groups presentation for this course, and the majority of those assignments were given at the end of the semester. Her lectures are unclear.",12/02/2009,4,4.0,,1,It's my life,1.5,1.5,1,Yes,N/A,1112,N/A,,N/A,,people,people
N/A,poor,good,poor,0,15232486,0,,poor,1,COMM356,"Do Not take a class with this woman.  Attendance is mandatory, she talks about non-sense, she is an incredibly hard grader, tons of readings in books and journals.  Tons of work with this woman...plus she is incredibly boring!",12/18/2008,5,5.0,,1,Meh,1,1.0,1,No,N/A,1112,N/A,,N/A,,people,people
N/A,average,average,poor,0,14674708,0,,poor,2,COMM166,"Hated her. Besides being ridiculously unorganized, she and my TA messed up the grades for several students in the class. She states her opinions as facts.",07/21/2008,2,2.0,,1,Really into it,1.5,1.5,1,No,N/A,1112,N/A,,N/A,,people,people
N/A,good,poor,average,0,14505034,0,,good,4,COMM166,"Great Class.  Really easy.  If you want to be entertained, go to the lecture.  I'm pretty sure Ivy makes up most of what she talks about.  I studied maybe an hour for the entire class, spent most of my time in lectures doing sudoku, and got a 94. I basically only went to hear the ridiculous things Ivy would say.",05/21/2008,1,1.0,,3,Sorta interested,3.5,3.5,1,No,N/A,1112,N/A,,N/A,,people,people
N/A,good,poor,good,0,14477260,0,,good,4,ADV493,I truly liked this class. She's pretty enthusiastic and makes it interesting. The tests weren't bad at all and I loved the content of the class (also loved the book!). Take it if you're an ad major!!! This is for ADV 493 not the COMM class.,05/15/2008,1,1.0,,4,It's my life,4,4.0,1,Yes,N/A,1112,N/A,,N/A,,people,people
N/A,average,average,average,0,14360200,0,,good,3,COMM166,"The lecture was a joke. I didn't go to more than half. Go to discussion and put in a decent effort on the project, and you will get an A like me. Also do the online multiple choice practice exams. Ivy is knowledgeable, but a terrible lecturer. Unbearable. Get Matt as a TA. He's hot.",04/28/2008,2,2.0,,4,Really into it,3.5,3.5,1,Yes,N/A,1112,N/A,,N/A,,people,people
N/A,good,average,average,0,14103161,0,,good,4,COMM166,"She could be pretty boring, but overall her class was not bad. I was always amused when she would talk about things to imply that she was keeping up with technology. She tried but sometimes she seemed clueless. But overall a good class. Interesting content. If you do the readings and assignments you will do great! I got an A!",02/18/2008,2,2.0,,3,Sorta interested,3.5,3.5,1,Yes,N/A,1112,N/A,,N/A,,people,people
N/A,good,poor,average,0,13906152,0,,average,5,COMM166,"Best teacher ever!  Even though her lectures were posted online, she tells you questions that will be on the test and shows examples to clarify.  Don't listent to people who say she is awful or boring!  She took time to know everyone's name in our lecture of about 200 students!  Great teacher and easy class as long as you read the book!  :)",12/24/2007,1,1.0,,1,Really into it,3,3.0,1,Yes,N/A,1112,N/A,,N/A,,people,people
N/A,good,poor,good,0,13662622,0,,good,4,COMM166,"She's boring but the class is fine. The quizzes were really easy. You don't have to attend lecture, just show up for discussion with the TA and you'll be fine. Not bad at all!",11/15/2007,1,1.0,,4,Really into it,4,4.0,1,Yes,N/A,1112,N/A,,N/A,,people,people
