attendance,clarityColor,easyColor,helpColor,helpCount,id,notHelpCount,onlineClass,quality,rClarity,rClass,rComments,rDate,rEasy,rEasyString,rErrorMsg,rHelpful,rInterest,rOverall,rOverallString,rStatus,rTextBookUse,rWouldTakeAgain,sId,takenForCredit,teacher,teacherGrade,teacherRatingTags,unUsefulGrouping,usefulGrouping
N/A,average,poor,average,0,21249076,0,,average,3,EPS202,"She may like her subject, but her lectures are just repeats of the textbook content, except more boring. She doesn't know how to use technology either. The guest speakers are entertaining, and the discussion sections are great (with a good TA). You get to use one sheet of notes on the exams. It's an easy A.",01/12/2013,1,1.0,,2,It's my life,2.5,2.5,1,Yes,N/A,1112,N/A,,N/A,,people,people
N/A,average,average,average,0,19524302,0,,average,3,EPS201,"She's all over the place, and her powerpoints are unorganized. lectures are hard to follow. she's bad at technology. guest speakers are great, discussion sections were great. one of my favorite classes because of subject matter.",12/15/2011,3,3.0,,3,Sorta interested,3,3.0,1,Yes,N/A,1112,N/A,,N/A,,people,people
N/A,average,poor,poor,0,19348119,0,,poor,2,EPS201,Worst class ever lecture is terrible discussion is fun though if you have a good TA like I did. Class is boring and the same slides are shown time after time. If you look at the powerpoints they are over like 100 slides long and she liteally only goes over like 5. The only interesting thing about this class is discussion and the guest speakers.,12/01/2011,1,1.0,,1,Meh,1.5,1.5,1,No,N/A,1112,N/A,,N/A,,people,people
N/A,average,poor,average,0,18754161,0,,average,2,EPS202,I thought I would love this class but she made me hate it! She goes over the same thing for weeks and posts powerpoints online so no need to go to lecture. just go to discussion. super easy advanced comp and she lets you use notes on exams.,06/22/2011,1,1.0,,3,Really into it,2.5,2.5,1,No,N/A,1112,N/A,,N/A,,people,people
N/A,poor,poor,poor,0,18573574,0,,poor,1,EPS201,"When it comes to using technology, she's really dumb and can hardly get it to work on her own. In addition she is a very boring person presenting a very boring subject. Go to class to do lecture writes and then skip the rest. The lecture is useless, discussion is where it's at. Just make sure Erin Castro's your TA",05/10/2011,1,1.0,,1,Meh,1,1.0,1,No,N/A,1112,N/A,,N/A,,people,people
N/A,average,average,average,0,18515352,0,,poor,2,EPS201,"She once received an ICIS forms with the following: If I only had 24 hours to live, I would come to her class because she would make it feel like an eternity. She thought this was a compliment.",05/03/2011,2,2.0,,2,Really into it,2,2.0,1,No,N/A,1112,N/A,,N/A,,people,people
N/A,good,good,average,0,18456560,0,,good,4,EPS202,Horrible class. do not take this Advanced comp. it was such a pain! they make writing a 15 page paper an long and dragged out process. If your TA is kisha rivers u are in for a horrible semester. Lectures are so boring. SO SO SO boring. worst class i have taken so far.,04/23/2011,5,5.0,,3,Low,3.5,3.5,1,Yes,N/A,1112,N/A,,N/A,,people,people
N/A,average,average,average,0,18229125,0,,average,2,EPS202,"BORING! And I absolutely HATE how she puts her powerpoints online the night before lecture, but then changes them for lecture! WHAT IS THE POINT OF PRINTING THEM OUT IF YOU'RE JUST GOING TO CHANGE THEM ANYWAY&#63;! She basically regurgitates the book material word for word. No real insight. It's not a horrible class, but definitely not what I expected.",02/11/2011,3,3.0,,3,Sorta interested,2.5,2.5,1,Yes,N/A,1112,N/A,,N/A,,people,people
N/A,average,poor,average,0,18039945,0,,good,3,EPS202,"EPS 202 lecture is boring. BOOORRRIIINNNGGGG! It's not Professor Connell's fault that the material for an educational foundation class is boring, but she certainly doesn't do anything to make it... fun. EPS 202 is an easy easy easy advanced comp. class. Jeanne just happens to be the person teaching it. It's an easy class. Jeanne isn't that bad.",12/24/2010,1,1.0,,4,Sorta interested,3.5,3.5,1,Yes,N/A,1112,N/A,,N/A,,people,people
N/A,average,poor,average,0,17548127,0,,poor,3,EPS202,"If you guys did not finish advanced composition yet, I would recommend to take EPS202. It is very very easy class and you dont have to go to class. If you just concentrate on discussion section, then you will get A for sure. I've got B+ but i guess i was the only person who got this grade. SO...take this class.",08/25/2010,1,1.0,,1,It's my life,2,2.0,1,Yes,N/A,1112,N/A,,N/A,,people,people
N/A,poor,poor,poor,0,17283900,0,,poor,1,EPS201,"This class is extremely easy, but Professor Connell is extremely boring. It is not necessary to attend lecture other than the day she gives a lecture write for points. I also had no idea what this class was about until I went to discussion. I learned everything I learned from my TA, not from her.",05/29/2010,1,1.0,,1,Low,1,1.0,1,Yes,N/A,1112,N/A,,N/A,,people,people
N/A,good,poor,average,0,16226855,0,,good,4,EPS201,"It's a grave disappointment that someone who is teaching educators cannot provide a good example. The class is useless; full of common sense with little insight into anything else. On the bright side, easy A.",10/08/2009,1,1.0,,3,Really into it,3.5,3.5,1,Yes,N/A,1112,N/A,,N/A,,people,people
N/A,average,average,poor,0,15881586,0,,poor,2,EPS201,"This class was very easy, but completely awful.  Prof. Connell's lecture slides were a straight regurgitation of the readings for the class; no extra insight was provided by going to lecture.  The guest speakers brought into class were very cool, but class was pointless, just like every other education course: disappointingly useless",05/21/2009,2,2.0,,1,Sorta interested,1.5,1.5,1,No,N/A,1112,N/A,,N/A,,people,people
N/A,average,poor,average,0,15837309,0,,good,3,EPS201,"Good lecture, interesting topics. She caters to students who miss class a little too much, other than that, very nice and agreeable.",05/14/2009,1,1.0,,4,Really into it,3.5,3.5,1,Yes,N/A,1112,N/A,,N/A,,people,people
N/A,good,poor,good,0,15830798,0,,good,4,EPS202,Professor Connell is really friendly. She is always willing to clarify any concepts that you may not understand. She posts her lectures online which makes it easy to follow her lectures. The films she shows in lecture are eye opening about the conditions in schools.,05/13/2009,1,1.0,,4,Really into it,4,4.0,1,Yes,N/A,1112,N/A,,N/A,,people,people
N/A,average,average,good,0,15819118,0,,good,3,EPS202,Professor Connell has really interesting lectures and the films she shows in class-from Youtube and movies- are really helpful and these clips help the students in the class understand the material better. Understanding this material is important for written responses in both lecture and discussion- Overall this is a great class!,05/12/2009,2,2.0,,5,Sorta interested,4,4.0,1,Yes,N/A,1112,N/A,,N/A,,people,people
N/A,poor,poor,poor,0,15747306,0,,poor,1,EPS201,"I HATED THIS CLASS! She is a nice person, but a horrible lecturer. She is boring and gets sidetracked a lot. She reads right off the power point. If lecture wasn't mandatory, I wouldn't go. You learn just as much just by reading the PowerPoints she puts online and reading the material. Easy A though (depending on your TA)",05/01/2009,1,1.0,,1,Meh,1,1.0,1,No,N/A,1112,N/A,,N/A,,people,people
N/A,average,average,average,0,15614933,0,,good,3,EPS201,"Fairly easy course with this prof. She is friendly and seems to be passionate. She tends to ramble and her slides are rather random. A required course for me that I did fairly well on. My TA was, however, very lackluster.",04/06/2009,2,2.0,,4,Sorta interested,3.5,3.5,1,Yes,N/A,1112,N/A,,N/A,,people,people
N/A,good,poor,good,0,15215111,0,,good,5,EPS201,She is really easy and this class is really easy. I would recommend you take it as an advanced composition instead because it is sooooo easy!,12/16/2008,1,1.0,,4,Sorta interested,4.5,4.5,1,Yes,N/A,1112,N/A,,N/A,,people,people
N/A,average,average,average,0,15197370,0,,poor,2,EPS202,"This class is easy, but it depends on your TA. Her lectures though are so random and wierd. She puts pictures on there that have nothing to do with anything and then, she puts so much information on one slide...",12/15/2008,2,2.0,,2,Really into it,2,2.0,1,Yes,N/A,1112,N/A,,N/A,,people,people
