attendance,clarityColor,easyColor,helpColor,helpCount,id,notHelpCount,onlineClass,quality,rClarity,rClass,rComments,rDate,rEasy,rEasyString,rErrorMsg,rHelpful,rInterest,rOverall,rOverallString,rStatus,rTextBookUse,rWouldTakeAgain,sId,takenForCredit,teacher,teacherGrade,teacherRatingTags,unUsefulGrouping,usefulGrouping
N/A,good,average,good,0,14425045,0,,good,5,CHEM102,He is a great professor and very clear in his explanations.  I was in the hospital for a month of class and he was extremely understanding and really helped me catch up with my work.  He is very enthusiastic about chemistry which makes lecture much easier to attend.,05/07/2008,2,2.0,,5,Really into it,5,5.0,1,Yes,N/A,1112,N/A,,N/A,,people,people
N/A,good,average,good,0,14353302,0,,good,5,CHEM102,"He's a great prof, and you can tell that he really cares about his students and takes his job seriously.  He uses demos which not only help to make sense of the actual chemistry, but also make class far more enjoyable to attend. If you're taking chem, I'd highly recommend taking 102 with Weaver!",04/26/2008,3,3.0,,4,Low,4.5,4.5,1,Yes,N/A,1112,N/A,,N/A,,people,people
N/A,good,average,good,0,13917554,0,,good,5,CHEM102,"He's a very nice guy and has a good sense of humor. He is always willing to answer questions, and his lectures are very helpful in learning the material.",12/28/2007,3,3.0,,5,Sorta interested,5,5.0,1,Yes,N/A,1112,N/A,,N/A,,people,people
N/A,good,average,good,0,13784505,0,,good,5,CHEM102,"GREAT guy! Super easy to understand, very willing to answer questions, extremely down to earth and approachable. Very fair grading, highly recommend",12/09/2007,2,2.0,,5,Sorta interested,5,5.0,1,Yes,N/A,1112,N/A,,N/A,,people,people
N/A,good,good,good,0,13676461,0,,good,4,CHEM102,No Comments,11/19/2007,4,4.0,,4,Sorta interested,4,4.0,1,Yes,N/A,1112,N/A,,N/A,,people,people
N/A,good,good,good,0,13550203,0,,good,4,CHEM102,"Weaver is a great professor. this year he used Hummel's exams, so make sure you study those hard-core. Weaver knows his stuff and is always willing to help out. If you put in the work you will pass. If you slack off, you better be smart.",10/22/2007,4,4.0,,4,Low,4,4.0,1,Yes,N/A,1112,N/A,,N/A,,people,people
