attendance,clarityColor,easyColor,helpColor,helpCount,id,notHelpCount,onlineClass,quality,rClarity,rClass,rComments,rDate,rEasy,rEasyString,rErrorMsg,rHelpful,rInterest,rOverall,rOverallString,rStatus,rTextBookUse,rWouldTakeAgain,sId,takenForCredit,teacher,teacherGrade,teacherRatingTags,unUsefulGrouping,usefulGrouping
N/A,average,good,poor,0,10632721,0,,poor,2,PSYCH100,"the worse prof. ever...she acts like she's 14 years old...the class itself is VERY boring and unnecessarily difficult...it's a 100 level class but it's as hard as any 300 level...very riddiculous...do NOT take psych 100 with her...if you have to, take Psych 100 section X...trust me.",10/24/2005,5,5.0,,1,Meh,1.5,1.5,1,N/A,N/A,1112,N/A,,N/A,,people,people
N/A,good,average,good,0,3128950,0,,good,5,PSYCH100,No Comments,12/29/2004,3,3.0,,5,Low,5,5.0,1,N/A,N/A,1112,N/A,,N/A,,people,people
N/A,good,good,good,0,3022755,0,,good,5,PSYCH100,"Great teacher, very funny and entertaining.",12/14/2004,4,4.0,,4,It's my life,4.5,4.5,1,N/A,N/A,1112,N/A,,N/A,,people,people
N/A,good,good,good,0,2639815,0,,good,4,PSYCH100,"She is very funny, and is full of great interesting information relating to everyday life.",11/02/2004,4,4.0,,4,Sorta interested,4,4.0,1,N/A,N/A,1112,N/A,,N/A,,people,people
N/A,average,good,average,0,2619025,0,,poor,2,PSYCH100,"Knows what she's talking about, but teaches with all the maturity of a ditzy teenage girl. Tells boring stories about dating crackheads and other desperate men.",10/30/2004,4,4.0,,2,Sorta interested,2,2.0,1,N/A,N/A,1112,N/A,,N/A,,people,people
