attendance,clarityColor,easyColor,helpColor,helpCount,id,notHelpCount,onlineClass,quality,rClarity,rClass,rComments,rDate,rEasy,rEasyString,rErrorMsg,rHelpful,rInterest,rOverall,rOverallString,rStatus,rTextBookUse,rWouldTakeAgain,sId,takenForCredit,teacher,teacherGrade,teacherRatingTags,unUsefulGrouping,usefulGrouping
Mandatory,poor,good,poor,0,23733038,0,,poor,1,GE100,I have never worked harder at a 100 level class in my life. Lectures are mandatory and you will fall asleep due to the dry monotone that persists for 50 minutes. ,11/03/2014,5,5.0,,1,Low,1,1.0,1,Yes,N/A,1112,Yes,,A+,,people,people
N/A,average,good,average,0,17722588,0,,average,3,GE101,"No question, he is boring. However, if you go to class, and study hard for exams and learn autocad stuff,you should be fine. True, course requires a lot of different kind of work: 2 written exams, 2 autodesk exams, project, etc",11/03/2010,4,4.0,,2,Sorta interested,2.5,2.5,1,Yes,N/A,1112,N/A,,N/A,,people,people
N/A,poor,good,poor,0,17087661,0,,poor,1,GE101,Most useless class I have ever taken.  He can't teach.,04/29/2010,5,5.0,,1,Meh,1,1.0,1,No,N/A,1112,N/A,,N/A,,people,people
N/A,average,good,average,0,15894354,0,,average,2,GE101,"What did UIUC expect when they made a course that combined 3D Auto CAD, Inventor, hand sketching, learning about perspective and a bad professor who runs a racket selling his textbook to the class every semester&#63; Clearly it is not working, because they try to teach you too much and not much sticks.",05/25/2009,5,5.0,,3,It's my life,2.5,2.5,1,Yes,N/A,1112,N/A,,N/A,,people,people
N/A,average,good,average,0,14055882,0,,poor,2,GE101,"Very Boring.  Does not teach the class well at all.  Avoid taking the class at all costs.  It is extremely boring and requires a lot of work.  Plus, most of his TAs can't speak English.",01/29/2008,4,4.0,,2,Sorta interested,2,2.0,1,No,N/A,1112,N/A,,N/A,,people,people
N/A,average,good,average,0,14006550,0,,poor,2,GE101,"I think he's a robot. When I wasn't fighting sleep, I thought his teaching abilities were par, at best.  Book readings weren't helpful.  Thank goodness for my awesome TA.  Leake's class notes online are pretty good to study from, however.  Otherwise zzzzzzzz.",01/15/2008,4,4.0,,2,Sorta interested,2,2.0,1,No,N/A,1112,N/A,,N/A,,people,people
N/A,average,average,average,0,12307899,0,,good,3,GE101,ZZZZZZZZZzzzzzzzzzzZZZZZZZZZZzzzzzzzzzzzz,10/23/2006,3,3.0,,4,Really into it,3.5,3.5,1,No,N/A,1112,N/A,,N/A,,people,people
N/A,poor,good,poor,0,11120602,0,,poor,1,GE101,"If you're having problems with insomia, come to GE 101 lecture. You are sure to fall asleep within a matter of 32 seconds.",12/11/2005,5,5.0,,1,Meh,1,1.0,1,N/A,N/A,1112,N/A,,N/A,,people,people
