attendance,clarityColor,easyColor,helpColor,helpCount,id,notHelpCount,onlineClass,quality,rClarity,rClass,rComments,rDate,rEasy,rEasyString,rErrorMsg,rHelpful,rInterest,rOverall,rOverallString,rStatus,rTextBookUse,rWouldTakeAgain,sId,takenForCredit,teacher,teacherGrade,teacherRatingTags,unUsefulGrouping,usefulGrouping
N/A,good,poor,good,1,18062514,0,,good,5,STAT100,Very easy teacher. Take this teacher for stat! I got D's on the first two test but I ended up with an A in the course. Very easy class. All you have to do is do the homework and extra credit and you are set!,12/30/2010,1,1.0,,5,Sorta interested,5,5.0,1,Yes,N/A,1112,N/A,,N/A,,people,person
N/A,average,good,average,0,17776748,0,,poor,2,STAT100,"A bit hard to understand sometimes. She's not great at explaining things, but her lecture notes are good.",11/16/2010,4,4.0,,2,Meh,2,2.0,1,No,N/A,1112,N/A,,N/A,,people,people
N/A,good,poor,good,0,17595688,0,,good,5,STATS100,super easy... havent gone to a single class except for exams easy A,09/15/2010,1,1.0,,5,Meh,5,5.0,1,No,N/A,1112,N/A,,N/A,,people,people
N/A,good,poor,good,0,17595685,0,,good,5,STATS100,"SUPER easy, havent gone to a single class expect for exam days...",09/15/2010,1,1.0,,5,Meh,5,5.0,1,No,N/A,1112,N/A,,N/A,,people,people
N/A,good,good,average,0,17551806,0,,good,4,STAT100,"Very Hard Class, suggest you drop out if you take it... The exams are almost impossible, and the book work is hard everyday!",08/26/2010,4,4.0,,3,Really into it,3.5,3.5,1,Yes,N/A,1112,N/A,,N/A,,people,people
