attendance,clarityColor,easyColor,helpColor,helpCount,id,notHelpCount,onlineClass,quality,rClarity,rClass,rComments,rDate,rEasy,rEasyString,rErrorMsg,rHelpful,rInterest,rOverall,rOverallString,rStatus,rTextBookUse,rWouldTakeAgain,sId,takenForCredit,teacher,teacherGrade,teacherRatingTags,unUsefulGrouping,usefulGrouping
N/A,poor,good,poor,0,12358294,0,,poor,1,MATH234,"His exam questions are similar to the practice exam. However, there is so much work involved. First, you can't really try to learn the material in lecture becayse you are trying to understand his incredibly thick accent. So you have to go over everything again later. Also, he can barely speak English, seriously. TA recommendation: Kunwoo Kim.",11/04/2006,5,5.0,,1,Low,1,1.0,1,Yes,N/A,1112,N/A,,N/A,,people,people
N/A,good,poor,good,0,11780445,0,,good,4,MATH234,easy materal with easy exams. have quizzes every week but they are not that hard and they are really helpful for understanding.,04/27/2006,1,1.0,,5,Sorta interested,4.5,4.5,1,N/A,N/A,1112,N/A,,N/A,,people,people
N/A,poor,good,poor,0,11192859,0,,poor,1,MATH234,How do they let someone like him teach,12/16/2005,5,5.0,,1,Low,1,1.0,1,N/A,N/A,1112,N/A,,N/A,,people,people
N/A,good,poor,good,0,10918004,0,,good,5,MATH234,"good professor, great online notes + easy tests",11/16/2005,1,1.0,,5,It's my life,5,5.0,1,N/A,N/A,1112,N/A,,N/A,,people,people
N/A,poor,good,poor,0,10456086,0,,poor,1,MATH234,No Comments,09/28/2005,5,5.0,,1,Meh,1,1.0,1,N/A,N/A,1112,N/A,,N/A,,people,people
N/A,average,average,poor,0,10537076,0,,poor,2,BUSCALC,"He can barely speak english, so understnading him in lecture is very hard. When he says ZOOM it sounds like LOOM and when he says ECONOMICS it sounds like EGOLOMICS.  Atleast my TA is helpful, but then again he barely makes it to class on time! :-)",09/22/2005,3,3.0,,1,Sorta interested,1.5,1.5,1,N/A,N/A,1112,N/A,,N/A,,people,people
