attendance,clarityColor,easyColor,helpColor,helpCount,id,notHelpCount,onlineClass,quality,rClarity,rClass,rComments,rDate,rEasy,rEasyString,rErrorMsg,rHelpful,rInterest,rOverall,rOverallString,rStatus,rTextBookUse,rWouldTakeAgain,sId,takenForCredit,teacher,teacherGrade,teacherRatingTags,unUsefulGrouping,usefulGrouping
Mandatory,good,average,good,0,25269074,0,,good,4,CMN463,Fantastic professor! Class is enjoyable and knowledge is applicable. Dr. Lammers is very helpful too.,10/19/2015,3,3.0,,5,It's my life,4.5,4.5,1,Yes,Yes,1112,Yes,,A,,people,people
Mandatory,average,average,average,0,22696334,0,,average,3,CMN463,"I thought this class was pretty interesting because I am very interested in the United States healthcare system. However, this professor gets sidetracked quite frequently making class drag on forever. He doesn't get straight to the point during lectures. His exams were very easy to prepare for and well written though.",01/04/2014,3,3.0,,3,It's my life,3,3.0,1,No,N/A,1112,N/A,,A,,people,people
N/A,good,poor,good,0,21299801,0,,good,5,CMN463,"If you skim the readings and are a warm body in his classroom, you'll easily ace this class.",01/27/2013,1,1.0,,5,Really into it,5,5.0,1,Yes,N/A,1112,N/A,,N/A,,people,people
N/A,good,average,good,0,21173667,0,,good,5,CMN463,"This class is very beneficial if you really want to get to know the US health industry. It is very practical for people who want to enter the health field. The exam was pretty easy, since he gave you a study guide and tells you exact what will be on the exam. The exam is usually consist of 40 multiple choice question and a short essay question",12/27/2012,2,2.0,,4,It's my life,4.5,4.5,1,No,N/A,1112,N/A,,N/A,,people,people
N/A,average,average,good,0,20314024,0,,good,3,CMN412,"I had to say the class was pretty boring, the class consist reading every single day, and we often have iclicker quiz on the reading material. There is also a midterm paper 10~15 pages which counts a large portion of your grade, also the is a in class midterm on the macdonlalization ritzler book. However, he is a very easy grader to his student.",05/19/2012,3,3.0,,5,Sorta interested,4,4.0,1,Yes,N/A,1112,N/A,,N/A,,people,people
N/A,good,average,good,0,20232451,0,,good,4,CMN412,"He is a great guy and, his lectures are semi-interesting. He tends to get off topic often. There was two midterms, one was a 15-20 page case study and and the other was one in class essay. The final was optional.",05/08/2012,2,2.0,,5,Sorta interested,4.5,4.5,1,No,N/A,1112,N/A,,N/A,,people,people
