attendance,clarityColor,easyColor,helpColor,helpCount,id,notHelpCount,onlineClass,quality,rClarity,rClass,rComments,rDate,rEasy,rEasyString,rErrorMsg,rHelpful,rInterest,rOverall,rOverallString,rStatus,rTextBookUse,rWouldTakeAgain,sId,takenForCredit,teacher,teacherGrade,teacherRatingTags,unUsefulGrouping,usefulGrouping
N/A,poor,good,poor,0,20665917,0,,poor,1,RHETP6,Boring!,09/27/2012,5,5.0,,1,Meh,1,1.0,1,Yes,N/A,1112,N/A,,N/A,,people,people
N/A,poor,poor,poor,0,18645616,0,,poor,1,ENGL115,"take this class for the Easy A (Actually if you can't get an A with him then you probably should just quit). On a scale of 1 to 5 he is a 10 with easiness. if you expect to learn anything, want to create relationships, enjoy reading= you will not find it here.",05/21/2011,1,1.0,,1,Meh,1,1.0,1,Yes,N/A,1112,N/A,,N/A,,people,people
N/A,average,poor,average,0,18356762,0,,average,3,ENG115,"Easy, but I don't recommend this class. The material was very dry, and Mr. O'Neil would rarely give feedback on responses to questions. Also, it took him nearly an entire semester to return essays and midterms.",04/05/2011,1,1.0,,3,Low,3,3.0,1,Yes,N/A,1112,N/A,,N/A,,people,people
N/A,good,poor,good,0,17943459,0,,good,5,ENGL115,"Very nice! Awkward at times, but he meant well. He made this class almost impossible to fail, best gen ed!",12/14/2010,1,1.0,,5,Meh,5,5.0,1,Yes,N/A,1112,N/A,,N/A,,people,people
N/A,average,good,average,0,17644768,0,,poor,2,ENG115,,10/10/2010,5,5.0,,2,Meh,2,2.0,1,No,N/A,1112,N/A,,N/A,,people,people
