attendance,clarityColor,easyColor,helpColor,helpCount,id,notHelpCount,onlineClass,quality,rClarity,rClass,rComments,rDate,rEasy,rEasyString,rErrorMsg,rHelpful,rInterest,rOverall,rOverallString,rStatus,rTextBookUse,rWouldTakeAgain,sId,takenForCredit,teacher,teacherGrade,teacherRatingTags,unUsefulGrouping,usefulGrouping
N/A,good,average,good,0,21159899,0,,good,5,ENGL231,"Jonathan Vincent is currently teaching at Towson University, MD. He's a great, enthusiastic professor that gives you exactly what you need to get an A if you show up. He's very casual and enjoys analyzing what people contribute. Great class, I learned a lot more about history instead of literature though! (American Literature up to 1860)",12/23/2012,2,2.0,,5,Sorta interested,5,5.0,1,Yes,N/A,1112,N/A,,N/A,,people,people
N/A,good,average,good,0,18775590,0,,good,5,ENG116,"Best instructor I have ever had. Very engaging, intelligent, perceptive, fun and a geniunely good person. If you take his class... please give it your all. He deserves nothing less.",06/29/2011,2,2.0,,5,It's my life,5,5.0,1,Yes,N/A,1112,N/A,,N/A,,people,people
N/A,good,average,good,0,18161613,0,,good,5,RHET103,He is fun and humorous person and also he grades pretty gently.,01/20/2011,2,2.0,,5,Really into it,5,5.0,1,No,N/A,1112,N/A,,N/A,,people,people
N/A,good,average,good,0,14431027,0,,good,4,ENGL116,He provided an exceptional learning environment. Class assignments were open-ended and generally easy. He was also easily accessible for help on papers/reading material.,05/08/2008,3,3.0,,5,Sorta interested,4.5,4.5,1,Yes,N/A,1112,N/A,,N/A,,people,people
N/A,good,average,good,1,13171645,0,,good,5,ENG101,"He is the best teacher I have ever had.  He encouraged me to go back to school after I was kicked out with a .75. He kept telling me I was smart and that  the world was about more than numbers on paper.  Either way, I will graduate this year with a 3.91. Thanks",05/16/2007,3,3.0,,5,Really into it,5,5.0,1,Yes,N/A,1112,N/A,,N/A,,people,person
N/A,average,average,good,0,13079552,0,,good,3,ENGL116,"Can be sometimes boring. Very lax on the essay assignments, though. Exams are okay only if you take REALLY good notes. Overall, relaxing, enjoying class.",04/29/2007,2,2.0,,5,Sorta interested,4,4.0,1,Yes,N/A,1112,N/A,,N/A,,people,people
N/A,good,average,good,0,11928209,0,,good,4,ENGL116,"Good guy, really enjoys what he does and that reflects in his teachings. After an assigned reading, he usually gives notes about the passage and historical background behind it before discussion, and these notes are well represented in his tests.",12/22/2006,3,3.0,,4,Sorta interested,4,4.0,1,N/A,N/A,1112,N/A,,N/A,,people,people
N/A,good,average,good,0,11100090,0,,good,5,AMERICANLIT,Oh my God. One of the best classes ever. He was awesome at talking about big issues while making them accessible at the same time. The class atmosphere was fun too.,12/09/2005,3,3.0,,5,Sorta interested,5,5.0,1,N/A,N/A,1112,N/A,,N/A,,people,people
