attendance,clarityColor,easyColor,helpColor,helpCount,id,notHelpCount,onlineClass,quality,rClarity,rClass,rComments,rDate,rEasy,rEasyString,rErrorMsg,rHelpful,rInterest,rOverall,rOverallString,rStatus,rTextBookUse,rWouldTakeAgain,sId,takenForCredit,teacher,teacherGrade,teacherRatingTags,unUsefulGrouping,usefulGrouping
Mandatory,good,average,good,0,26578450,0,,good,4,PHIL426,"If you intend on taking and learning a 'tougher' level of philosophy such as PHIL 426, I strongly recommend Professor Livengood; he is a very supportive and passionate professor that makes himself largely available in order to ensure the student is learning well. I was very fond on how he gives students a large amount of autonomy in writing papers.",05/15/2016,3,3.0,,5,N/A,4.5,4.5,1,Yes,N/A,1112,Yes,,A,,people,people
Not Mandatory,good,poor,good,0,25393196,0,,good,4,PHIL103,Good instructor. Pretty easy course but not so boring. Best Gened for engineering student.,11/11/2015,1,1.0,,4,Sorta interested,4,4.0,1,Yes,N/A,1112,Yes,,A,,people,people
N/A,good,average,good,0,22584802,0,,good,4,PHIL103,Professor Livengood is one of the best professors I have ever had at UIUC. His passion for helping students is immense and he will literally spend hours with you if you need the help. For me personally the class was not simple but Livengood made it understandable by walking me through it.,12/17/2013,2,2.0,,5,Low,4.5,4.5,1,No,N/A,1112,N/A,,N/A,,people,people
N/A,good,poor,good,0,21251557,0,,good,5,PHIL103,"Excellent, excellent teacher. Intelligent, calm, helpful. Highly recommended. He challenges you and is crystal clear and organized. His textbook was overdue (exam came mostly from lecture slides... which were also overdue); he is still a one-of-a-kind, true TEACHER. So rare. Absolute 5.0. Class was thought-provoking.",01/13/2013,1,1.0,,5,Really into it,5,5.0,1,No,N/A,1112,N/A,,N/A,,people,people
N/A,good,average,good,0,21167286,0,,good,4,PHIL103,"Great professor, class was alright. He is terrible about putting things online but one of the most helpful teachers I have ever had at UIUC. I'd recommend this class if you want something that will make you think, but I don't believe it's an easy A.",12/25/2012,3,3.0,,5,Really into it,4.5,4.5,1,Yes,N/A,1112,N/A,,N/A,,people,people
