attendance,clarityColor,easyColor,helpColor,helpCount,id,notHelpCount,onlineClass,quality,rClarity,rClass,rComments,rDate,rEasy,rEasyString,rErrorMsg,rHelpful,rInterest,rOverall,rOverallString,rStatus,rTextBookUse,rWouldTakeAgain,sId,takenForCredit,teacher,teacherGrade,teacherRatingTags,unUsefulGrouping,usefulGrouping
N/A,good,good,good,0,21566177,0,,good,5,CHLH474,"Professor Rosenblatt is extremely knowledgeable. She is a great professor, although she is not the most engaging. Slackers and disinterested students tend to dislike the class, but I felt that grading was fair.",04/19/2013,4,4.0,,5,Sorta interested,5,5.0,1,Yes,N/A,1112,N/A,,N/A,,people,people
N/A,average,good,average,0,17655402,0,,average,3,CHLTH374,"I had this professor 15 to 17 years ago.  She is a genious.  She likes to be treated like a human being.  If you treat her snooty and do not take advantage of her knowledge, that's your problem!",10/13/2010,4,4.0,,3,Low,3,3.0,1,No,N/A,1112,N/A,,N/A,,people,people
N/A,average,average,average,0,13900660,0,,average,3,CHLH274,"She has got to be the most boring professor I have ever had. She sits down in her chair (because she is physically disabled) and simply reads the powerpoint slides. Literally, she says &quot;uhmm&quot; every other sentence, no lie! DO NOT take 274 with her, take it in the Spring with the other professor.",12/23/2007,3,3.0,,3,Meh,3,3.0,1,Yes,N/A,1112,N/A,,N/A,,people,people
N/A,good,average,good,0,12415572,0,,good,4,CHLH274,"Really,  shes not that bad. The class may be a bit boring, but as long as you complete the weekly assignments there shouldnt be a problem. The midterm and final arent easy, but if you study her notes and weekly assignments, you'll do fine. Some people complain because it is a bit harder than other CHLH classes, but its easy overall.",11/14/2006,2,2.0,,4,Sorta interested,4,4.0,1,No,N/A,1112,N/A,,N/A,,people,people
N/A,poor,good,poor,1,12304455,0,,poor,1,CHLH274,"Do NOT TAKE THIS CLASS WITH HER! she is the worst teacher I've ever had. She teaches the class like an advanced senior class. She goes off on tangents, she grades the hw way too hard and it doesn't matter how hard you study for the tests bc everyone does bad! She needs to be fired ASAP!",10/22/2006,5,5.0,,1,Meh,1,1.0,1,Yes,N/A,1112,N/A,,N/A,,people,person
N/A,average,average,average,0,11995012,0,,average,3,CHLTH274,She was boring but the information given was very useful,06/11/2006,2,2.0,,3,Sorta interested,3,3.0,1,N/A,N/A,1112,N/A,,N/A,,people,people
N/A,poor,average,poor,0,10141841,0,,poor,1,HE274,horrible!!!,08/19/2005,3,3.0,,1,Meh,1,1.0,1,N/A,N/A,1112,N/A,,N/A,,people,people
N/A,average,average,average,0,10025512,0,,average,3,CHLH274,She is one of the most disorganized and and unhelpful teachers ever.,07/14/2005,3,3.0,,3,Sorta interested,3,3.0,1,N/A,N/A,1112,N/A,,N/A,,people,people
