attendance,clarityColor,easyColor,helpColor,helpCount,id,notHelpCount,onlineClass,quality,rClarity,rClass,rComments,rDate,rEasy,rEasyString,rErrorMsg,rHelpful,rInterest,rOverall,rOverallString,rStatus,rTextBookUse,rWouldTakeAgain,sId,takenForCredit,teacher,teacherGrade,teacherRatingTags,unUsefulGrouping,usefulGrouping
N/A,average,good,average,0,20664684,0,,poor,3,ENG200,"kelly innes is the worst teacher ever. He constantly says ummm a lot! He does not know a good paper when he sees one! In addition, he does know how to teach the material!! Worst teacher ever!!!!!!!1",09/26/2012,4,4.0,,1,Low,2,2.0,1,No,N/A,1112,N/A,,N/A,,people,people
N/A,poor,good,poor,0,17538147,0,,poor,1,ENG200,"Loves the sound of his own voice; you must interrupt him to speak. Must read all material, but you only use small bits for essays & tests. Nebulous concepts are presented & he explains in a roundabout way that leaves you more confused. Write down the charts he draws and what he says to regurgitate it later; he doesn't want original ideas.",08/23/2010,5,5.0,,2,Sorta interested,1.5,1.5,1,Yes,N/A,1112,N/A,,N/A,,people,people
N/A,good,average,good,0,17354578,0,,good,5,ENGL398,"I was blown away by his exceptional breadth of knowledge in literary theory, and his ability to explain complex ideas with clarity.  He also gave us assignments that really helped us improve our writing over the course of the semester (which I found impressive just for the sheer amount of extra grading that he was willing to do for his students.)",06/21/2010,3,3.0,,5,Really into it,5,5.0,1,Yes,N/A,1112,N/A,,N/A,,people,people
N/A,poor,average,poor,0,16861947,0,,poor,1,ENGL116,,03/10/2010,2,2.0,,2,Meh,1.5,1.5,1,Yes,N/A,1112,N/A,,N/A,,people,people
N/A,good,average,good,0,15503887,0,,good,5,ENGL300,"Kelly is an awesome guy! So calm, laid back, and really considerate of students and their workloads. Material is strange and hard, but Kelly is exceptional at explaining concepts. Young guy, seems to have an excellent grasp of life as an undergraduate student.Willing to talk/meet at any time. The epitome of what a great English professor should be.",03/03/2009,2,2.0,,5,It's my life,5,5.0,1,Yes,N/A,1112,N/A,,N/A,,people,people
