attendance,clarityColor,easyColor,helpColor,helpCount,id,notHelpCount,onlineClass,quality,rClarity,rClass,rComments,rDate,rEasy,rEasyString,rErrorMsg,rHelpful,rInterest,rOverall,rOverallString,rStatus,rTextBookUse,rWouldTakeAgain,sId,takenForCredit,teacher,teacherGrade,teacherRatingTags,unUsefulGrouping,usefulGrouping
Mandatory,good,poor,good,0,24792169,0,,good,5,374,"nice professor, respect and care about student",05/10/2015,1,1.0,,5,It's my life,5,5.0,1,No,N/A,1112,Yes,,A,,people,people
Mandatory,average,good,average,0,22729321,0,,average,2,ARCH475,"Hinders is best described as a father figure who cares about all his students but also expects a lot out of them. He's hard but fair and understanding. Most importantly he lets you make your own mistakes and never lets a student flounder in reviews. He never forces his own ideas on you, lets you come to your own realizations about your own work.",01/09/2014,4,4.0,,4,Really into it,3,3.0,1,No,N/A,1112,N/A,,B,,people,people
Mandatory,average,average,average,0,22687819,0,,good,3,ARCH199KH,"Treats all students fairly and with great respect. Many people are intimidated by him just because he is about 6'-6"" and has a loud voice, but he is a good instructor. At times, some of his instructions can be unclear and confusing, however, he is more than willing to meet with students to discuss problems!",01/02/2014,2,2.0,,4,Really into it,3.5,3.5,1,No,N/A,1112,N/A,,A,,people,people
N/A,good,poor,good,0,10443792,0,,good,5,ARCH272,"I respect the man because he treats students like adults and not children.I think alot of people are intimidated by him because he is a big man with large voice.His core teaching style does not revolve around intellectualism, but on competency.He is a seasoned architect and not an academic stuck in a fantasy world of intellectual masquerading, Amen",09/24/2005,1,1.0,,5,It's my life,5,5.0,1,N/A,N/A,1112,N/A,,N/A,,people,people
N/A,average,good,poor,0,3244393,1,,poor,2,ARCH172,"Very disorganized, no syllabus so the entire semester was a guessing game about when projects were due.  Lectures were irrelevant, LOVES to talk about himself.  Overall not a great teacher, can't establish a good relationship with his students, they all either hate him or kiss his ass (intimidated)",01/19/2005,5,5.0,,1,Sorta interested,1.5,1.5,1,N/A,N/A,1112,N/A,,N/A,,person,people
N/A,average,good,poor,0,2887576,0,,poor,2,ARCH171,"wow!  A complete waste of time.  Once said, &quot;I will not respond to anyone unless they call me PROFESSOR HINDERS&quot;",12/02/2004,5,5.0,,1,It's my life,1.5,1.5,1,N/A,N/A,1112,N/A,,N/A,,people,people
N/A,average,good,poor,0,2448162,0,,poor,2,ARCH172,hinders is a tall sex bomb,09/04/2004,5,5.0,,1,N/A,1.5,1.5,3,N/A,N/A,1112,N/A,,N/A,,people,people
N/A,poor,good,poor,0,2311936,1,,poor,1,ARCH171,"has to be the worst teacher in the university.  Poor understanding of the subject and very poor directional advisory.  Quote him saying, I'll be happy if two thirds of 'you' students dont pass my class&quot;",07/13/2004,4,4.0,,1,N/A,1,1.0,3,N/A,N/A,1112,N/A,,N/A,,person,people
