attendance,clarityColor,easyColor,helpColor,helpCount,id,notHelpCount,onlineClass,quality,rClarity,rClass,rComments,rDate,rEasy,rEasyString,rErrorMsg,rHelpful,rInterest,rOverall,rOverallString,rStatus,rTextBookUse,rWouldTakeAgain,sId,takenForCredit,teacher,teacherGrade,teacherRatingTags,unUsefulGrouping,usefulGrouping
Mandatory,poor,good,poor,0,26676291,1,,poor,1,ADV281,If an assignment is due you better be to class real early or he literally will not accept it and you receive a 0. His lectures are quite unclear as he goes off on random tangents. The quizzes had questions that have never been covered even if you went to class and did the online readings. Not much respect for his own students.,05/31/2016,5,5.0,,1,N/A,1,1.0,1,No,No,1112,Yes,,B,,person,people
Mandatory,average,average,average,1,25626837,0,,good,3,ADV281,"Extremely helpful, knowledgeable professor. Will put in the time for students who also put in the time! ",12/10/2015,3,3.0,,4,Really into it,3.5,3.5,1,Yes,N/A,1112,Yes,,N/A,,people,person
Mandatory,good,good,good,2,25223577,1,,good,5,ADV281,"i can't understand why there are so many negative comments. To be honest, Kevin is a very strict professor. He does not accept you homework if you are late for class. He always has a poker face. His tests are always hard. But anyway I did learn a lot from this course. It's the best advertising class I have ever had.",10/02/2015,4,4.0,,5,It's my life,5,5.0,1,No,N/A,1112,Yes,,A-,,person,people
Not Mandatory,average,good,average,2,24857279,0,,good,3,ADV281,The class was pretty tough but I learned a ton of very applicable information.,05/18/2015,4,4.0,,4,Really into it,3.5,3.5,1,Yes,Yes,1112,Yes,,B+,,people,people
Not Mandatory,poor,good,poor,0,24777574,1,,poor,1,ADV281,WORST PROFESSOR EVER. IF YOU ARE LATE BY ONE MINUTE TO CLASS THEN YOUR HOMEWORK RECEIVES A ZERO. ONLINE QUIZZES ARE UP FOR 48 HOURS ONLY. IF YOU MISS IT YOU MISS IT FOR GOOD. NO REVIEW MATERIAL OR ANY HELP BEFORE THE TEST AND EXAM WHATSOEVER. LECTURES DON'T HELP.,05/08/2015,5,5.0,,1,Meh,1,1.0,1,No,N/A,1112,Yes,,N/A,,person,people
N/A,poor,good,poor,1,24773060,0,,poor,1,ADV281,"tests are hard, lectures are long and boring.  always tries to remember the name of students who speak in the class, which is useless.  zero tolerance on late submission of homework-- you will get zero if you are late for even 1 second. homework are complicated but he seldom explains. notes are important but he never provides slides after class",05/07/2015,4,4.0,,1,Low,1,1.0,1,Yes,N/A,1112,Yes,,N/A,,people,person
N/A,average,good,good,1,24174013,1,,good,3,ADV281,"He does not clarify how to do the assignments unless you ask. Pay attention in class, even the details. The problem with his lecture is that he does not emphasize those little details and then he has them on the tests and quizzes. But you can find those information in the book. Read&pay attention then you won't complain about his class.",12/23/2014,4,4.0,,5,Really into it,4,4.0,1,Yes,N/A,1112,Yes,,N/A,,person,person
Not Mandatory,good,average,good,3,23856936,3,,good,4,ADV281,"What people have said on here is a bit unfair. He does try; it's the students who don't care. He is actually a nice person as long as you aren't rude. If you show up to office hours, he is always there and will work to build a relationship with you and give you great feedback. He knows his stuff and will do all he can to help those who actually try",11/19/2014,3,3.0,,4,Really into it,4,4.0,1,Yes,N/A,1112,Yes,,A,,people,people
N/A,average,good,poor,5,23835061,2,,poor,2,ADV281,"Wow this guy is 1 of a kind. NOT FUNNY at all, TRIES to remember students names all semester and its extremely annoying and unnecessary. Tells people to get off laptops (I pay for this class I can quietly do what I want). Won't consider accepting assignments 1 second late (leave previous class early). Shouldn't be teaching anywhere, especially here",11/17/2014,5,5.0,,1,Low,1.5,1.5,1,No,N/A,1112,Yes,,N/A,,people,people
Not Mandatory,poor,good,poor,4,23833471,0,,poor,1,ADV281,"He's a horrible professor. He's a PhD from Stanford, so I thought I'd learn a lot from him but it was the worst possible ADV class I have ever taken. It made me question my major. If you enter class a minute late he won't accept your assignment and you'll get a 0.  Also his assignments make no sense and have no relevance to anything. Avoid the guy",11/17/2014,5,5.0,,1,Meh,1,1.0,1,No,N/A,1112,Yes,,B,,people,people
N/A,poor,good,poor,3,23718974,0,,poor,1,ADV281,"The guy is absolutely terrible, he is full of himself and condescending and the class material would be easier if it wasn't for his weak powerpoints. Avoid him if you can, he seriously needs to reevaluate how he conducts himself with students. ",10/30/2014,5,5.0,,1,Meh,1,1.0,1,No,N/A,1112,Yes,,N/A,,people,people
Not Mandatory,poor,good,poor,3,23643791,0,,poor,1,281,"Seriously you can be a minute late for class and he gives your assignments a 0. If you talk to him about it in a mature matter, he shoots back defensively and very condescending. He isn't clear about what is on tests, the readings have nothing to do with the tests (But he will tell you to study the readings for a test) His power points are useless.",10/09/2014,5,5.0,,1,Meh,1,1.0,1,No,N/A,1112,Yes,,N/A,,people,people
N/A,poor,good,poor,4,23602331,0,,poor,1,ADV281,"If your a minute late to class on days your supposed to turn in an assignment its a 0 and all hopes for an A are gone. Don't pick him as a professor. He thinks he's funny but he's not. He also wears a step counting bracelet and walks back and forth in class. He emphasizes learning names, but never remembers anyway. ",09/19/2014,5,5.0,,1,It's my life,1,1.0,1,Yes,N/A,1112,Yes,,N/A,,people,people
Mandatory,average,good,poor,4,22582832,0,,poor,2,ADV281,I put a lot of effort into this class. I tried really hard. He did not seem to care that our class average for tests were 70%; he grades hard. You have to go into office hours to see exactly what you did wrong on a quiz/test/assignment. A lot of material. Seems like a decent guy but comes off as condescending if you don't participate.,12/17/2013,5,5.0,,1,Low,1.5,1.5,1,Yes,N/A,1112,N/A,,C+,,people,people
Not Mandatory,poor,good,poor,3,22582451,0,,poor,1,ADV281,"Assignments: Vague questions and harsh grading. Tests: Very poor description of what will be on the test and tests typically have things never gone over in class. Personality: Seems like a nice guy, but with a couple tweaks he could fix up his class. Unfortunately this rating is based off of what I experienced. My apologies.",12/17/2013,5,5.0,,1,Low,1,1.0,1,No,N/A,1112,N/A,,D+,,people,people
Not Mandatory,good,good,good,2,22580410,7,,good,4,ADV281,"Honestly these comments make me sick. Yes Professor Wise was strict but better to get a slap in the face your sophomore year then out in the real world. The only thing that this class did was show some people that they are not as perfect as they think they are. If you try hard, pay attention, and be proactive you will do great",12/16/2013,4,4.0,,4,Low,4,4.0,3,No,N/A,1112,N/A,,N/A,,people,people
Not Mandatory,average,good,poor,5,22567626,1,,poor,2,281,condescending person and awful teacher,12/16/2013,5,5.0,,1,Sorta interested,1.5,1.5,3,No,N/A,1112,N/A,,B,,person,people
Not Mandatory,poor,good,poor,4,22566575,0,,poor,1,ADV281,Basically everything below describes him to a T. He is a nice guy when you're not talking about the class but he is an awful teacher. I've gone to office hours many times and always feel more confused when I leave then when I came in. Avoid this guy at all costs.,12/15/2013,5,5.0,,1,Sorta interested,1,1.0,1,Yes,N/A,1112,N/A,,N/A,,people,people
Not Mandatory,average,good,poor,5,22566479,0,,poor,2,ADV281,"This class could've been great. Prof. Wise totally bombed it. He doesn't care that the class average on tests is ridiculously low. You are expected to complete his tests in 50 minutes with a lot of detail when a normal human being needs like 90 minutes. I attended like every lecture, took great notes, studied like a crazy person. Don't take it!",12/15/2013,5,5.0,,1,Meh,1.5,1.5,3,No,N/A,1112,N/A,,N/A,,people,people
Not Mandatory,poor,average,poor,4,22512645,0,,poor,1,ADV281,"Literally don't take a class with him. He is rude, disrespectful, and offers no type of assistance when the class needed it. Hard tests, and although the assignments are pretty straight forward they don't help your grade at all.",12/11/2013,3,3.0,,1,Meh,1,1.0,3,No,N/A,1112,N/A,,N/A,,people,people
