attendance,clarityColor,easyColor,helpColor,helpCount,id,notHelpCount,onlineClass,quality,rClarity,rClass,rComments,rDate,rEasy,rEasyString,rErrorMsg,rHelpful,rInterest,rOverall,rOverallString,rStatus,rTextBookUse,rWouldTakeAgain,sId,takenForCredit,teacher,teacherGrade,teacherRatingTags,unUsefulGrouping,usefulGrouping
Mandatory,good,good,good,0,25877917,0,,good,4,GCL147,Love the professor!! I did learn a great deal of knowledge from the class.,01/05/2016,4,4.0,,5,Really into it,4.5,4.5,1,Yes,N/A,1112,Yes,,A,,people,people
Mandatory,good,good,good,0,25653257,0,,good,5,GCL147,excellent class  with good discussions and nice professor who cares about the topic,12/11/2015,4,4.0,,4,Really into it,4.5,4.5,1,Yes,N/A,1112,Yes,,N/A,,people,people
Mandatory,good,average,good,0,25216519,0,,good,5,ENG396,Participation matters yes but this is a very caring and knowledgeable prof who is also funny and really nice.  Interesting class on different kind of detective lit made class very good as well.  ,09/29/2015,3,3.0,,4,Really into it,4.5,4.5,1,Yes,N/A,1112,Yes,,N/A,,people,people
N/A,good,average,good,0,25011751,0,,good,5,ENGL396,"Excellent professor; explains concepts well, encourages discussion-based participation, worked with a great list of books. Very considerate toward the students and their personal needs, too. ",07/02/2015,2,2.0,,5,It's my life,5,5.0,1,Yes,N/A,1112,Yes,,N/A,,people,people
N/A,average,average,average,1,14949746,0,,average,2,ENGL461,Calls on kids even if your hand isn't raised.  Thinks it's ok talking about stuff that no one has a clue about because that's part of learning or something.  Always lets class out too late.  At least 5 minutes if your lucky.  Nice lady but be able to adapt with her.  You'll work hard on a project and then have to do it the next week bc of no time.,11/06/2008,3,3.0,,3,Low,2.5,2.5,1,Yes,N/A,1112,N/A,,N/A,,people,person
N/A,good,average,good,0,11287010,0,,good,5,ENG300,She's amazing!,01/02/2006,3,3.0,,5,It's my life,5,5.0,1,N/A,N/A,1112,N/A,,N/A,,people,people
N/A,average,average,average,1,10680750,0,,average,3,ENGL300,"Yes, she's a vampire fanatic, but she is humorous and kind.  Many books of marginal quality.",11/01/2005,3,3.0,,3,Sorta interested,3,3.0,1,N/A,N/A,1112,N/A,,N/A,,people,person
