attendance,clarityColor,easyColor,helpColor,helpCount,id,notHelpCount,onlineClass,quality,rClarity,rClass,rComments,rDate,rEasy,rEasyString,rErrorMsg,rHelpful,rInterest,rOverall,rOverallString,rStatus,rTextBookUse,rWouldTakeAgain,sId,takenForCredit,teacher,teacherGrade,teacherRatingTags,unUsefulGrouping,usefulGrouping
Mandatory,good,poor,good,0,24103593,0,,good,5,CMN336,"I love Liesel! She's amazing! Her lectures are clear and easy to understand. She's always there to answer any questions you may have. If it is not on the study guide, it will not be on the exam. Exams are fair. Term paper due at the end but it is not bad at all. 3 exams. ",12/16/2014,1,1.0,,5,It's my life,5,5.0,1,No,N/A,1112,Yes,,A-,,people,people
N/A,good,poor,good,0,21025333,0,,good,5,CMN102,"Such a great teacher, very easy. Grades everything by completion, highly recommend her.",12/11/2012,1,1.0,,5,Low,5,5.0,1,No,N/A,1112,N/A,,N/A,,people,people
N/A,good,poor,good,0,18570278,0,,good,5,CMN112,Awesome class and teacher.,05/10/2011,1,1.0,,5,Sorta interested,5,5.0,1,No,N/A,1112,N/A,,N/A,,people,people
N/A,good,poor,good,0,18373997,0,,good,4,CMN111,"sooo easy, and such a cool chick. really interested in your success as a student, and definitely concerned about your grade. if you show that you have interest in the class and put forth the slightest bit of effort, you can get an A. there's a lot of busy work but that's unavoidable due to curriculum. best option for a CMN 111 teacher",04/07/2011,1,1.0,,5,Sorta interested,4.5,4.5,1,Yes,N/A,1112,N/A,,N/A,,people,people
N/A,good,poor,good,0,18079362,0,,good,4,CMN111,The class required a lot of work but the grading was very fair and the teacher does a good job of explaining everything she expects from the students on the assignments.,01/04/2011,1,1.0,,5,Sorta interested,4.5,4.5,1,No,N/A,1112,N/A,,N/A,,people,people
