attendance,clarityColor,easyColor,helpColor,helpCount,id,notHelpCount,onlineClass,quality,rClarity,rClass,rComments,rDate,rEasy,rEasyString,rErrorMsg,rHelpful,rInterest,rOverall,rOverallString,rStatus,rTextBookUse,rWouldTakeAgain,sId,takenForCredit,teacher,teacherGrade,teacherRatingTags,unUsefulGrouping,usefulGrouping
Mandatory,good,average,good,0,26562430,0,,good,4,MATH542,Good professor,05/13/2016,3,3.0,,5,N/A,4.5,4.5,1,No,N/A,1112,Yes,,Not sure yet,,people,people
Not Mandatory,average,average,good,0,25276245,0,,good,3,MATH 241,"Decent lecturer, has an accent but not too thick. Tests were rough. Nice arms",10/21/2015,3,3.0,,5,Sorta interested,4,4.0,1,No,N/A,1112,Yes,,N/A,,people,people
N/A,average,good,average,2,23318492,0,,average,2,MATH416,"The man is brilliant, and because he's so smart, he assumes we're at the same mathematical level as him.  Gives lots of long, detailed proofs very quickly, which led to lots of confusion.  Some homeworks took a couple hours and some took up to 7-8 hours to complete - definitely hardest aspect of the course.  Exams were not bad compared to the HW.",05/27/2014,5,5.0,,3,Sorta interested,2.5,2.5,1,No,N/A,1112,N/A,,N/A,,people,people
N/A,good,average,good,0,20390128,2,,good,5,MATH444,"Pleasant course experience. He makes elementary analysis quite interesting and easy to understand, while homework is not easy. You have to review lecture notes carefully to solve thoes problems. Exams are not very difficult and many problems in exams are homework problems and Theorems' proof in lectures. Will take his math540 course next semester.",06/07/2012,2,2.0,,5,Sorta interested,5,5.0,1,Yes,N/A,1112,N/A,,N/A,,people,people
N/A,good,average,good,1,19572377,0,,good,5,MATH424,"He makes analysis enjoyable! Go to class and take notes so that you will be fine. HWs are hard, which takes hours. Midterm and final is just couple proofs from the book and easy proofs which is similar to the HWs. Don't hesitate to take his course. He is the man!",12/19/2011,2,2.0,,5,It's my life,5,5.0,1,Yes,N/A,1112,N/A,,N/A,,people,person
N/A,good,good,good,0,15074460,0,,good,5,MATH285,"Outstanding. Lectures are very clear, quizzes and exams are not too bad.",11/30/2008,4,4.0,,5,Sorta interested,5,5.0,1,Yes,N/A,1112,N/A,,N/A,,people,people
N/A,good,average,good,1,12085509,0,,good,5,540,Best. 540. Teacher. Ever.  He makes analysis enjoyable.,07/18/2006,3,3.0,,5,Low,5,5.0,1,N/A,N/A,1112,N/A,,N/A,,people,person
