attendance,clarityColor,easyColor,helpColor,helpCount,id,notHelpCount,onlineClass,quality,rClarity,rClass,rComments,rDate,rEasy,rEasyString,rErrorMsg,rHelpful,rInterest,rOverall,rOverallString,rStatus,rTextBookUse,rWouldTakeAgain,sId,takenForCredit,teacher,teacherGrade,teacherRatingTags,unUsefulGrouping,usefulGrouping
Not Mandatory,average,average,average,0,24687350,0,,poor,3,A,"Does not respond to emails and breaks his own homework policy. Tests are okay, but it is impossible to memorize all the material. People say it is an easy class, but it is not that easy. TA's were not helpful either.",04/28/2015,2,2.0,,1,Low,2,2.0,1,No,N/A,1112,Yes,,A,,people,people
N/A,average,average,average,1,22457419,1,,poor,2,NPRE402,Class is straight forward. His teaching is useless although he appears to know quite a bit about the material. Don't get on his bad side- can be extremely unreasonable.,12/06/2013,2,2.0,,2,Sorta interested,2,2.0,1,No,N/A,1112,N/A,,N/A,,person,person
N/A,average,poor,good,0,22040832,0,,good,3,NPRE498,Good professor who is genuinely interested in teaching and having you learn. He is focused on having you actually go over the material and get all of the key points.,08/09/2013,1,1.0,,5,Really into it,4,4.0,1,Yes,N/A,1112,N/A,,N/A,,people,people
N/A,good,average,good,0,18166369,0,,good,5,NPRE402,Great professor.  He actually wants all his students to get A's.,01/21/2011,3,3.0,,5,Sorta interested,5,5.0,1,Yes,N/A,1112,N/A,,N/A,,people,people
N/A,good,average,good,0,18039139,0,,good,4,NPRE457,"Awesome professor, very helpful, but the beginning of the semester was quite boring. However, it got more interesting as the semester went on.",12/24/2010,2,2.0,,5,It's my life,4.5,4.5,1,Yes,N/A,1112,N/A,,N/A,,people,people
N/A,good,poor,good,0,17739916,0,,good,4,NPRE402,"Ragheb is a good teacher. The material is straight-forward and the tests are reasonably easy. If you need a tech elect for another engineering major, this is one of the easiest classes. Homework every day, but it's usually 15-20 minute assignments. He gets a bit angry when you ask him questions, so you feel slightly intimidated, but he's a good guy",11/07/2010,1,1.0,,4,Really into it,4,4.0,1,No,N/A,1112,N/A,,N/A,,people,people
N/A,good,average,good,0,16641058,0,,good,5,NPRE402,Very knowledgeable professor.  The course may seem a bit overwhelming and boring for non-majors but the exams are easy...especially if you have old sample exams. He puts a lot of effort and time into teaching.,12/25/2009,2,2.0,,5,Meh,5,5.0,1,No,N/A,1112,N/A,,N/A,,people,people
