attendance,clarityColor,easyColor,helpColor,helpCount,id,notHelpCount,onlineClass,quality,rClarity,rClass,rComments,rDate,rEasy,rEasyString,rErrorMsg,rHelpful,rInterest,rOverall,rOverallString,rStatus,rTextBookUse,rWouldTakeAgain,sId,takenForCredit,teacher,teacherGrade,teacherRatingTags,unUsefulGrouping,usefulGrouping
N/A,average,average,poor,0,11939283,0,,poor,2,COMM320,"Though the class is not difficult, the professor was not organized,the slides are always posted right before class,which started at 8 am. She is not a helpful and flexible professor,I didn't feel that she was knowledgeble about the subject.I wouldnt't recommend it.",05/24/2006,2,2.0,,1,Sorta interested,1.5,1.5,1,N/A,N/A,1112,N/A,,N/A,,people,people
N/A,poor,poor,poor,0,11803106,0,,poor,1,COMM320,She is an embarrassment to the College of Communications. I really hope that she presents this to the class on the first day as an example of pop culture.,05/02/2006,1,1.0,,1,Meh,1,1.0,1,N/A,N/A,1112,N/A,,N/A,,people,people
N/A,good,poor,good,0,11733198,0,,good,5,COMM320,"class is raelly easy, very interesting, and did i mention easy&#63;",04/19/2006,1,1.0,,5,It's my life,5,5.0,1,N/A,N/A,1112,N/A,,N/A,,people,people
N/A,good,average,good,0,11713120,0,,good,4,COMM320,"Really easy!! The professor is nice, reading is easy, exams are easy! TAKE IT!",04/15/2006,2,2.0,,4,Sorta interested,4,4.0,1,N/A,N/A,1112,N/A,,N/A,,people,people
N/A,average,average,average,0,11272936,0,,poor,2,COMM320,"This class really sucked. Spent an hour talking about a cartoon of a mermaid. She was totally unorganized. I had no idea what kind of grade I had and ended up with a B.  I thought the class should be easy, but I have a feeling alot of students ended up disappointed with their grades. DONT TAKE THIS CLASS",12/28/2005,3,3.0,,2,Low,2,2.0,1,N/A,N/A,1112,N/A,,N/A,,people,people
