attendance,clarityColor,easyColor,helpColor,helpCount,id,notHelpCount,onlineClass,quality,rClarity,rClass,rComments,rDate,rEasy,rEasyString,rErrorMsg,rHelpful,rInterest,rOverall,rOverallString,rStatus,rTextBookUse,rWouldTakeAgain,sId,takenForCredit,teacher,teacherGrade,teacherRatingTags,unUsefulGrouping,usefulGrouping
Mandatory,good,average,good,0,25186567,0,,good,4,CMN101,"You'll be a better speaker after this class. Mark is clear and easy to talk to. He's funny and laid back but he doesn't bend on the attendance policy or rules, so make sure you show up for class.",09/13/2015,3,3.0,,4,Sorta interested,4,4.0,1,Yes,N/A,1112,Yes,,B+,,people,people
N/A,good,poor,good,0,20347517,0,,good,5,CMN101,"Awesome CMN 101 instructor, made public speaking really fun and manageable.",05/25/2012,1,1.0,,5,Sorta interested,5,5.0,1,No,N/A,1112,N/A,,N/A,,people,people
N/A,good,poor,good,0,18886339,0,,good,5,CMN396,Mark is a really good instructor and we watched so much awesome stand up comedy. I love his dimples.,08/05/2011,1,1.0,,5,It's my life,5,5.0,1,Yes,N/A,1112,N/A,,N/A,,people,people
N/A,good,average,good,0,18801229,0,,good,5,CMN111,Mark is so funny and a really nice guy.  Too bad he's married.,07/08/2011,2,2.0,,5,Low,5,5.0,1,No,N/A,1112,N/A,,N/A,,people,people
N/A,good,average,good,0,17563255,0,,good,5,CMN321,"Mark is cool as heck. He knows what he wants from his students and when he feels that he's gotten that, everybody's happy and we can all go home. He's not one to fill up the class time with clutter. He has an agenda, and when it's done, we're done. He also has a realistic grasp on grading. He knows what he wants and communicates that clearly.",08/31/2010,3,3.0,,5,It's my life,5,5.0,1,No,N/A,1112,N/A,,N/A,,people,people
N/A,good,poor,good,0,17540197,0,,good,5,CMN101,Best instructor ever. Interesting class. None of his classes were boring. Easy to understand and also is a fair grader. Best class for cmn101,08/23/2010,1,1.0,,5,It's my life,5,5.0,1,Yes,N/A,1112,N/A,,N/A,,people,people
N/A,good,poor,good,0,16651984,0,,good,5,CMN101,"Awesome guy, understands the college student and doesnt expect one to be only focused on that class. The only downside was that this was my 8am class but other than that it was an awesome class and I learned a lot",12/28/2009,1,1.0,,5,Sorta interested,5,5.0,1,Yes,N/A,1112,N/A,,N/A,,people,people
N/A,good,average,good,0,15402052,0,,good,5,COM111,Very funny guy with good humor. Grades realistically and will be tough but will tell you what hes looking for. Easy A/B,01/22/2009,2,2.0,,4,Really into it,4.5,4.5,1,No,N/A,1112,N/A,,N/A,,people,people
