attendance,clarityColor,easyColor,helpColor,helpCount,id,notHelpCount,onlineClass,quality,rClarity,rClass,rComments,rDate,rEasy,rEasyString,rErrorMsg,rHelpful,rInterest,rOverall,rOverallString,rStatus,rTextBookUse,rWouldTakeAgain,sId,takenForCredit,teacher,teacherGrade,teacherRatingTags,unUsefulGrouping,usefulGrouping
Mandatory,average,average,average,2,26639545,0,,poor,2,CI402,"Unclear  requirements . Makes some fairly offensive remarks on sensitive issues in class, which is surprising as it is an education class. Says that he will provide help and feedback but then doesn't end up doing it. Creates deadlines and then doesn't stick with them, but the class still turns in everything on the original due date. Meh.",05/23/2016,3,3.0,,2,N/A,2,2.0,1,No,N/A,1112,Yes,,N/A,,people,people
Mandatory,average,poor,average,0,24623537,0,,average,3,CI473,He seems approachable but very disrespectful with other ideas. It is pretty annoying. It is 1-credit course and super easy to pass. A lot of group work and discussion. You learn as much as 1-credit course should be.,04/19/2015,1,1.0,,2,Meh,2.5,2.5,1,No,N/A,1112,Yes,,A,,people,people
Mandatory,good,poor,good,1,23749365,1,,good,5,ENG7,Awesome Teacher ,11/05/2014,1,1.0,,5,It's my life,5,5.0,1,Yes,Yes,1112,N/A,,A+,,person,person
N/A,average,poor,average,2,20149364,0,,poor,3,CI401,Was not interested in the students as people. Did not provide useful techniques to utilize in the field. More concerned with past experiences and life instead of the present. Boring.,04/29/2012,1,1.0,,1,Sorta interested,2,2.0,1,No,N/A,1112,N/A,,N/A,,people,people
N/A,good,poor,good,1,19140817,0,,good,4,CI401,"Keeps you pretty interested, he is passionate about what he is teaching. Good class.",11/01/2011,1,1.0,,4,Really into it,4,4.0,1,No,N/A,1112,N/A,,N/A,,people,person
