attendance,clarityColor,easyColor,helpColor,helpCount,id,notHelpCount,onlineClass,quality,rClarity,rClass,rComments,rDate,rEasy,rEasyString,rErrorMsg,rHelpful,rInterest,rOverall,rOverallString,rStatus,rTextBookUse,rWouldTakeAgain,sId,takenForCredit,teacher,teacherGrade,teacherRatingTags,unUsefulGrouping,usefulGrouping
Mandatory,good,average,good,0,24812019,0,,good,5,CMN323,"Class was out of 1000 points, attendance was mandatory, and there are no exams. There is a decent amount of work in the class, but none of it is too difficult. You just have to be willing to put in the time and effort, and there is no reason you shouldn't get an A. He's a great guy that wants all his students to do well.",05/12/2015,2,2.0,,5,Really into it,5,5.0,1,No,N/A,1112,Yes,,A,,people,people
Mandatory,good,average,good,0,22316167,0,,good,5,CMN111,"Cool guy, if you are in his class and got to his study hours he tends to give you better grades on your papers",11/14/2013,2,2.0,,5,It's my life,5,5.0,1,Yes,N/A,1112,N/A,,A,,people,people
N/A,good,average,good,0,22195462,0,,good,5,CMN111,"Before going into CMN111, I thought the class was going to be torture. But, Matt made the class enjoyable to the point where I actually started looking forward to it. He's very professional and has quite the sense of humor. Definitely looking forward to CMN112 if I get him!",10/20/2013,2,2.0,,5,Sorta interested,5,5.0,1,Yes,N/A,1112,N/A,,N/A,,people,people
N/A,average,average,average,0,21990722,0,,average,3,CMN111,"Matt is a pretty cool guy. I liked him as a teacher, wasn't too hard on you but actually helped to improve my speaking and writing skills. definitely would recommend taking his class. lol just don't ask for a letter of recommendation because he gets a little shady on you.",07/23/2013,2,2.0,,3,Sorta interested,3,3.0,1,Yes,N/A,1112,N/A,,N/A,,people,people
N/A,poor,good,average,0,21398617,0,,poor,1,CMN111,"Be careful if you ever get him as a teacher. Yes, he's professional and classy, but he's teaching more for the sake of his own pursuits and less for the class's learning experience. Super difficult grader.",03/09/2013,5,5.0,,3,Really into it,2,2.0,1,No,N/A,1112,N/A,,N/A,,people,people
N/A,good,average,good,0,21190384,0,,good,5,CMN111,Mr. Pitchford is an awesome instructor. CMN 111 was my favorite class in my first semester at UIUC. He made the class great by relating to us. He's classy and professional; you can't go wrong with him.,12/31/2012,3,3.0,,5,Really into it,5,5.0,1,Yes,N/A,1112,N/A,,N/A,,people,people
