attendance,clarityColor,easyColor,helpColor,helpCount,id,notHelpCount,onlineClass,quality,rClarity,rClass,rComments,rDate,rEasy,rEasyString,rErrorMsg,rHelpful,rInterest,rOverall,rOverallString,rStatus,rTextBookUse,rWouldTakeAgain,sId,takenForCredit,teacher,teacherGrade,teacherRatingTags,unUsefulGrouping,usefulGrouping
Not Mandatory,good,good,average,0,24345622,0,,good,4,AE416,"1. You will learn a lot! a lot! and this is the best part about this course 2. He teaches most things out of experience, hard to find those things in books, which is good.  3. Makes you work hard! A lot of stuff is crammed into one single course and hence the lectures are fast paced. Homeworks are long. Bad handwriting, and even worse drawings.",01/29/2015,4,4.0,,3,Really into it,3.5,3.5,1,Yes,N/A,1112,Yes,,N/A,,people,people
N/A,good,good,good,2,19733542,0,,good,4,AE416,"Very effective in teaching. Tries to develop the conceptual thinking about aerodynamics instead of just solving problems. This will not be an easy class. Very homework heavy and time consuming. However, You will learn A LOT!",01/16/2012,5,5.0,,4,Sorta interested,4,4.0,1,Yes,N/A,1112,N/A,,N/A,,people,people
N/A,average,good,average,1,16326100,0,,poor,2,AE416,"I'd have a beer with him, but probably not pick him as a professor. Knowledgeable, but not the best laid out lectures.",11/06/2009,4,4.0,,2,Really into it,2,2.0,1,No,N/A,1112,N/A,,N/A,,people,person
N/A,average,average,average,1,16313688,1,,poor,3,AE100,Worst class ever. He gives a ton of pointless homework and has powerpoints that no one is interested in.,11/04/2009,3,3.0,,1,Sorta interested,2,2.0,1,No,N/A,1112,N/A,,N/A,,person,person
N/A,good,average,good,0,10848671,0,,good,5,APPLIEDAERO,"The work load is quite high, but the assignments and lectures are very interesting.  Selig was always well prepared for class and clearly put a lot of effort into it.  One of the few profs in AE who promotes class discussion.",11/08/2005,3,3.0,,4,It's my life,4.5,4.5,1,N/A,N/A,1112,N/A,,N/A,,people,people
