attendance,clarityColor,easyColor,helpColor,helpCount,id,notHelpCount,onlineClass,quality,rClarity,rClass,rComments,rDate,rEasy,rEasyString,rErrorMsg,rHelpful,rInterest,rOverall,rOverallString,rStatus,rTextBookUse,rWouldTakeAgain,sId,takenForCredit,teacher,teacherGrade,teacherRatingTags,unUsefulGrouping,usefulGrouping
N/A,good,average,good,0,23610534,0,,good,5,PHYS508,Has a meticulous style of teaching which I like. The formulation is build from the basics fundamentals and is very easy to follow. Course notes are well written  ,09/24/2014,3,3.0,,4,Really into it,4.5,4.5,1,Yes,N/A,1112,Yes,,N/A,,people,people
Not Mandatory,average,average,average,0,23264536,0,,average,3,PHYS211,"In this class, the learning is basically all done through the pre-lectures and discussion sections. That being said, Professor Stone could have done a much better job at connecting all of the material and contributing to the learning process. He was a very average professor.",05/16/2014,3,3.0,,2,Sorta interested,2.5,2.5,1,Yes,N/A,1112,N/A,,A-,,people,people
N/A,poor,good,poor,0,21312970,0,,poor,1,PHYS508,"condescending during office hours, very cryptic homework solutions, and unreasonable test grading procedures (i.e. no partial credit, errors don't propagate).  Usually talks to the blackboard, sometimes stalls for a few minutes at a time because he's trying to understand his own lecture notes. Do not take this class.",01/31/2013,5,5.0,,1,Sorta interested,1,1.0,1,No,N/A,1112,N/A,,N/A,,people,people
N/A,good,good,good,0,13813179,0,,good,4,PHYSMMA,Knows a lot of stuff but his lectures are boring.  More than half of the time I find myself sleeping at the end of his lecture.  Much better off just reading his own PDF textbook.  But the assignments were all very interesting we learned a lot from them.,12/12/2007,4,4.0,,4,Really into it,4,4.0,1,Yes,N/A,1112,N/A,,N/A,,people,people
N/A,average,good,average,0,12752540,0,,average,2,PHYS212,"He ability to explain material in lecture is very weak, he is also boring. try to take naomi makins for phys 212 if possible, so is great",01/10/2007,4,4.0,,3,Really into it,2.5,2.5,3,No,N/A,1112,N/A,,N/A,,people,people
N/A,good,good,average,0,12534555,0,,good,4,PHYS212,No Comments,12/06/2006,5,5.0,,3,Really into it,3.5,3.5,1,No,N/A,1112,N/A,,N/A,,people,people
N/A,good,good,good,0,12276448,0,,good,4,MMA598,No Comments,10/10/2006,5,5.0,,4,Really into it,4,4.0,1,Yes,N/A,1112,N/A,,N/A,,people,people
