attendance,clarityColor,easyColor,helpColor,helpCount,id,notHelpCount,onlineClass,quality,rClarity,rClass,rComments,rDate,rEasy,rEasyString,rErrorMsg,rHelpful,rInterest,rOverall,rOverallString,rStatus,rTextBookUse,rWouldTakeAgain,sId,takenForCredit,teacher,teacherGrade,teacherRatingTags,unUsefulGrouping,usefulGrouping
N/A,good,poor,good,0,14563171,0,,good,4,RST230,Really nice teacher. You have to memorize a lot of stuffs but exams are pretty easy. There are also some interesting assignments experiencing minority groups. Very good choice for gen ed.,06/06/2008,1,1.0,,5,Really into it,4.5,4.5,1,No,N/A,1112,N/A,,N/A,,people,people
N/A,good,average,good,0,11884739,0,,good,4,KIN230,She is really really sweet!! This class is not hard at all and actually very interesting. She tells you exactly what will be on every exam.,05/14/2006,2,2.0,,5,It's my life,4.5,4.5,1,N/A,N/A,1112,N/A,,N/A,,people,people
N/A,average,average,good,0,11125898,0,,good,3,RSTKINES230,"Not difficult, sexy voice!!!",12/12/2005,2,2.0,,5,Meh,4,4.0,1,N/A,N/A,1112,N/A,,N/A,,people,people
N/A,average,average,average,0,3551296,0,,average,3,LEIS230,talks w/ a polish accent.  can't understand her all the time.,04/04/2005,2,2.0,,3,Really into it,3,3.0,1,N/A,N/A,1112,N/A,,N/A,,people,people
N/A,good,good,average,0,3190458,0,,good,5,501,No Comments,01/10/2005,5,5.0,,2,Meh,3.5,3.5,1,N/A,N/A,1112,N/A,,N/A,,people,people
N/A,good,good,good,0,1184366,0,,good,5,LEIST401,very good looking;so other qualities don't matter.very left wing.,10/12/2003,5,5.0,,5,N/A,5,5.0,1,N/A,N/A,1112,N/A,,N/A,,people,people
