attendance,clarityColor,easyColor,helpColor,helpCount,id,notHelpCount,onlineClass,quality,rClarity,rClass,rComments,rDate,rEasy,rEasyString,rErrorMsg,rHelpful,rInterest,rOverall,rOverallString,rStatus,rTextBookUse,rWouldTakeAgain,sId,takenForCredit,teacher,teacherGrade,teacherRatingTags,unUsefulGrouping,usefulGrouping
N/A,average,average,average,0,11707029,0,,average,2,ECE290,"Not nearly as good as Brown.   Less clear in lecture, thick accent, homework straight out of the book rather than custom-made, and I basically had to learn most of the second half of the course by reading the book which defeats the purpose of having a professor.",04/13/2006,3,3.0,,3,It's my life,2.5,2.5,1,N/A,N/A,1112,N/A,,N/A,,people,people
N/A,poor,good,poor,0,11599430,0,,poor,1,ECE290,Very difficult exams and you can't understand a word the guy says during his monotonous lectures.  If I could grade this guy I would give him an F--.,03/22/2006,4,4.0,,1,Sorta interested,1,1.0,1,N/A,N/A,1112,N/A,,N/A,,people,people
N/A,average,average,average,0,10850668,0,,good,3,ECE290,"He taught the material that was more interesting to me than Brown, and his homeworks and exams were much more straigtforward than hers were.",11/08/2005,2,2.0,,4,Really into it,3.5,3.5,1,N/A,N/A,1112,N/A,,N/A,,people,people
N/A,average,poor,average,0,2197034,0,,average,2,ECE290,hard to understand,05/27/2004,1,1.0,,4,N/A,3,3.0,1,N/A,N/A,1112,N/A,,N/A,,people,people
N/A,average,average,average,0,2128934,0,,poor,2,ECE110,"The tests he writes are easy, but he's a horrible lecturer.",05/12/2004,2,2.0,,2,N/A,2,2.0,3,N/A,N/A,1112,N/A,,N/A,,people,people
N/A,good,average,good,0,2109191,0,,good,4,ECE290,but have Ahuja make the test :),05/07/2004,2,2.0,,4,N/A,4,4.0,1,N/A,N/A,1112,N/A,,N/A,,people,people
N/A,poor,good,poor,0,2075579,0,,poor,1,ECE290,professor brown should teach this whole class,05/03/2004,5,5.0,,1,N/A,1,1.0,1,N/A,N/A,1112,N/A,,N/A,,people,people
N/A,average,average,average,0,1046284,0,,average,2,ECE290,No Comments,07/11/2003,3,3.0,,3,N/A,2.5,2.5,1,N/A,N/A,1112,N/A,,N/A,,people,people
N/A,good,average,good,0,979964,0,,good,5,EE,No Comments,05/23/2003,3,3.0,,5,N/A,5,5.0,1,N/A,N/A,1112,N/A,,N/A,,people,people
