attendance,clarityColor,easyColor,helpColor,helpCount,id,notHelpCount,onlineClass,quality,rClarity,rClass,rComments,rDate,rEasy,rEasyString,rErrorMsg,rHelpful,rInterest,rOverall,rOverallString,rStatus,rTextBookUse,rWouldTakeAgain,sId,takenForCredit,teacher,teacherGrade,teacherRatingTags,unUsefulGrouping,usefulGrouping
N/A,good,good,good,0,16030975,0,,good,5,CHEM1,"She made section worth going to.  Made hard topics in chemistry much nicer, since they came in such an attractive package!  Seriously, she is crazy hot.  I don't know why she is in science.  She should totally be a FHM model",07/11/2009,5,5.0,,4,It's my life,4.5,4.5,1,Yes,N/A,1112,N/A,,N/A,,people,people
N/A,average,average,average,0,15868448,0,,average,2,BIOCH492,"It's surprising to me, the level of credibility this person is given by the number of publications that have her names of them. I wouldn't look closely at the papers because of my experience with this person. Took me a while to recover from this exposure.",05/19/2009,3,3.0,,3,Low,2.5,2.5,1,No,N/A,1112,N/A,,N/A,,people,people
N/A,good,good,good,0,15365566,0,,good,5,CHEM101,"Very helpful, and attractive. The best TA EVAR",01/13/2009,5,5.0,,5,It's my life,5,5.0,1,Yes,N/A,1112,N/A,,N/A,,people,people
N/A,poor,poor,average,0,14767861,0,,poor,1,CHEM105,"Yelled me in the face a few times, if someone can make her care, will work wonders, if not completely useless, can do math in her head in my experience, oddest human being I've met in my entire life, be nice to her, probably got fed up, if you didn't see the best side of her, she's allowed that once a year, from now on.  No one's perfect.",08/23/2008,1,1.0,,3,Meh,2,2.0,1,Yes,N/A,1112,N/A,,N/A,,people,people
N/A,average,average,poor,0,11394093,0,,poor,2,CHEM105,"she was not prepared for the lab, told us the wrong things to do multiple times, nmaking us need to start over and then told us we weren't prepared enough when we did not finish the lab on time, she did not help much when asked a question and didnt seem to know much or care much about questions students had",01/20/2006,2,2.0,,1,Low,1.5,1.5,1,N/A,N/A,1112,N/A,,N/A,,people,people
