attendance,clarityColor,easyColor,helpColor,helpCount,id,notHelpCount,onlineClass,quality,rClarity,rClass,rComments,rDate,rEasy,rEasyString,rErrorMsg,rHelpful,rInterest,rOverall,rOverallString,rStatus,rTextBookUse,rWouldTakeAgain,sId,takenForCredit,teacher,teacherGrade,teacherRatingTags,unUsefulGrouping,usefulGrouping
Mandatory,poor,good,average,0,26632175,0,,poor,1,MATH553,"Engineering student for Math553 PDE here please, 1st, are you familiar with lebesgue convergence theorem, n-dimension sphere surface area and many other concepts in functional analysis?  if not, forget about this course. 2nd, you care about why the solution to a PDE exists and why it's unique rather than how to solve it?  if not, forget about it.",05/22/2016,5,5.0,,3,N/A,2,2.0,1,Yes,N/A,1112,Yes,,N/A,,people,people
Not Mandatory,good,good,good,0,25708975,0,,good,5,MATH441,"Dr. Tzirakis is an amazing professor who loves the material he teaches. It is very difficult to make ordinary differential equations interesting, but his lectures and applications make the course (while more abstract than MATH 285) much more useful. Take the course with him.",12/15/2015,4,4.0,,5,It's my life,5,5.0,1,Yes,N/A,1112,Yes,,N/A,,people,people
Mandatory,good,good,good,0,24973481,0,,good,4,MATH543,"He is a great Professor, knows the material very well, approachable, nice person!! A lot of HWs!! good grading , very hard ",06/17/2015,4,4.0,,5,Really into it,4.5,4.5,1,Yes,N/A,1112,Yes,,A,,people,people
N/A,good,poor,good,0,23514618,0,,good,4,MATH441,"Friendly personality. Not arrogant like some higher level professors. Likes to lecture without looking too closely at notes so he'll make a few mistakes, but takes student corrections well. Has an accent but easy to understand after a few classes. Explained concepts well. Tests were very straightforward and similar to homework and study guide.",08/09/2014,1,1.0,,4,Really into it,4,4.0,1,Yes,N/A,1112,N/A,,N/A,,people,people
N/A,average,poor,average,0,21205476,0,,good,2,MATH442,"Good professor. His questions come straight from homework. His grading was fair, and he tried to help the student out frequently.",01/03/2013,1,1.0,,5,Really into it,3.5,3.5,1,Yes,N/A,1112,N/A,,N/A,,people,people
N/A,average,average,average,0,15979409,0,,average,3,MATH441,Pretty easy class. Exams are only a few problems so make sure you know how to do everything on the study guide as well as covered in the homework. Not the best partial credit either. He doesn't try to mess you up. He's just making sure you know the material that he taught. Many 100's were achieved on exams in my class.,06/20/2009,2,2.0,,3,Really into it,3,3.0,1,Yes,N/A,1112,N/A,,N/A,,people,people
N/A,good,average,good,0,15605757,0,,good,4,MATH441,"He's a nice guy. His exams are on study guides and homework. Make sure you study all problems on your study guide and homework, then you can get 100/100",04/04/2009,2,2.0,,4,Really into it,4,4.0,1,Yes,N/A,1112,N/A,,N/A,,people,people
