attendance,clarityColor,easyColor,helpColor,helpCount,id,notHelpCount,onlineClass,quality,rClarity,rClass,rComments,rDate,rEasy,rEasyString,rErrorMsg,rHelpful,rInterest,rOverall,rOverallString,rStatus,rTextBookUse,rWouldTakeAgain,sId,takenForCredit,teacher,teacherGrade,teacherRatingTags,unUsefulGrouping,usefulGrouping
N/A,average,poor,good,0,15225413,0,,good,3,ECON103,"Good TA to have definitely. Had him last year and he explains everything you need to know and doesn't give you useless stuff. He also explains very clearly. As some of you will find out, you'll be lucky to have TA's like Odilon(i.e: ECON 302).",12/17/2008,1,1.0,,5,Meh,4,4.0,1,No,N/A,1112,N/A,,N/A,,people,people
N/A,poor,average,poor,0,14965115,0,,poor,1,ECON503,I had classes with him last semester. He is a nice guy and good TA but he needs to work in his English and clarity. A little confuse sometimes.,11/10/2008,3,3.0,,2,Sorta interested,1.5,1.5,1,Yes,N/A,1112,N/A,,N/A,,people,people
N/A,good,poor,good,0,12793492,0,,good,5,ECON103,The best TA I have ever had! He is really good in explaining and he gives just that necessary part that will be on the mid-term and final!,01/18/2007,1,1.0,,5,It's my life,5,5.0,1,Yes,N/A,1112,N/A,,N/A,,people,people
N/A,good,average,good,0,12521218,0,,good,5,ECON103,Pretty interesting and good at explaining what you don't understand.,12/05/2006,3,3.0,,4,Really into it,4.5,4.5,1,No,N/A,1112,N/A,,N/A,,people,people
N/A,average,average,average,0,11326774,0,,good,3,ECON103,Very good TA,01/09/2006,3,3.0,,4,Sorta interested,3.5,3.5,1,N/A,N/A,1112,N/A,,N/A,,people,people
