attendance,clarityColor,easyColor,helpColor,helpCount,id,notHelpCount,onlineClass,quality,rClarity,rClass,rComments,rDate,rEasy,rEasyString,rErrorMsg,rHelpful,rInterest,rOverall,rOverallString,rStatus,rTextBookUse,rWouldTakeAgain,sId,takenForCredit,teacher,teacherGrade,teacherRatingTags,unUsefulGrouping,usefulGrouping
N/A,average,average,average,0,17304814,0,,average,2,MATH231,"He was very hard to understand. You only had to attend lecture if you wanted to know what was on the test since he followed the book's examples to the dot. Get a good section TA. Hourly exams were easy; however, the final was insane with the average being 45%. He is very nice and tries to work through the communication barrier though.",06/05/2010,2,2.0,,4,It's my life,3,3.0,1,Yes,N/A,1112,N/A,,N/A,,people,people
N/A,poor,good,poor,0,17147921,0,,poor,1,MATH347,"SADDEST CLASS I HAVE EVER TAKEN. Everyday in class, it's just sad... I don't understand him at all. Again, no one that ever speaks English ever taught this class...",05/07/2010,5,5.0,,1,Sorta interested,1,1.0,1,Yes,N/A,1112,N/A,,N/A,,people,people
N/A,average,average,average,0,16858649,0,,average,2,MATH221,"By far the hardest teacher to understand. Fun and nice guy, just can't understand him.",03/09/2010,3,3.0,,4,Sorta interested,3,3.0,1,Yes,N/A,1112,N/A,,N/A,,people,people
N/A,poor,good,poor,0,16737151,0,,poor,1,MATH347,"Lectures very hard to understand, exams are hard. Don't waste your time going in for office hours, really hard to understand. 347 is already a difficult class.. the language barrier made this class 4x harder.",01/19/2010,4,4.0,,1,Sorta interested,1,1.0,1,Yes,N/A,1112,N/A,,N/A,,people,people
N/A,average,good,average,0,16550002,0,,poor,2,MATH231,Exams are really difficult.  His lectures are hard to understand.,12/14/2009,5,5.0,,2,Really into it,2,2.0,1,No,N/A,1112,N/A,,N/A,,people,people
N/A,poor,good,poor,0,16387855,0,,poor,1,MATH231,very hard to understand.  doesn't help very much when u have a problem in class. partly because he cant understand us... and partly because he prolly doesn't care.,11/17/2009,4,4.0,,1,Sorta interested,1,1.0,1,No,N/A,1112,N/A,,N/A,,people,people
N/A,good,average,good,0,11834861,0,,good,4,MATH385,"Panki's lectures are pretty worthless in terms of listening to him talk, but his notes are priceless. They match up perfectly to the homework and tests. Tests are pretty easy, too, he tells you exactly what's on them, more or less, and he's very very helpful if you need assistance. Overall, I highly recommend him.",05/06/2006,3,3.0,,5,Really into it,4.5,4.5,1,N/A,N/A,1112,N/A,,N/A,,people,people
N/A,average,poor,good,0,11737427,0,,good,3,MATH385,His lectures were sometimes unclear but overall he was a good teacher and his exams were pretty easy.,04/20/2006,1,1.0,,5,Sorta interested,4,4.0,1,N/A,N/A,1112,N/A,,N/A,,people,people
N/A,average,average,good,0,11379694,0,,good,3,MATH461,"His lecture is not quite clear at times. However, he is very willing to help students and the level of difficulty of his tests is not bad.",01/17/2006,3,3.0,,5,Meh,4,4.0,1,N/A,N/A,1112,N/A,,N/A,,people,people
