attendance,clarityColor,easyColor,helpColor,helpCount,id,notHelpCount,onlineClass,quality,rClarity,rClass,rComments,rDate,rEasy,rEasyString,rErrorMsg,rHelpful,rInterest,rOverall,rOverallString,rStatus,rTextBookUse,rWouldTakeAgain,sId,takenForCredit,teacher,teacherGrade,teacherRatingTags,unUsefulGrouping,usefulGrouping
Mandatory,good,average,good,0,24004027,0,,good,5,SPAN395,"AMAZING TEACHER. SUPER FAIR, HELPFUL AND SHE DEFINITELY KNOW WHAT SHE IS TALKING ABOUT. ALWAYS ENGAGED. ",12/09/2014,2,2.0,,5,Really into it,5,5.0,1,No,N/A,1112,Yes,,A,,people,people
Mandatory,good,average,good,0,23210369,0,,good,4,SPAN250,Class was pretty easy. Make sure you really participate because you do get graded on that. She's a very nice lady and really knows what she's talking about. Read ALL the stories too!,05/09/2014,2,2.0,,5,Really into it,4.5,4.5,1,Yes,N/A,1112,N/A,,A,,people,people
Mandatory,good,average,good,0,22885450,0,,good,5,SPAN250,"She's honestly the nicest. She's always ready to help her students, and she's very approachable. Also, she's probably one of the fairest professors I've ever had. Ugh. She's great.",03/04/2014,3,3.0,,5,It's my life,5,5.0,1,Yes,N/A,1112,N/A,,N/A,,people,people
Mandatory,good,poor,good,0,22113292,0,,good,5,SPAN250310,"Pilar is one of my favourite professors at UIUC. She is extremely knowledgeable and approachable; she's always willing to accommodate and help her students. I liked her so much for 250, I took 310 with her... as did half of my 310 class. If you show up and are engaged, you shouldn't have any problem getting at least an A.",09/09/2013,1,1.0,,5,Really into it,5,5.0,1,Yes,N/A,1112,N/A,,A+,,people,people
N/A,good,poor,good,0,21918652,0,,good,5,SPAN250,Very very clear about expectations and the tests are very easy if you attend class. Attendance points are taken but you can miss a few days no problem. As long as you pay attention in class you should get an A.,06/24/2013,1,1.0,,5,It's my life,5,5.0,1,Yes,N/A,1112,N/A,,N/A,,people,people
