attendance,clarityColor,easyColor,helpColor,helpCount,id,notHelpCount,onlineClass,quality,rClarity,rClass,rComments,rDate,rEasy,rEasyString,rErrorMsg,rHelpful,rInterest,rOverall,rOverallString,rStatus,rTextBookUse,rWouldTakeAgain,sId,takenForCredit,teacher,teacherGrade,teacherRatingTags,unUsefulGrouping,usefulGrouping
N/A,good,poor,good,0,19744615,0,,good,4,STAT420,"OK prof, his teaching is not that great but the exams have at least 1 or 2 problems pulled straight from the practice exam. Very easy A. Also, he is very helpful during office hours.",01/18/2012,1,1.0,,4,Sorta interested,4,4.0,1,Yes,N/A,1112,N/A,,N/A,,people,people
N/A,good,poor,good,0,18056202,0,,good,4,STAT425,"It's easy, I heard that a lot of people saying that Jeff Douglas in the spring semester is much easier. But this class was easy for me too. Studying lecture notes he posts online and practice exams, you'll be totally fine for midterms. For finals, you'll have to really  understand materials. Enjoyed bonus 5points per each midterms!",12/28/2010,1,1.0,,4,Sorta interested,4,4.0,1,Yes,N/A,1112,N/A,,N/A,,people,people
N/A,average,average,average,0,17938825,0,,average,3,STAT425,"This class is essentially a repeat of Stat 420 (a prereq) so it's pretty easy. Posts practice exams before actual exam which are pretty much the same (usually have bonus problems). HOWEVER, the practice final is NOTHING LIKE THE ACTUAL FINAL. The actual final was extremely hard and most of the questions on experimental design were ambiguous.",12/14/2010,2,2.0,,3,Really into it,3,3.0,1,No,N/A,1112,N/A,,N/A,,people,people
N/A,average,average,average,0,17250622,0,,good,3,STAT400,The exams ranged widely in difficulty.  The first midterm was pretty easy.  The second exam was ridiculously easy.  Then the final was impossible.,05/21/2010,2,2.0,,4,Sorta interested,3.5,3.5,1,Yes,N/A,1112,N/A,,N/A,,people,people
N/A,average,poor,average,0,17047361,1,,average,3,STAT400,"Incredibly easy as long as you do your homework and read your textbook from time to time. If you happen to know some basic statistical functions on your Ti-83/84, then you can blow through the statistical section quickly. Exams are pieces of cake. 1 equally weighted bonus question on exams = HUGE EXAM AVERAGES.",04/23/2010,1,1.0,,3,Sorta interested,3,3.0,1,Yes,N/A,1112,N/A,,N/A,,person,people
N/A,good,poor,good,0,16999145,0,,good,4,STAT400,"It's super easy class if it's taught by him. You must take it. For example, the average of exam score was 65 out of 70. Do you see&#63;&#63;&#63;&#63;&#63;&#63;&#63;&#63;&#63;&#63;&#63; Take it if you can !",04/15/2010,1,1.0,,4,Sorta interested,4,4.0,1,No,N/A,1112,N/A,,N/A,,people,people
