attendance,clarityColor,easyColor,helpColor,helpCount,id,notHelpCount,onlineClass,quality,rClarity,rClass,rComments,rDate,rEasy,rEasyString,rErrorMsg,rHelpful,rInterest,rOverall,rOverallString,rStatus,rTextBookUse,rWouldTakeAgain,sId,takenForCredit,teacher,teacherGrade,teacherRatingTags,unUsefulGrouping,usefulGrouping
N/A,good,average,good,0,25841973,0,,good,5,ABE224,Great class!  The learning objectives were clear and Dr. Kalita does a good job at generating student interest in the material.,12/29/2015,2,2.0,,5,Really into it,5,5.0,1,Yes,N/A,1112,Yes,,N/A,,people,people
Mandatory,good,poor,good,0,24182609,0,,good,5,ABE199,"I had Dr. Kalita for an honors class ""water in the global environment"". Lectures are 3 hours, but very interesting and he kept the class engaged.  We took a few cool field trips (best one: NGRREC near St. Louis). Very passionate about his field and has a good sense of humor.  It was interesting to hear first-hand stories from him about this field",12/24/2014,1,1.0,,5,It's my life,5,5.0,1,No,N/A,1112,Yes,,A+,,people,people
N/A,good,average,good,0,19717976,0,,good,4,ABE223,Amazing professor. Really cares about the students and tests were really easy since it's open book open note. Only problem is he never gives back exams on a timely matter.,01/12/2012,2,2.0,,5,Really into it,4.5,4.5,1,Yes,N/A,1112,N/A,,N/A,,people,people
N/A,good,average,good,0,17055883,0,,good,5,ABE221,This is one of the greatest professor in the ABE department.He really cares about each and every student.,04/25/2010,2,2.0,,5,It's my life,5,5.0,1,Yes,N/A,1112,N/A,,N/A,,people,people
N/A,good,average,good,0,15626216,0,,good,4,ABE456,Awesome teacher.  Wants to make sure students know the material.  Does a great job of relating material to real world experience.,04/08/2009,2,2.0,,5,Really into it,4.5,4.5,1,Yes,N/A,1112,N/A,,N/A,,people,people
N/A,average,average,poor,0,15282261,0,,poor,2,ABE221,"This was the most boring class I have ever taken in college, and while at first Dr. Kalita's high energy and positive attitude made the class better... He eventually just became annoying. It's really hard to understand what he's saying, but usually he writes stuff down. Tests were basically all from the notes, but you should still study.",12/26/2008,2,2.0,,1,Sorta interested,1.5,1.5,1,Yes,N/A,1112,N/A,,N/A,,people,people
N/A,good,poor,good,0,11418235,0,,good,4,ABE,"Makes sure students understand the material, is very straight forward about tests and homework.",01/25/2006,1,1.0,,5,Really into it,4.5,4.5,1,N/A,N/A,1112,N/A,,N/A,,people,people
N/A,good,average,good,0,10843620,0,,good,4,ABE221,He is very easy to get along with and interested in making sure the students understand the content discussed during class.,11/07/2005,2,2.0,,5,Really into it,4.5,4.5,1,N/A,N/A,1112,N/A,,N/A,,people,people
