attendance,clarityColor,easyColor,helpColor,helpCount,id,notHelpCount,onlineClass,quality,rClarity,rClass,rComments,rDate,rEasy,rEasyString,rErrorMsg,rHelpful,rInterest,rOverall,rOverallString,rStatus,rTextBookUse,rWouldTakeAgain,sId,takenForCredit,teacher,teacherGrade,teacherRatingTags,unUsefulGrouping,usefulGrouping
Mandatory,good,average,good,0,24466291,0,,good,4,BADM350,"Ram is the best. His class is boring JUST because the material can get a little boring, but he tries to make it as fun as possible. It was such an easy A, he WANTS to give you a good grade. If he hears feedback that the test was hard he curves. ",03/16/2015,2,2.0,,5,Sorta interested,4.5,4.5,1,No,N/A,1112,Yes,,A,,people,people
N/A,good,poor,good,0,21781165,0,,good,5,BADM350,Very good teacher. Cares for students,05/17/2013,1,1.0,,5,It's my life,5,5.0,1,Yes,N/A,1112,N/A,,N/A,,people,people
N/A,average,poor,average,0,21681215,0,,good,3,BADM350,good teacher,05/05/2013,1,1.0,,4,Really into it,3.5,3.5,1,No,N/A,1112,N/A,,N/A,,people,people
N/A,good,average,good,0,21511987,0,,good,5,BADM350,I am in his class this semester. Quite a few students in this class do not have an IT background. So Ram tries to simplify complex topics. He is extremely energetic and helpful in making sure everyone gets it. He is an Excellent teacher and I learnt a lot about IT this course. Students shouldn't rate teachers without putting the necessary effort.,04/10/2013,3,3.0,,5,It's my life,5,5.0,1,Yes,N/A,1112,N/A,,N/A,,people,people
N/A,poor,average,average,0,21400520,0,,average,1,BADM350,"Clearly knows his stuff. Gets really excited about talking about IT, but is prone to ranting and getting off-topic. A bit hard to understand and moves through semi-complex topics at a breakneck speed. If you have an aptitude for IT, you would probably enjoy the class, otherwise, avoid.",03/11/2013,3,3.0,,4,Sorta interested,2.5,2.5,1,No,N/A,1112,N/A,,N/A,,people,people
