attendance,clarityColor,easyColor,helpColor,helpCount,id,notHelpCount,onlineClass,quality,rClarity,rClass,rComments,rDate,rEasy,rEasyString,rErrorMsg,rHelpful,rInterest,rOverall,rOverallString,rStatus,rTextBookUse,rWouldTakeAgain,sId,takenForCredit,teacher,teacherGrade,teacherRatingTags,unUsefulGrouping,usefulGrouping
N/A,good,poor,good,0,23354662,0,,good,4,MATH415,"One of the best professors i've had at this school. Very funny and made the subject interesting. Exams were pretty easy, definitely focus on her exam study sheets and going to TA office hours were a life saver. Her grading was fair and listens to her students' request like how much homework is too much.",06/08/2014,1,1.0,,5,Sorta interested,4.5,4.5,1,Yes,N/A,1112,N/A,,A-,,people,people
N/A,average,average,average,0,23309240,0,,average,2,MATH415,"Study guides given before exams correlated very well with the material that was on the tests.  Difficulty leaned toward easy. Averages were usually high(around 85 percent). The downside was that lectures were generally a summary of the book, which made things confusing at times. Reading the book on your own will cover whatever is done in lecture.",05/24/2014,2,2.0,,4,Really into it,3,3.0,1,Yes,N/A,1112,N/A,,N/A,,people,people
N/A,average,good,average,0,23231628,0,,poor,2,MATH415,"Very nice lady, but her lectures often got very confusing. Her tests were extremely difficult with memorization of proofs, which made the class not even feel like a math class. And the biggest problem was lectures were straight from the book, so if you didn't understand the lecture, there was no other reference",05/12/2014,4,4.0,,2,Really into it,2,2.0,1,Yes,N/A,1112,N/A,,N/A,,people,people
Not Mandatory,poor,good,poor,0,23202004,0,,poor,1,MATH415,"All she did was copy her notes onto the chalkboard. Had a lot of examples but wouldn't go through the work for each step making it difficult to follow along. Her exams are worth 17% each with only 4-6 questions, making it easy to lose a lot of overall percentage points on one question. I wish I would have taken a section with a different professor.",05/08/2014,4,4.0,,2,Meh,1.5,1.5,1,Yes,N/A,1112,N/A,,D,,people,people
Not Mandatory,good,average,good,0,22849638,0,,good,5,BUS234,"She is the best math teacher I've had at U of I. Being an athlete, it's not too demanding. Homework really helps for tests. She keep class entertaining by making awesome comments about her kids. I've had her in multiple classes. She is chill.",02/18/2014,2,2.0,,5,Really into it,5,5.0,1,No,N/A,1112,N/A,,B-,,people,people
N/A,good,average,good,0,22184575,0,,good,5,MATH125,She is the first good math teacher that I have had in a long time. She explains the material well and interacts with the students.  She makes a big class feel small and students fell comfortable asking questions.  There is mandatory homework every week but it is not bad.  If you are taking this class definitely take it with her!,10/16/2013,2,2.0,,5,Sorta interested,5,5.0,1,No,N/A,1112,N/A,,N/A,,people,people
N/A,good,average,good,0,22143206,0,,good,5,MATH234,"Liked the way this course was structured. Lectures were always interesting, she talked about her kids and funny random stuff sometimes. Material was pretty clear. Quizzes were fair. Exams were very similar to practice exams. She's approachable and I'm considering taking her again for another math course.",09/27/2013,3,3.0,,5,Meh,5,5.0,1,No,N/A,1112,N/A,,N/A,,people,people
N/A,average,average,good,0,22014575,0,,good,3,MATH234,"She is a great professor and ALWAYS willing to help. Her tests were difficult at times. A lot of the times she would include things that we did not focus on as much as others during lecture and in the homework problems. This always annoyed me, but as long as you do the homework and understand the lectures you should be golden. :D",07/31/2013,3,3.0,,5,Sorta interested,4,4.0,1,No,N/A,1112,N/A,,N/A,,people,people
N/A,good,poor,good,0,21950954,0,,good,5,MATH234,"Easy A. Very organized. Practice exams given before tests are very helpful. Also, all course notes are online.",07/07/2013,1,1.0,,5,It's my life,5,5.0,1,Yes,N/A,1112,N/A,,N/A,,people,people
N/A,good,poor,good,0,21803664,0,,good,5,MATH415,Fantastic teacher. We got let out early most days and she breaks up straight lecturing to tell little stories about her family. I enjoyed the slight mental break. Homework is standard. Tests are standard leaning toward easy. The averages were always high.,05/21/2013,1,1.0,,5,Low,5,5.0,1,Yes,N/A,1112,N/A,,N/A,,people,people
N/A,good,average,good,0,21705522,0,,good,4,MATH234,"Dr. Arana is a very good professor. She is passionate about her students and wants them to succeed. Her class was very challenging, but not impossible.",05/08/2013,3,3.0,,4,Really into it,4,4.0,1,No,N/A,1112,N/A,,N/A,,people,people
N/A,good,average,good,0,21635556,0,,good,4,MATH234,Best teacher for this course but her tests aren't fair and there is nothing you can do about it no matter how much you study,04/30/2013,3,3.0,,5,It's my life,4.5,4.5,1,Yes,N/A,1112,N/A,,N/A,,people,people
N/A,good,average,good,0,21625164,0,,good,5,MATH125,"Had her for MATH 125 and 234. I think she is entertaining and keeps the class lively. She adjusted to a new university smoothly. 125 was a bit confusing in her explanation, but 234 was much better. Maybe adjustment problems? USE THE BOOK FOR EXTRA PRACTICE. She takes homework/exam problems from it (sometimes altered slightly).",04/29/2013,2,2.0,,4,Really into it,4.5,4.5,1,No,N/A,1112,N/A,,N/A,,people,people
N/A,good,average,good,0,21487771,0,,good,5,MATH415,"This was her first semester teaching Linear Algebra, and I'm pretty sure she's the best professor I've had to date.  She was very personable, gave very clear notes, and made great exam study guides.  The exams also adhered very well to what we had covered in class and done in homework and were very straightforward.",04/04/2013,2,2.0,,5,Low,5,5.0,1,Yes,N/A,1112,N/A,,N/A,,people,people
N/A,good,average,good,0,21222974,0,,good,5,MATH234,"Probably the best teacher you can get for this course. I didn't go to class that often since all of her notes are online, but in class she explains material better. Quizzes were mostly straight forward. Got a B in the class.",01/07/2013,3,3.0,,4,It's my life,4.5,4.5,1,No,N/A,1112,N/A,,N/A,,people,people
N/A,good,good,good,0,21192822,0,,good,4,MATH125,"I was among the first to have professor Arana at the University this past semester. She is clearly a mom who loves her children as she brings them up a lot in class. Very funny and clear with her expectations. Go to her office hours if you are having trouble, one on one help was everything!! Class was challenging but not impossible.",01/01/2013,4,4.0,,5,Sorta interested,4.5,4.5,1,No,N/A,1112,N/A,,N/A,,people,people
N/A,good,average,good,0,21179403,0,,good,5,MATH125,"Professor Arana did a great job with this class this past semester. It was her first semester at the University of Illinois, but that did not stop her from doing a quality job. She is passionate about what she is teaching. The material was not too difficult. As long as you go to class, do the work and study, you will do fine.",12/28/2012,2,2.0,,5,Really into it,5,5.0,1,No,N/A,1112,N/A,,N/A,,people,people
N/A,good,average,good,0,21151323,0,,good,4,MATH125,"She's hilarious...pretty good teacher, tests can be hard but a good grade can be attainable with some studying...She's better than anyone else that teaches the class",12/22/2012,3,3.0,,4,Low,4,4.0,1,Yes,N/A,1112,N/A,,N/A,,people,people
