attendance,clarityColor,easyColor,helpColor,helpCount,id,notHelpCount,onlineClass,quality,rClarity,rClass,rComments,rDate,rEasy,rEasyString,rErrorMsg,rHelpful,rInterest,rOverall,rOverallString,rStatus,rTextBookUse,rWouldTakeAgain,sId,takenForCredit,teacher,teacherGrade,teacherRatingTags,unUsefulGrouping,usefulGrouping
N/A,average,average,average,0,10118499,0,,average,2,ATMOS120,"Probably one of the most boring classes I've ever taken..bring crosswords and/or books to lecture..also, her voice is really annoying.  Overall, the class wasn't bad..the review sessions help A LOT!",08/12/2005,3,3.0,,4,Meh,3,3.0,1,N/A,N/A,1112,N/A,,N/A,,people,people
N/A,good,average,good,0,3671091,0,,good,5,ATMS120,"The curve for this class is awesome, a B is 70, it doesn't get better, some people I know got a D on the first couple exams, then a B on the final exam, and Still pulled of a B, the best gen ed I took so far!",04/20/2005,2,2.0,,5,It's my life,5,5.0,1,N/A,N/A,1112,N/A,,N/A,,people,people
N/A,average,good,average,0,3622608,0,,good,3,ATMS120,Not an easy blow off gen ed,04/13/2005,4,4.0,,4,Really into it,3.5,3.5,1,N/A,N/A,1112,N/A,,N/A,,people,people
N/A,good,poor,good,0,3196142,0,,good,5,ATMS120,"great teacher. very clear, helpful, and the lecture notes are the tests exactly.",01/10/2005,1,1.0,,5,It's my life,5,5.0,1,N/A,N/A,1112,N/A,,N/A,,people,people
N/A,good,average,good,0,3006955,0,,good,4,ATMOS120,No Comments,12/13/2004,2,2.0,,4,It's my life,4,4.0,1,N/A,N/A,1112,N/A,,N/A,,people,people
N/A,average,average,average,0,2943674,0,,average,3,ATMOS120,No Comments,12/08/2004,3,3.0,,3,Meh,3,3.0,1,N/A,N/A,1112,N/A,,N/A,,people,people
