attendance,clarityColor,easyColor,helpColor,helpCount,id,notHelpCount,onlineClass,quality,rClarity,rClass,rComments,rDate,rEasy,rEasyString,rErrorMsg,rHelpful,rInterest,rOverall,rOverallString,rStatus,rTextBookUse,rWouldTakeAgain,sId,takenForCredit,teacher,teacherGrade,teacherRatingTags,unUsefulGrouping,usefulGrouping
Mandatory,good,good,good,0,23664326,0,,good,5,NPRE448,"He teaches tough courses, but he explains all of the concepts very well. You must go to class and pay attention. Homeworks are all hard and long, but doable. Overall one of the best professors I've had in college.",10/16/2014,4,4.0,,4,It's my life,4.5,4.5,1,Yes,Yes,1112,Yes,,A,,people,people
N/A,good,good,good,0,22040827,0,,good,4,NPRE455,"Awesome professor, just difficult courses. More than willing to help, but won't make it easy if you try to blow through it.",08/09/2013,5,5.0,,5,Really into it,4.5,4.5,1,No,N/A,1112,N/A,,N/A,,people,people
N/A,poor,good,poor,0,20884077,0,,poor,1,NPRE448,Doesn't teach the homework or the tests.  Leaves you in a state of unknowing the whole semester.,11/26/2012,5,5.0,,1,Sorta interested,1,1.0,1,Yes,N/A,1112,N/A,,N/A,,people,people
N/A,average,good,average,0,20312699,0,,average,3,NPRE455,"I am the first one to use video lectures. It was painful for me to keep up with the lectures especially when exams came around. he grades very harsh but we had easier exams than previous semesters. nonetheless, DO prepare for this class!",05/18/2012,4,4.0,,3,Sorta interested,3,3.0,1,No,N/A,1112,N/A,,N/A,,people,people
N/A,good,good,average,0,18410831,0,,good,4,NPRE455,"Teaches a lot of material that is difficult to understand, but if you go to class and actively participate/take notes/ask questions you will do fine. Uddin usually does a good job of presenting material, but missing notes will really hurt you. His exams are hard but manageable. Be sure to understand the theory behind equations.",04/14/2011,4,4.0,,3,Really into it,3.5,3.5,1,Yes,N/A,1112,N/A,,N/A,,people,people
N/A,average,average,average,0,17047912,0,,average,3,ENVS101,"Tends to ramble on, somewhat dull to listen to. Otherwise fine.",04/23/2010,2,2.0,,3,Meh,3,3.0,1,No,N/A,1112,N/A,,N/A,,people,people
