attendance,clarityColor,easyColor,helpColor,helpCount,id,notHelpCount,onlineClass,quality,rClarity,rClass,rComments,rDate,rEasy,rEasyString,rErrorMsg,rHelpful,rInterest,rOverall,rOverallString,rStatus,rTextBookUse,rWouldTakeAgain,sId,takenForCredit,teacher,teacherGrade,teacherRatingTags,unUsefulGrouping,usefulGrouping
Mandatory,average,good,average,0,26734516,0,,average,3,CS101,"If you are not CS major get ready to die. At the beginning class(101)seems easy, but when you get your first homework where you should write whole code by yourself , that's madness. However, midterms are not so bad , but the final is tough because there are free-response  questions.",06/17/2016,4,4.0,,3,N/A,3,3.0,1,No,No,1112,Yes,,B+,,people,people
Mandatory,average,good,average,0,26618697,0,,average,3,CS101,"Good teacher, but the homeworks are a little tough, especially if you are not a CS major. Would suggest utilizing TA office hours, and befriending people!",05/19/2016,4,4.0,,3,N/A,3,3.0,1,No,N/A,1112,Yes,,A,,people,people
Mandatory,good,average,average,8,26091253,1,,average,4,CS210,Very condescending. Answers Piazza posts in a very disrespectful way. Gets really mad when people don't attend lecture so he makes the tests really hard which doesn't benefit anyone. Kind of acts like a child when it comes to people not paying attention to exactly what he expects. Needs to grow up a little bit.,02/26/2016,2,2.0,,2,Low,3,3.0,1,No,N/A,1112,Yes,,N/A,,person,people
Mandatory,good,average,good,0,25817538,0,,good,5,CS101,He wanted his students to succeed. He's a great professor that really wants everyone to succeed.,12/24/2015,2,2.0,,3,It's my life,4,4.0,1,No,Yes,1112,Yes,,A,,people,people
Mandatory,good,average,good,2,24858989,2,,good,5,CS210,"He's a very intelligent, young guy who is very clear, cares about his students, and honestly seems like the most personable professor I've ever had while on campus. I've had him three times, and I recommend him to any student taking any computer science oriented courses. He knows his stuff.",05/18/2015,3,3.0,,5,Meh,5,5.0,1,No,Yes,1112,Yes,,A,,people,people
N/A,good,average,good,0,24599135,0,,good,5,CS461,One of the best Professors I've ever had. Very nice and helpful. Lectures are engaging and clear.,04/15/2015,3,3.0,,5,It's my life,5,5.0,1,No,N/A,1112,Yes,,N/A,,people,people
