attendance,clarityColor,easyColor,helpColor,helpCount,id,notHelpCount,onlineClass,quality,rClarity,rClass,rComments,rDate,rEasy,rEasyString,rErrorMsg,rHelpful,rInterest,rOverall,rOverallString,rStatus,rTextBookUse,rWouldTakeAgain,sId,takenForCredit,teacher,teacherGrade,teacherRatingTags,unUsefulGrouping,usefulGrouping
N/A,good,poor,good,0,12369872,0,,good,5,RST216,Great Teacher and Class!,11/06/2006,1,1.0,,5,It's my life,5,5.0,1,No,N/A,1112,N/A,,N/A,,people,people
N/A,good,average,good,0,12311869,0,,good,5,RST110,"Good, interesting class...helpful with any questions",10/24/2006,2,2.0,,5,Really into it,5,5.0,1,Yes,N/A,1112,N/A,,N/A,,people,people
N/A,good,poor,good,0,10692678,0,,good,5,RST110,The ideal for what a young college professor should be.  Everything is broken down and test are generally straight forward.  I would take another class even if I didn't need it just to have him again.,11/03/2005,1,1.0,,5,Really into it,5,5.0,1,N/A,N/A,1112,N/A,,N/A,,people,people
N/A,good,average,good,0,10453349,0,,good,5,RST100,very good guy,09/27/2005,2,2.0,,5,Sorta interested,5,5.0,1,N/A,N/A,1112,N/A,,N/A,,people,people
N/A,good,average,good,0,3896518,0,,good,5,LEIS100,"Ryan was a great professor. He never kept us in lecture longer than we had to be there and would always let us out early. He gave us study guides for the tests, but actually made the tests so we were forced to read the chapters and study. He was a very good teacher, and had all of the lecture notes online.",05/20/2005,3,3.0,,5,It's my life,5,5.0,1,N/A,N/A,1112,N/A,,N/A,,people,people
