attendance,clarityColor,easyColor,helpColor,helpCount,id,notHelpCount,onlineClass,quality,rClarity,rClass,rComments,rDate,rEasy,rEasyString,rErrorMsg,rHelpful,rInterest,rOverall,rOverallString,rStatus,rTextBookUse,rWouldTakeAgain,sId,takenForCredit,teacher,teacherGrade,teacherRatingTags,unUsefulGrouping,usefulGrouping
N/A,good,average,good,0,20722365,0,,good,5,ENG120,"Really great professor for first time college writers. The only thing I wish is that class essays were weighted more overall. Her one on one editing sessions are fabulous. It doesn't hurt that Professor McWhorter is easy on the eyes, either.",10/22/2012,3,3.0,,5,Really into it,5,5.0,1,Yes,N/A,1112,N/A,,N/A,,people,people
N/A,good,good,good,0,19015063,0,,good,5,RHET105,"good teacher. she taught me the dif between their, there, and they're. recomend",09/21/2011,4,4.0,,5,Low,5,5.0,1,Yes,N/A,1112,N/A,,N/A,,people,people
N/A,good,good,good,0,18212703,0,,good,4,BTW250,"It's a tough class. I had to work really hard, but I learned a lot and improved my writing!",02/05/2011,5,5.0,,5,Low,4.5,4.5,1,Yes,N/A,1112,N/A,,N/A,,people,people
N/A,good,good,good,0,18136675,0,,good,4,BTW250,"A great class. Ms. McWhorter is a tough grader, but fair. You can tell she cares about her students and is great at explaining things. She met with me outside of class to help me with my writing and to look over my job materials. Super nice.",01/13/2011,4,4.0,,5,Sorta interested,4.5,4.5,1,Yes,N/A,1112,N/A,,N/A,,people,people
N/A,average,good,average,0,17926519,0,,poor,2,BTW250,A very hard teacher. Please change section if you get her for Rhetoric or Business technical writing. All other sections will be much easier and you'll end up doing way better in the class even though you'll work much less than her section.,12/13/2010,5,5.0,,2,Low,2,2.0,1,No,N/A,1112,N/A,,N/A,,people,people
N/A,good,good,good,0,17741489,0,,good,4,BTW250,"She is a difficult grader for sure, but I honestly believe its because she holds her students to a higher standard than other TAs. If you go to class and are engaged in whats going on you will do fine. Class is tough since its all online and never meets. Not a horrible teacher, but can be more clear. But overall, it was enjoyable.",11/07/2010,4,4.0,,4,Meh,4,4.0,1,No,N/A,1112,N/A,,N/A,,people,people
N/A,average,good,poor,0,17610495,0,,poor,2,RHET105,She's a horrible teacher; choose a different RHET 105 TA,09/23/2010,5,5.0,,1,Meh,1.5,1.5,1,No,N/A,1112,N/A,,N/A,,people,people
