attendance,clarityColor,easyColor,helpColor,helpCount,id,notHelpCount,onlineClass,quality,rClarity,rClass,rComments,rDate,rEasy,rEasyString,rErrorMsg,rHelpful,rInterest,rOverall,rOverallString,rStatus,rTextBookUse,rWouldTakeAgain,sId,takenForCredit,teacher,teacherGrade,teacherRatingTags,unUsefulGrouping,usefulGrouping
N/A,good,average,good,0,18988553,0,,good,5,ENGL199,She knows her poetry and is interested in how it makes you feel...not how it will have an effect on your grade.,09/09/2011,2,2.0,,5,Really into it,5,5.0,1,Yes,N/A,1112,N/A,,N/A,,people,people
N/A,good,poor,good,0,17736769,0,,good,5,CW106,Super smart and funny. She is very passionate about poetry and knows A LOT about it in all respects. My favorite class this semester by far!,11/06/2010,1,1.0,,5,It's my life,5,5.0,1,Yes,N/A,1112,N/A,,N/A,,people,people
N/A,good,poor,good,0,17736765,0,,good,5,CW106,Super smart and funny. She is very passionate about poetry and knows ALOT about it in all respects. My favorite class this semester by far!,11/06/2010,1,1.0,,5,It's my life,5,5.0,1,Yes,N/A,1112,N/A,,N/A,,people,people
N/A,good,average,good,0,17618721,0,,good,5,BTW250,Sara is awesome. Very understanding when you have issues going on. I actually cared about doing the work and impressing her. One of the best profs here.,09/28/2010,3,3.0,,4,Low,4.5,4.5,1,No,N/A,1112,N/A,,N/A,,people,people
N/A,good,average,good,0,17546157,0,,good,5,BTW250,Keeps class interesting. Really relatable and not boring at all.,08/25/2010,3,3.0,,5,Low,5,5.0,1,Yes,N/A,1112,N/A,,N/A,,people,people
N/A,good,average,good,0,17228158,0,,good,5,BTW250,Super laid back and funny and really easy to talk to. She's pretty hot too.,05/18/2010,3,3.0,,3,Low,4,4.0,1,No,N/A,1112,N/A,,N/A,,people,people
N/A,good,average,good,0,17215392,0,,good,5,BTW250,Extremely down to earth and very clear.,05/17/2010,2,2.0,,5,Meh,5,5.0,1,No,N/A,1112,N/A,,N/A,,people,people
