attendance,clarityColor,easyColor,helpColor,helpCount,id,notHelpCount,onlineClass,quality,rClarity,rClass,rComments,rDate,rEasy,rEasyString,rErrorMsg,rHelpful,rInterest,rOverall,rOverallString,rStatus,rTextBookUse,rWouldTakeAgain,sId,takenForCredit,teacher,teacherGrade,teacherRatingTags,unUsefulGrouping,usefulGrouping
N/A,good,average,good,0,2727111,0,,good,4,FSHN101,Schimdt is a good teacher. She remarkably understands what she is teaching. The class is not so hard (3 exams+ 1 paper). Don't forget to get the past exams! 90% of questions in the exam are just the same as the past exams!!!,11/13/2004,2,2.0,,4,It's my life,4,4.0,1,N/A,N/A,1112,N/A,,N/A,,people,people
N/A,good,poor,good,0,2503285,0,,good,5,FSHN101,Supa dupa easy class.  Yet it sucked going three times a week...in lincoln theater(P.O.S. lecture hall),09/29/2004,1,1.0,,5,Meh,5,5.0,1,N/A,N/A,1112,N/A,,N/A,,people,people
N/A,good,good,good,0,2227071,0,,good,5,FSHN101,"This course is supposed to be an easy A, but there is tons to memorize.",06/07/2004,4,4.0,,4,N/A,4.5,4.5,1,N/A,N/A,1112,N/A,,N/A,,people,people
N/A,good,average,average,0,2109431,0,,good,4,FSHN101,easy if you go to lecture and actually pay attention. minimal work...mostly just taking notes (which are online) and studying (which doesnt really help for the tests).  ok for a gen ed...easy A if work is put into it.,05/07/2004,2,2.0,,3,N/A,3.5,3.5,1,N/A,N/A,1112,N/A,,N/A,,people,people
N/A,average,average,good,0,2060803,0,,good,3,FSHN101,"In order to do well in this class, you have to understand one very important thing: half the class has a copy of last semester's upcoming exam, which reflects almost perfectly what this semester's exam will be. Too bad for those who study hard.",04/29/2004,2,2.0,,5,N/A,4,4.0,1,N/A,N/A,1112,N/A,,N/A,,people,people
N/A,good,good,good,0,2046599,0,,good,5,FSHN101,"Supposed to be an easy class, but requires a lot of math and chemistry and tons of memorizing. Schmidt is a good teacher though and answers a lot of questions during class.",04/28/2004,4,4.0,,4,N/A,4.5,4.5,1,N/A,N/A,1112,N/A,,N/A,,people,people
N/A,good,average,average,0,2045923,0,,good,4,FSHN101,"Pretty easy class, very large, its ok for a gen ed, but not the greatest",04/27/2004,2,2.0,,3,N/A,3.5,3.5,1,N/A,N/A,1112,N/A,,N/A,,people,people
