attendance,clarityColor,easyColor,helpColor,helpCount,id,notHelpCount,onlineClass,quality,rClarity,rClass,rComments,rDate,rEasy,rEasyString,rErrorMsg,rHelpful,rInterest,rOverall,rOverallString,rStatus,rTextBookUse,rWouldTakeAgain,sId,takenForCredit,teacher,teacherGrade,teacherRatingTags,unUsefulGrouping,usefulGrouping
Not Mandatory,good,poor,good,0,25178717,0,,good,5,SPAN307,"I loved this class! Prof. Montrul is knowledgeable about her area, knows how to communicate well and really cares about her students. I definitely enjoyed the lectures and would take this class again. She definitely sparked my interest in linguistics and bilingualism. Inspirational.",09/08/2015,1,1.0,,5,It's my life,5,5.0,1,Yes,Yes,1112,Yes,,N/A,,people,people
Not Mandatory,good,good,average,0,24735448,0,,good,4,SPAN307,"She is very smart, but if you aren't on the same page as her, she will treat you as if you are a young child. She is good at lecturing, but she is very picky with your answers when it comes to tests, homework, and other assignments. Be careful with the second test. It is very detailed and much harder than the first exam. She never updates gradebook",05/04/2015,4,4.0,,3,Sorta interested,3.5,3.5,1,Yes,N/A,1112,Yes,,Not sure yet,,people,people
N/A,good,poor,good,0,21677234,0,,good,5,SPAN307,I enjoyed going to class even though it was not mandatory. Topics that were covered were really interesting. She is very smart. Probably my favorite Spanish class I have taken at the university.,05/05/2013,1,1.0,,5,Really into it,5,5.0,1,Yes,N/A,1112,N/A,,N/A,,people,people
N/A,good,good,good,0,18604674,0,,good,4,SPAN307,Awesome!,05/15/2011,4,4.0,,4,It's my life,4,4.0,1,Yes,N/A,1112,N/A,,N/A,,people,people
N/A,good,good,good,0,16067414,0,,good,5,SPAN252,"I didn't even know how interesting linguistics was until I took Professor Montrul's class! Even though the tests were really difficult, she definitely helps your understanding of the material in class lectures!",07/26/2009,4,4.0,,4,Meh,4.5,4.5,1,Yes,N/A,1112,N/A,,N/A,,people,people
N/A,average,average,average,0,15940098,0,,average,3,LING425,"Easy class. Everything you need to know for the exams is in the powerpoints, so you don't even need to take notes. She's a picky grader and takes off points for stupid things in the homework assignments.",06/07/2009,3,3.0,,2,Really into it,2.5,2.5,1,Yes,N/A,1112,N/A,,N/A,,people,people
N/A,good,average,good,0,15710037,0,,good,4,SPAN252,"Good professor. I took linguistics 250 and I found it a little bit difficult. So much material in one class. Exams are not difficult, but you have to understand the concepts and practice, practice and practice. She is always accessible and helpful. My TA was excellent and patient. There are 4 homework packages but there aren't difficult.",04/26/2009,3,3.0,,4,Really into it,4,4.0,1,Yes,N/A,1112,N/A,,N/A,,people,people
