attendance,clarityColor,easyColor,helpColor,helpCount,id,notHelpCount,onlineClass,quality,rClarity,rClass,rComments,rDate,rEasy,rEasyString,rErrorMsg,rHelpful,rInterest,rOverall,rOverallString,rStatus,rTextBookUse,rWouldTakeAgain,sId,takenForCredit,teacher,teacherGrade,teacherRatingTags,unUsefulGrouping,usefulGrouping
Not Mandatory,good,average,good,2,24677711,0,,good,5,CS498,"He is the most intelligent and inspiring professor I ever had! He will make any dry subject fun! If you have a chance to take a class with him, do it!",04/27/2015,3,3.0,,5,It's my life,5,5.0,1,Yes,N/A,1112,Yes,,N/A,,people,people
N/A,good,poor,good,1,20619355,0,,good,4,CS357,he constantly makes mistakes during the lecture.,08/30/2012,1,1.0,,4,It's my life,4,4.0,1,Yes,N/A,1112,N/A,,N/A,,people,person
N/A,good,average,good,1,20283149,0,,good,5,CS373,Recommend. Great sense of humor. Make a hard class material easier. Very open to questions. Homework is quite challenging.,05/15/2012,3,3.0,,4,It's my life,4.5,4.5,1,Yes,N/A,1112,N/A,,N/A,,people,person
N/A,good,good,good,1,20252141,0,,good,5,CS373,Excellent professor. 373's a tough course but his lectures are always a blast to attend and really help you understand stuff. Great sense of humor.,05/10/2012,5,5.0,,5,Sorta interested,5,5.0,1,Yes,N/A,1112,N/A,,N/A,,people,person
N/A,good,average,good,1,18303337,0,,good,5,CS373,"Good professor, great sense of humor.",03/23/2011,3,3.0,,5,Really into it,5,5.0,1,No,N/A,1112,N/A,,N/A,,people,person
N/A,average,good,average,1,17366048,0,,poor,3,CS373,"Very interesting professor. He is very good at presenting the material, and is always open to explaining things that do not make sense, or persuing anything that the class is interested in that pertains to the topic in lecture. The homework assignments are quite  challenging, and are not busy work.",06/24/2010,5,5.0,,1,Really into it,2,2.0,3,Yes,N/A,1112,N/A,,N/A,,people,person
N/A,good,average,good,1,16732149,0,,good,4,CS373,"If he's teaching a course, take it. CS 373 is usually supposed to be boring and hard. However, professor LaValle has a great sense of humor and knows things to be clear on the materials. He likes to teach with black boards, so it is highly recommended to be in lecture. The exams are not very hard compared to those of other professors'.",01/15/2010,2,2.0,,5,It's my life,4.5,4.5,1,Yes,N/A,1112,N/A,,N/A,,people,person
