attendance,clarityColor,easyColor,helpColor,helpCount,id,notHelpCount,onlineClass,quality,rClarity,rClass,rComments,rDate,rEasy,rEasyString,rErrorMsg,rHelpful,rInterest,rOverall,rOverallString,rStatus,rTextBookUse,rWouldTakeAgain,sId,takenForCredit,teacher,teacherGrade,teacherRatingTags,unUsefulGrouping,usefulGrouping
N/A,good,poor,good,0,13202524,0,,good,5,ADV300,Easy A.  You don't have to go to class but there are assignments about in class things so take the class with friends and occaisonally go together. I love its upper level credit.  You do nothing.  He is a jerk when you actually speak to him in person.  Whatever... you get an A.,05/23/2007,1,1.0,,5,Low,5,5.0,1,Yes,N/A,1112,N/A,,N/A,,people,people
N/A,good,poor,average,0,13125841,0,,good,4,ADV300,im still trying to figure out how this class is allowed on campus. its is ridiculously EASY. i think it was instituted to boost GPAs. if u get the chance to take it DO NOT PASS IT UP! projects are easy except the last ones require some effort. attendance is not necessary unless u have an in class assignment or something due (he tells u in advance),05/07/2007,1,1.0,,3,It's my life,3.5,3.5,1,No,N/A,1112,N/A,,N/A,,people,people
N/A,good,poor,good,0,13077426,0,,good,5,ADV300,"TAKE THIS CLASS!! it is so easy.  when reading these comments, disregard those saying this class is annoying or hard, because they are probably quite dumb, you'd have to be to think this class is challenging.  I did not attend EVER, and yet i got a 100 percent.take the class.if you don't, you will regert it.  OH, AND HE DOES LOOK LIKE A GRAPE!",04/28/2007,1,1.0,,5,It's my life,5,5.0,1,No,N/A,1112,N/A,,N/A,,people,people
N/A,good,poor,average,0,13077399,0,,average,4,ADV300,"this man teaches one of the most pointless classes ever invented for credit. no final exam, no tests. people take notes but this is a waste of time, as is attending. i did not even know steve hall's name until the end of the semester since i did not go to this class ever. things you should know: he is loud, and resembles a grape.",04/28/2007,1,1.0,,1,Meh,2.5,2.5,1,No,N/A,1112,N/A,,N/A,,people,people
N/A,good,poor,good,0,13020864,0,,good,5,ADV300,"best. class. ever. no tests, slides are online but it's pretty necessary to go to class because he uses examples in class not on the slides, then uses them on assignments.  so much fun!",04/17/2007,1,1.0,,5,It's my life,5,5.0,1,No,N/A,1112,N/A,,N/A,,people,people
N/A,good,poor,good,0,12806624,0,,good,5,ADV300,"This is probably the easiest class on campus.  Also, it's pretty interesting.  He usually lets out earlier than the alotted time.  Theres about 5 assignments, no tests, and a couple in class activities.  Automatic A.",01/22/2007,1,1.0,,5,It's my life,5,5.0,1,No,N/A,1112,N/A,,N/A,,people,people
N/A,good,poor,good,0,12556160,0,,good,5,ADV300,"Very easy class, no exams just projects which can be time consuming but are not difficult. Lots of work left till the very end of the semester. Interesting guy to listen to during lectures even though its not necessary to go.",12/09/2006,1,1.0,,5,It's my life,5,5.0,1,No,N/A,1112,N/A,,N/A,,people,people
N/A,good,poor,average,0,12179967,0,,good,4,ADV300,"Two huge projects left at the end of the semester so plan ahead to have room in your schedule for that.  Take this class with a friend and  you can switch off who goes to which class becuase all you need is the notes randomly here and there. Grades depend on who your TA is...overall easy A, no final exam.",08/22/2006,1,1.0,,3,It's my life,3.5,3.5,1,Yes,N/A,1112,N/A,,N/A,,people,people
N/A,average,poor,average,0,11883825,0,,poor,2,ADV300,"This class is so easy.  It is interesting, but all of it is just common sense.  Out of a class of 750 about 200 came to each lecture.  Left 2 projects worth 25% of your grade EACH due the last 3 weeks of class.  Also, lots of hot girls take this class if you're into that.",05/14/2006,1,1.0,,2,It's my life,2,2.0,1,N/A,N/A,1112,N/A,,N/A,,people,people
N/A,average,poor,average,0,11800234,0,,poor,2,ADV300,"easy as hell, didn't learn anything.",05/01/2006,1,1.0,,2,Really into it,2,2.0,1,N/A,N/A,1112,N/A,,N/A,,people,people
N/A,average,poor,average,0,11460460,0,,poor,3,ADV300281,"Basically, this man is paid to breathe and drop names of all the people he knows in the industry for a few hours a week. A tool outside of the classroom as well. Truly a waste of time. Unhappily, a required course for adv majors. An easy A though. And a good guy to know when you start job hunting.",02/07/2006,1,1.0,,1,Meh,2,2.0,1,N/A,N/A,1112,N/A,,N/A,,people,people
N/A,poor,poor,poor,0,11441098,0,,poor,1,ADV300,"If you want to literally do nothing and get an A+, take this class.  If you're not a total moron, and you think college is about actually learning something valuable, don't take this class.  Everyone gets an A.",01/31/2006,1,1.0,,1,It's my life,1,1.0,1,N/A,N/A,1112,N/A,,N/A,,people,people
N/A,poor,average,poor,0,11252098,0,,poor,1,ADV300,"He is the most unhelpful instructor I have encountered on the campus in 3 years of college. He didn't release assignments until weeks after he said he would, and left 2 huge projects for the last week of the semester. Grading is random and the TAs don't have a clue about anything. Not worth the stress, and he and the TAs never reply to their email.",12/23/2005,3,3.0,,1,Meh,1,1.0,1,N/A,N/A,1112,N/A,,N/A,,people,people
N/A,average,poor,average,0,11225231,0,,poor,2,ADV300,"Worthless class. You will honestly learn nothing. There is no final just projects. 
 
 if you don't get an A you are just dumb.",12/20/2005,1,1.0,,2,Really into it,2,2.0,1,N/A,N/A,1112,N/A,,N/A,,people,people
N/A,poor,poor,poor,0,11224402,0,,poor,1,ADV300,Steve Hall is the worst and the least organized professor I have ever stumbled upon. The class is a joke and the TAs dont have a clue as to what is going on. Lecture is pointless because there are no tests or final.  Projects are unclear and worthless. I learned and did completely nothing and got an A.  Going to class is a waste of time.,12/20/2005,1,1.0,,1,Sorta interested,1,1.0,1,N/A,N/A,1112,N/A,,N/A,,people,people
N/A,poor,good,poor,0,11180907,0,,poor,1,ADV300,"He is a complete moron. He promised to put up assignments so that we would have time to do them, and then he never posted them until (literally) weeks later. Grading was random and capricious, and it took FOREVER to get things graded and graded posted. I truly dispise him,&te never responds to email",12/16/2005,5,5.0,,1,Meh,1,1.0,1,N/A,N/A,1112,N/A,,N/A,,people,people
N/A,good,poor,average,0,11173453,0,,average,4,ADV300,"This class is one of the easiest classes I have ever had in college. No tests, just take home quizzes. A couple of easy BS papers are assigned as well. You do not need the book or even go to class. If you have a firend who does go, just use their quiz answers. Tons of Extra Credit available. This class is pointless but an easy A.",12/15/2005,1,1.0,,2,Really into it,3,3.0,1,N/A,N/A,1112,N/A,,N/A,,people,people
N/A,good,poor,good,0,11006869,0,,good,5,ADV300,best teacher ever.  he's very funny and made this one of my favorite classes,11/29/2005,1,1.0,,5,Sorta interested,5,5.0,1,N/A,N/A,1112,N/A,,N/A,,people,people
N/A,poor,average,poor,0,10891813,0,,poor,1,ADV300,"Irritating is the best word to describe this class.  The lectures suck, the take home quizzes are really specific about things no one could possibly remember.  I really can't describe it any other way except that it is constantly irritating.",11/13/2005,2,2.0,,1,Low,1,1.0,1,N/A,N/A,1112,N/A,,N/A,,people,people
N/A,good,poor,good,0,10021110,0,,good,5,ADV300,Easiest class I have EVER taken- take it if you want to get an A+ without even trying or going to class,07/13/2005,1,1.0,,5,Really into it,5,5.0,1,N/A,N/A,1112,N/A,,N/A,,people,people
