attendance,clarityColor,easyColor,helpColor,helpCount,id,notHelpCount,onlineClass,quality,rClarity,rClass,rComments,rDate,rEasy,rEasyString,rErrorMsg,rHelpful,rInterest,rOverall,rOverallString,rStatus,rTextBookUse,rWouldTakeAgain,sId,takenForCredit,teacher,teacherGrade,teacherRatingTags,unUsefulGrouping,usefulGrouping
Mandatory,good,average,good,0,25131573,0,,good,5,JOUR199,"The readings could be complex, but he was great at making lectures interesting so I felt that when I left, I had a good grasp on the concept. Grades came from participation and oral debates. ",08/18/2015,3,3.0,,5,It's my life,5,5.0,1,Yes,N/A,1112,Yes,,A,,people,people
Mandatory,good,average,good,0,24635841,0,,good,5,JOUR199,"Steve is a great professor. He is very knowledgable on all the subjects we talked about, and they were very interesting. We just had 2 in class debates, an original speech at the end, participation, and a scavenger hunt as part of our grade. He's a very fair grader and it'll be an easy A if you put in the work.",04/21/2015,2,2.0,,5,It's my life,5,5.0,1,Yes,N/A,1112,Yes,,A+,,people,people
N/A,good,good,good,0,21253806,0,,good,5,JOUR411,"I wasn't looking forward to this class because I had no interest in law, but Helle is so enthusiastic about it that he made the subject fun. Fantastic lecturer, I wish more professors were like him. Exams are challenging, but if you come to almost every class, pay attention and take good notes to study from, it will be okay.",01/13/2013,4,4.0,,5,Low,5,5.0,1,Yes,N/A,1112,N/A,,N/A,,people,people
N/A,good,good,good,0,19715560,0,,good,5,JOUR411,Prof. Helle is a fantastic professor who is passionate and knowledgeable about subject matter. He is everything a college professor should be. Please ignore the imbecile below with a negative post about Prof. Helle.,01/12/2012,4,4.0,,5,Really into it,5,5.0,1,Yes,N/A,1112,N/A,,N/A,,people,people
N/A,good,average,good,0,18916704,0,,good,4,JOURN199,"A really interesting class that really made me think. Professor Helle was excellent, and with a little bit of effort and decent research, this class is nothing to fear because Helle will help you out if you need it.",08/15/2011,3,3.0,,4,Really into it,4,4.0,1,Yes,N/A,1112,N/A,,N/A,,people,people
N/A,good,average,good,0,18172656,0,,good,5,JOUR199,Keeps students interested and is really good at explaining the material.,01/23/2011,3,3.0,,5,Really into it,5,5.0,1,Yes,N/A,1112,N/A,,N/A,,people,people
N/A,average,average,average,0,17779892,0,,good,3,JOUR199,"Helle is a great lecturer, pretty engaging. Topics discussed were pretty interesting. He will call on people at random, so readings aren't optional. Tough but fair grader, he met with people who didn't agree with their grades and allowed them to discuss them. With decent research and speaking abilities, you'll be fine.",11/17/2010,3,3.0,,4,Low,3.5,3.5,1,Yes,N/A,1112,N/A,,N/A,,people,people
N/A,poor,good,poor,0,17402081,0,,poor,1,JOURN199,has no sympathy. I would not take this class because he made it stressful and puts pressure on you. strongly disliked everything about this class. very negative experience.,07/08/2010,4,4.0,,1,Meh,1,1.0,1,No,N/A,1112,N/A,,N/A,,people,people
N/A,good,good,good,0,16633479,0,,good,4,JOUR411,"Great Professor. Very hard class, but he is very clear and engaging. He makes it a point to remember your name and will use that to call on you. Very fair grader, but tests are extremely difficult.",12/23/2009,5,5.0,,4,Sorta interested,4,4.0,1,Yes,N/A,1112,N/A,,N/A,,people,people
N/A,average,good,average,0,15669186,0,,average,3,JOUR411,Helle's class was pretty hard...there were only 2 exams (1 more is optional) and a small amount of participation. He randomly calls on the students so everyone is engaged. He is a great lecturer and is enthusiastic but the material is challenging. When meeting with him he was also a little rude. The exams are also curved big time.,04/18/2009,5,5.0,,3,Sorta interested,3,3.0,1,Yes,N/A,1112,N/A,,N/A,,people,people
N/A,good,good,good,0,15218488,0,,good,4,JOUR199,"This was the college class I feared coming in which I would do my best, try my hardest and still fail. I found it impossible to get higher that 40% on our papers even one's that were 200-500 words longer than the minimum and featured citations from 7 sources and 5 court cases. I really hope the required 411 is much harder otherwise I'm screwed.",12/17/2008,5,5.0,,4,Really into it,4,4.0,1,Yes,N/A,1112,N/A,,N/A,,people,people
N/A,good,good,good,0,14559278,0,,good,4,JOUR411,"Enthusiastic speaker who does a good job keeping the class engaged. He'll randomly call on students to participate so be alert unless you wanna look foolish :D. As others have said, his tests are hard but fair. He expects a lot from students but is willing to answer questions. Definitely not a class you can slack off in.",06/05/2008,5,5.0,,4,Really into it,4,4.0,1,Yes,N/A,1112,N/A,,N/A,,people,people
N/A,good,good,good,0,14414995,0,,good,4,JOUR199,"Greatest professor within journalism.  He's a hard, fair grader.  Study for exams, know your stuff, and he'll reward you.  Don't take his class for a grade; take it to learn.  You'll look forward to going to class.  He's not only a teacher but a performer.",05/06/2008,4,4.0,,5,It's my life,4.5,4.5,1,No,N/A,1112,N/A,,N/A,,people,people
N/A,good,good,good,0,14374932,0,,good,5,JOUR411,Great teacher. Hard but fair grader as others have said. Always willing to help. No study guides and very hard tests. The first two test are written and the final is a cumulative multiple choice. Make sure you asks questions because he will always explain what he means or clarify what a law means. Very interesting class if you are considering law.,04/30/2008,5,5.0,,5,Really into it,5,5.0,1,Yes,N/A,1112,N/A,,N/A,,people,people
N/A,good,good,good,0,14267494,0,,good,5,JOUR411,"The class is difficult-there are only 3 exams, an essay, and a hint of participation points. That being said- he is a great teacher. I learned an incredible amount from him, and he takes a great interest in his students. If you have test trouble- talk to him- I needed to. He will help you.",04/09/2008,4,4.0,,5,Sorta interested,5,5.0,1,Yes,N/A,1112,N/A,,N/A,,people,people
N/A,good,good,good,0,14248641,0,,good,5,JOUR411,"Helle is an interesting character. He's very energetic and bouncy and the subject material in the class is interesting enough. The entire grade is based on you exam grades, so you gotta know your stuff. Also, he picks random people in class to answer questions, so if you don't like participating, you're just going to have to deal with it. Have fun.",04/06/2008,5,5.0,,4,Really into it,4.5,4.5,1,Yes,N/A,1112,N/A,,N/A,,people,people
N/A,good,good,good,0,13996467,0,,good,5,JOUR199,"Professor Helle is a brilliant man who clearly knows his material well and easily brings his understanding to his students.  Great sense of humor, grades TOUGH but fairly, and was fun to listen to.  Def. Recommend him.",01/14/2008,5,5.0,,5,Sorta interested,5,5.0,1,Yes,N/A,1112,N/A,,N/A,,people,people
N/A,good,good,good,0,13790620,0,,good,4,JOUR411,"Helle's class is definitely not easy, but it's manageable. Your final grade is based entirely on how you score on 3 exams, so prepare to study your ass off and he can be nit-picky with his grading. You get a scenario, and you have to analyze the legality of it.. strictly essay exams. Helle has a great sense of humor which makes class more bearable.",12/10/2007,4,4.0,,4,Sorta interested,4,4.0,1,Yes,N/A,1112,N/A,,N/A,,people,people
N/A,good,good,good,0,13494015,0,,good,5,JOUR411,Great Teacher,09/27/2007,4,4.0,,5,Sorta interested,5,5.0,1,Yes,N/A,1112,N/A,,N/A,,people,people
N/A,good,average,good,0,13030257,0,,good,5,JOUR199,Great professor - really interesting even if you don't care too much for the topic.,04/18/2007,3,3.0,,5,Sorta interested,5,5.0,1,Yes,N/A,1112,N/A,,N/A,,people,people
