attendance,clarityColor,easyColor,helpColor,helpCount,id,notHelpCount,onlineClass,quality,rClarity,rClass,rComments,rDate,rEasy,rEasyString,rErrorMsg,rHelpful,rInterest,rOverall,rOverallString,rStatus,rTextBookUse,rWouldTakeAgain,sId,takenForCredit,teacher,teacherGrade,teacherRatingTags,unUsefulGrouping,usefulGrouping
Not Mandatory,good,poor,good,0,26246215,0,,good,5,ME330,Very enthusiastic about this class since materials is his field. Very helpful and clear teaching style. Easy straightforward exams,04/06/2016,1,1.0,,5,N/A,5,5.0,1,No,N/A,1112,Yes,,A-,,people,people
Mandatory,good,average,good,0,26242891,0,,good,4,ME330,"Lecture is boring. He is a really nice professor and doesn't assign mandatory homework. If you don't understand something, he is more than willing to meet with you 1-on-1 to explain it in more detail. Has ""pop quizzes"" in lecture that are ridiculously easy and you get 80% just for showing up.",04/06/2016,2,2.0,,5,N/A,4.5,4.5,1,No,N/A,1112,Yes,,A,,people,people
Not Mandatory,good,average,good,0,24788168,0,,good,5,ME330,"Perfectly fine lecturer; if you pay attention you'll probably learn something.   Some material you had to study on your own for the final; there were no lectures! Which is, well, frustrating. ",05/10/2015,3,3.0,,4,Low,4.5,4.5,1,Yes,N/A,1112,Yes,,N/A,,people,people
N/A,good,average,good,0,23982270,0,,good,4,ME498,great professor. very helpful,12/08/2014,2,2.0,,5,Sorta interested,4.5,4.5,1,No,Yes,1112,Yes,,N/A,,people,people
Mandatory,good,average,good,4,23320548,0,,good,5,ME330,"Excellent professor. Lectures move pretty slow, but his explanations of material is great. Exams are straightforward and the class is well organized. Speaks good English. Highly recommend.",05/28/2014,2,2.0,,5,Sorta interested,5,5.0,1,Yes,N/A,1112,N/A,,A-,,people,people
