attendance,clarityColor,easyColor,helpColor,helpCount,id,notHelpCount,onlineClass,quality,rClarity,rClass,rComments,rDate,rEasy,rEasyString,rErrorMsg,rHelpful,rInterest,rOverall,rOverallString,rStatus,rTextBookUse,rWouldTakeAgain,sId,takenForCredit,teacher,teacherGrade,teacherRatingTags,unUsefulGrouping,usefulGrouping
N/A,good,good,average,0,19050714,0,,average,4,CMN336,"She is absolutely awful, please save yourself the grief and don't take her class.  She's so snotty and very much enjoys the sound of her own voice.  She tries to make her tests impossible and has no concept that students have other classes and homework.  Read her ISU reviews if you don't believe me; they're even harsher than these.",10/06/2011,5,5.0,,1,Sorta interested,2.5,2.5,1,Yes,N/A,1112,N/A,,N/A,,people,people
N/A,good,good,average,0,17468272,0,,good,5,CMN336,"Unlike other students, I enjoyed her. She is sarcastic sometimes, which people might misinterpret, but otherwise I thought she was funny. Encourages you to find solutions or answers yourself first before just giving them to you. Knows her stuff, but def. doesn't take BS from students.",07/31/2010,4,4.0,,2,Sorta interested,3.5,3.5,1,Yes,N/A,1112,N/A,,N/A,,people,people
N/A,poor,good,poor,0,15617262,0,,poor,1,SPCM113,She has no interest in capturing her student's attention or interest in class subject.,04/07/2009,4,4.0,,1,Sorta interested,1,1.0,1,Yes,N/A,1112,N/A,,N/A,,people,people
N/A,good,poor,average,0,15431849,0,,average,4,SPCM113,"The material is straightforward, if you study the study guides you will be fine. Projects are a waste of time--they're something a high school would assign.  She is nice unless you disagree with her or challenge her viewpoint. It's a joke and an easy A.",01/31/2009,1,1.0,,1,Meh,2.5,2.5,1,No,N/A,1112,N/A,,N/A,,people,people
N/A,good,average,good,0,14295776,0,,good,5,SPCM113,"She's a good teacher if the material was interesting.  The RSO projects are fun, but the readings are plain and dry.  She does a good job with what she has to work with.",04/15/2008,2,2.0,,5,Low,5,5.0,1,Yes,N/A,1112,N/A,,N/A,,people,people
