attendance,clarityColor,easyColor,helpColor,helpCount,id,notHelpCount,onlineClass,quality,rClarity,rClass,rComments,rDate,rEasy,rEasyString,rErrorMsg,rHelpful,rInterest,rOverall,rOverallString,rStatus,rTextBookUse,rWouldTakeAgain,sId,takenForCredit,teacher,teacherGrade,teacherRatingTags,unUsefulGrouping,usefulGrouping
N/A,poor,good,poor,0,17210479,0,,poor,1,MATH415,"Horrible lecturer. Expects mathematica to teach you the material. The quizzes/exams were not difficult at all, but the material was not taught to you so it made it difficult. His accent gets in the way when talking about numberrrrs. Wait a semester and get a real professor.",05/15/2010,4,4.0,,1,Low,1,1.0,1,No,N/A,1112,N/A,,N/A,,people,people
N/A,good,good,good,0,16837107,0,,good,5,MATH286,"homework is not easy, and takes a long time to do it. hour exams is not hard if you study the quiz problems, but takes a long time to calculate. Bonus questions are pointless, you'll never know how to do it. However, this lecturer really teach you something. It's possible to get an A if you study hard.",03/01/2010,4,4.0,,5,Sorta interested,5,5.0,1,Yes,N/A,1112,N/A,,N/A,,people,people
N/A,good,poor,good,0,16299942,0,,good,4,MATH241H,He's the nicest professor I've ever have.,11/02/2009,1,1.0,,4,Really into it,4,4.0,1,Yes,N/A,1112,N/A,,N/A,,people,people
N/A,average,average,average,0,15448970,0,,good,3,MATH241H,"Professor Mei was not the easiest teacher to understand, but he was able to get many things communicated effectively. His office hours were pretty helpful, though the homework was tough at times and the tests pushed you. Form a study group and you should be fine.",02/08/2009,3,3.0,,4,Really into it,3.5,3.5,1,Yes,N/A,1112,N/A,,N/A,,people,people
N/A,average,poor,average,0,15344270,0,,average,3,MATH241,He gave very resonable tests. And you have chance to make up for your exams if you do good in your quiz. And he gave resonable curve. recommend him.,01/08/2009,1,1.0,,2,Sorta interested,2.5,2.5,1,Yes,N/A,1112,N/A,,N/A,,people,people
N/A,average,average,poor,0,15337438,0,,poor,2,MATH241H,"This guy was horrible. His in class explanations were unclear, and his test grading was unfair. Even if you completely understood what you were doing, he would take off points for stupid errors, when the work on the class material was perfect.",01/07/2009,2,2.0,,1,It's my life,1.5,1.5,1,Yes,N/A,1112,N/A,,N/A,,people,people
N/A,average,good,average,0,13891320,0,,good,3,MATHMATH,No Comments,12/21/2007,4,4.0,,4,Sorta interested,3.5,3.5,1,Yes,N/A,1112,N/A,,N/A,,people,people
