attendance,clarityColor,easyColor,helpColor,helpCount,id,notHelpCount,onlineClass,quality,rClarity,rClass,rComments,rDate,rEasy,rEasyString,rErrorMsg,rHelpful,rInterest,rOverall,rOverallString,rStatus,rTextBookUse,rWouldTakeAgain,sId,takenForCredit,teacher,teacherGrade,teacherRatingTags,unUsefulGrouping,usefulGrouping
Not Mandatory,average,average,average,1,26176121,0,,average,3,PHYS435,"His lectures were pretty helpful, always willing to answer questions and has clear diagrams . He also posts the notes online and they are really helpful. He just makes everything really basic and makes the homework really hard. The office hours are a few hours before the homework is due so it isn't the greatest. Not my favorite, but not horrible",03/23/2016,3,3.0,,3,Really into it,3,3.0,1,Yes,N/A,1112,Yes,,A,,people,person
Not Mandatory,good,poor,good,0,25543390,0,,good,5,PHYS101,Fun classes. Interesting professor. I love his classes. And the exams are easy.,12/03/2015,1,1.0,,5,It's my life,5,5.0,1,Yes,N/A,1112,Yes,,N/A,,people,people
Mandatory,good,average,good,0,22655858,0,,good,5,PHYS101,"Tom is the man. Fun class, great professor, and cool demos. His sense of humor is unique and very entertaining.",12/25/2013,2,2.0,,5,Sorta interested,5,5.0,1,Yes,N/A,1112,N/A,,A-,,people,people
Mandatory,good,average,good,1,22468021,0,,good,5,PHYS101,A great teacher who makes physics fun and very easy to grasp. The exams are very fair and he holds an optional review section every week. So there is no excuse if you get a bad grade.,12/08/2013,2,2.0,,4,It's my life,4.5,4.5,1,Yes,N/A,1112,N/A,,N/A,,people,person
Mandatory,good,average,good,0,22326102,0,,good,5,PHYS101,Very clear and easy to understand teacher. Super funny and he sounds like Charlie from It's Always Sunny in Philadelphia hahaha. He does a ton of demonstrations in class and you can tell he enjoys it. Always there for help..overall great professor! As long as you get the main concepts you will be fine for the test; plus he posts past exams online.,11/15/2013,2,2.0,,5,Really into it,5,5.0,1,No,N/A,1112,N/A,,N/A,,people,people
