attendance,clarityColor,easyColor,helpColor,helpCount,id,notHelpCount,onlineClass,quality,rClarity,rClass,rComments,rDate,rEasy,rEasyString,rErrorMsg,rHelpful,rInterest,rOverall,rOverallString,rStatus,rTextBookUse,rWouldTakeAgain,sId,takenForCredit,teacher,teacherGrade,teacherRatingTags,unUsefulGrouping,usefulGrouping
N/A,average,average,average,0,23407064,0,,average,2,CHEM102,She is decent. I took her class with barely any chemistry knowledge. She is okay with presenting the material but tends to only give easy examples of problems and such you will be facing. She is tough but if you taken AP Chem in high school you will be fine. For those who do not study hard. Use your book and if you got a good TA you are in luck.,06/27/2014,3,3.0,,3,Sorta interested,2.5,2.5,1,Yes,N/A,1112,N/A,,N/A,,people,people
Mandatory,good,average,good,0,23278841,0,,good,5,CHEM102B,"I had a borderline grade, she bumped me up because I did well on the last exam and the final, and I went to all lectures.  Dr. Huang was helpful in answering my questions, but don't wait till the right before the exam to go to office hours, I had to wait to ask my questions since there were many people. I would recommend her.",05/19/2014,3,3.0,,4,Really into it,4.5,4.5,1,Yes,N/A,1112,N/A,,B+,,people,people
Not Mandatory,good,average,good,0,23230266,0,,good,5,CHEM102,She is very helpful and smart!,05/12/2014,2,2.0,,5,Really into it,5,5.0,1,Yes,N/A,1112,N/A,,A,,people,people
N/A,good,average,good,0,23230250,0,,good,5,CHEM102,Dr. Tina Huang is the easiest chem 102 professor. She explains the material fairly well and is very warm and helpful.,05/12/2014,2,2.0,,5,Really into it,5,5.0,1,Yes,N/A,1112,N/A,,N/A,,people,people
N/A,good,average,good,1,22867126,0,,good,4,102,"Her exams isn't too bad if you just do the problems similar to her practice tests. She gives these clicker points for credit, so just show up to class.",02/25/2014,2,2.0,,4,Sorta interested,4,4.0,1,No,N/A,1112,N/A,,A-,,people,person
N/A,good,good,good,0,22867089,0,,good,5,CHEM102E,"I also don't understand the negative ratings. Dr. Huang makes every effort to help her students. I didn't mind her explanations because it is clear and simple. Sometimes she takes too long to answer questions.You do need to be prepare yourself to do a lot of outside work. Like others said, do the book problems and go see her during office hours.",02/25/2014,4,4.0,,5,Really into it,5,5.0,1,Yes,N/A,1112,N/A,,N/A,,people,people
N/A,poor,good,average,1,22847888,0,,poor,1,CHEM102,"Tina is probably the best prof for this class but she doesn't really take the time to make sure you know they material.  She goes over it once, not very clearly, and then moves on.  Obviously the material builds on itself so it gets tough and her exams and usually confusing and tough.",02/17/2014,5,5.0,,3,Meh,2,2.0,1,Yes,N/A,1112,N/A,,N/A,,people,person
Mandatory,good,average,good,0,22790796,0,,good,4,CHEM102A,"I am a health profession major, and was afraid of chemistry.  But Dr. Huang was very good in helping me understand.  I didn't have problems understanding her lectures.  I would recommend that you go see her office  hours regularly, so if you need a letter recommendation, she can provide one for you.",01/24/2014,3,3.0,,5,Really into it,4.5,4.5,1,Yes,N/A,1112,N/A,,B,,people,people
N/A,average,average,average,0,22777754,0,,average,3,CHEM102EL2,Pretty mediocre and it didn't help that we just watched her lectures live-streamed.,01/21/2014,3,3.0,,2,Low,2.5,2.5,1,Yes,N/A,1112,N/A,,N/A,,people,people
N/A,poor,average,poor,1,22728451,1,,poor,1,CHEM102,"Almost every week, Huang makes mistakes. She is a bit clueless when it comes to teaching. She was also proud to say that the class had a D average on an exam. Her office hours were not helpful at all.",01/09/2014,2,2.0,,1,Really into it,1,1.0,1,Yes,N/A,1112,N/A,,N/A,,person,person
N/A,average,poor,average,0,22132378,0,,poor,2,CHEM202,She is not very helpful and her ability to explain question is not very good. I won't take her class any more,09/20/2013,1,1.0,,2,Low,2,2.0,1,Yes,N/A,1112,N/A,,N/A,,people,people
N/A,good,average,good,0,22067396,0,,good,5,CHEM102,Dr. Huang is amazing and undoubtedly my favorite professor. The class is pretty hard but that's expected from a nationally ranked chem program that's filled with so many chem/ biological engineers. She always makes time for her students and gives weekly planners with suggested hw problems alongside the chapter readings. I definitely recommend her.,08/19/2013,3,3.0,,5,Low,5,5.0,1,Yes,N/A,1112,N/A,,N/A,,people,people
N/A,good,good,good,0,21709584,0,,good,5,CHEM102,"I just took her final exam, and while it was really really hard, but since it will be curved, I think I will be OK.  DO go to her office hours and ask for help, she is willing to help me improve my exam scores, but you need to do a lot of work outside class.  Sometimes she gets sidetracked with her stories, but good overall.",05/08/2013,4,4.0,,5,Really into it,5,5.0,1,Yes,N/A,1112,N/A,,N/A,,people,people
N/A,average,good,poor,0,21705643,0,,poor,2,CHEM102,Dr. Huang does not explain concepts very well. Her exams are fairly difficult and she makes them like that on purpose. If you know some Chemistry going into the class you should do ok.,05/08/2013,4,4.0,,1,Sorta interested,1.5,1.5,1,No,N/A,1112,N/A,,N/A,,people,people
N/A,good,average,good,0,21575802,0,,good,5,CHEM102,Dr. Huang is amazing! I don't know why her rating is so low! She truly cares about students! Go to office hours!She is fantastic in office hours! She will spend 60 minutes on one question if that is what it takes for you to understand it! Plus she is very personable! I go in there to just talk ab out life sometimes. Wonderful professor!,04/21/2013,2,2.0,,5,Meh,5,5.0,1,Yes,N/A,1112,N/A,,N/A,,people,people
N/A,good,good,good,0,21369890,0,,good,4,CHEM102,"This is the second time I am taking the class, I had to drop it last semester because I had Jamieson and I didn't understand a lot of the materials covered in his lectures.  I took her section this time because my friend had her last year.  She is very helpful if you go see her during her office hours.",02/27/2013,4,4.0,,5,Sorta interested,4.5,4.5,1,No,N/A,1112,N/A,,N/A,,people,people
N/A,average,average,good,0,21250812,0,,good,3,CHEM202,"really cool and funny. the exams are exactly like the practice ones. in class she's sometimes difficult to understand, but she will clarify extremely well if you go to office hours",01/12/2013,3,3.0,,5,Really into it,4,4.0,1,No,N/A,1112,N/A,,N/A,,people,people
N/A,good,average,good,0,21231202,0,,good,4,CHEMAL,"great professor! she's so funny, lots of demos, makes early lectures fun. friendly, answers questions well during office hrs, but not well during lectures. she teaches the same general topics from high school, but newer (specific) material. WARNING: exams are VERY SIMILAR to practice exams. study those like crazy.",01/08/2013,3,3.0,,5,It's my life,4.5,4.5,1,No,N/A,1112,N/A,,N/A,,people,people
N/A,good,good,good,0,21201184,0,,good,5,CHEM202,"It is a harder class than my high school chem for sure. I personally find her easy to understand, some of my friends thought she should've done more problems in class, I just go to her office hours to get the help.  She pretty much tells you what you need to know to do well, so I have no complaints.",01/03/2013,4,4.0,,5,Really into it,5,5.0,1,Yes,N/A,1112,N/A,,N/A,,people,people
N/A,average,good,average,1,21075241,0,,poor,2,CHEM202,"While she is very knowledgeable and knows what she's talking about, she cannot teach to save her life. Very unclear and spends less time on hard concepts than on easy ones. Also has some very annoying habits. Would not recommend and will not be taking another one of her classes!!!",12/14/2012,5,5.0,,2,Really into it,2,2.0,1,Yes,N/A,1112,N/A,,N/A,,people,person
