attendance,clarityColor,easyColor,helpColor,helpCount,id,notHelpCount,onlineClass,quality,rClarity,rClass,rComments,rDate,rEasy,rEasyString,rErrorMsg,rHelpful,rInterest,rOverall,rOverallString,rStatus,rTextBookUse,rWouldTakeAgain,sId,takenForCredit,teacher,teacherGrade,teacherRatingTags,unUsefulGrouping,usefulGrouping
N/A,good,average,good,0,20537599,0,,good,5,ETHICCTY,"Mr. Todd was an awesome teacher for us! He was very supportive, patient, and understanding. Though Mr. Todd can seem passive and monotonous, you really just need to listen and pay attention to his words, because he really knows his stuff! He is very passionate about philosophy. He's a really awesome guy once you get to know him. Yay Mr. Todd!!",08/02/2012,2,2.0,,5,It's my life,5,5.0,1,Yes,N/A,1112,N/A,,N/A,,people,people
N/A,average,poor,good,0,12109166,0,,good,3,PHIL101,"He allowed us rewrites for our big papers worth 20%, so that was awesome, that made it so it was a very easy A.  Sometimes boring, but he's passionate and knows what he's talking about.  If you pay attention you can learn alot about life and philosophy.",07/27/2006,1,1.0,,5,Sorta interested,4,4.0,1,N/A,N/A,1112,N/A,,N/A,,people,people
N/A,good,average,good,0,11963478,0,,good,5,PHIL101,"great class, interesting, and got a lot out of it. I would suggest Todd for this class for sure.",06/01/2006,2,2.0,,4,It's my life,4.5,4.5,1,N/A,N/A,1112,N/A,,N/A,,people,people
N/A,good,average,good,0,11832104,0,,good,5,PHIL101,todd rocks! Hes an awesome guy and listens to his students!,05/05/2006,2,2.0,,4,Sorta interested,4.5,4.5,1,N/A,N/A,1112,N/A,,N/A,,people,people
N/A,good,average,good,0,11729295,0,,good,5,PHIL101,"Todd is just a really cool guy. He is really helpful, and you just have to warm up to him. While he has a somewhat monotone voice, he is really funny, extremely smart, and passionate about his subject.",04/19/2006,2,2.0,,5,Really into it,5,5.0,1,N/A,N/A,1112,N/A,,N/A,,people,people
N/A,good,average,good,0,10877277,0,,good,4,PHIL101,"Very knowledgeable about the material and passionate about the humanities. Somewhat monotone voice, but always open to any discussion.  Still needs to work on some teaching methods but I think it's a class worth taking and he's a more than tolerable teacher. Humorous at times if you can catch it.  Allows handing in of late assignments,understanding",11/10/2005,2,2.0,,4,Sorta interested,4,4.0,1,N/A,N/A,1112,N/A,,N/A,,people,people
N/A,poor,average,poor,0,2548556,0,,poor,1,PHIL103,"At any given moment, 2/3 of the class will be asleep from his extremely monotone voice.  He obviously does not know how to teach and should not be allowed in a classroom. I have never had a teacher his bad. I loved philosophy before I took it with him.",10/14/2004,2,2.0,,1,It's my life,1,1.0,1,N/A,N/A,1112,N/A,,N/A,,people,people
N/A,poor,good,average,0,1549115,0,,poor,1,PHIL105,He speaks in monotone and good luck to anyone who thinks that they can understand the material or stay awake through class because both are impossible to do!,12/23/2003,4,4.0,,3,N/A,2,2.0,1,N/A,N/A,1112,N/A,,N/A,,people,people
