attendance,clarityColor,easyColor,helpColor,helpCount,id,notHelpCount,onlineClass,quality,rClarity,rClass,rComments,rDate,rEasy,rEasyString,rErrorMsg,rHelpful,rInterest,rOverall,rOverallString,rStatus,rTextBookUse,rWouldTakeAgain,sId,takenForCredit,teacher,teacherGrade,teacherRatingTags,unUsefulGrouping,usefulGrouping
N/A,good,average,good,0,14762056,1,,good,5,MUS133,"I LOVED this course!!   I think professor Faux explained things very well, and I think the class was the right level of difficulty for a general 100 level course.  You could pass easily by taking good notes, but you could get a lot out of it if you wanted.",08/21/2008,3,3.0,,4,Sorta interested,4.5,4.5,1,No,N/A,1112,N/A,,N/A,,person,people
N/A,average,average,average,0,13271273,0,,poor,2,MUSIC133,"Tom is repetitive, weird, but mainly, if you do not go to class, you will not get the vocab. words which will screw you over on a test. If you treat it like any other class, you should get an A.",06/16/2007,2,2.0,,2,Low,2,2.0,1,No,N/A,1112,N/A,,N/A,,people,people
N/A,good,average,good,0,13120062,1,,good,4,MUS133,"Lecture is exremely boring. If you go to discussion you should get all the notes you need. The class consists of a midterm, paper and a final.",05/07/2007,2,2.0,,4,Meh,4,4.0,1,No,N/A,1112,N/A,,N/A,,person,people
N/A,average,average,average,0,13087352,0,,average,2,MUS133,"Boring, requires extensive note-taking",04/30/2007,2,2.0,,3,Low,2.5,2.5,1,No,N/A,1112,N/A,,N/A,,people,people
N/A,average,average,average,0,12817084,0,,poor,2,MUSIC133,The guy is the most monotone person ever and all he talks about is Howlin' Wolf... I swear we heard the same song five times already,01/25/2007,2,2.0,,2,Low,2,2.0,1,Yes,N/A,1112,N/A,,N/A,,people,people
