attendance,clarityColor,easyColor,helpColor,helpCount,id,notHelpCount,onlineClass,quality,rClarity,rClass,rComments,rDate,rEasy,rEasyString,rErrorMsg,rHelpful,rInterest,rOverall,rOverallString,rStatus,rTextBookUse,rWouldTakeAgain,sId,takenForCredit,teacher,teacherGrade,teacherRatingTags,unUsefulGrouping,usefulGrouping
N/A,good,average,good,0,15448199,0,,good,4,HNDI201,"Vandana was a good teacher who taught Hindi to those who aren't native by any stretch of the imagination. While she left mid-semester on maternity leave, she was a good teacher. The other teachers were also good, the class is just a little unorganized.",02/07/2009,2,2.0,,5,Really into it,4.5,4.5,1,Yes,N/A,1112,N/A,,N/A,,people,people
N/A,good,poor,good,0,15047991,0,,good,5,HINDI201,She is not the Prof. for our section but teaches us once every week. Me and my friends wait for her because she makes everything so clear and easy to understand.,11/22/2008,1,1.0,,5,It's my life,5,5.0,1,Yes,N/A,1112,N/A,,N/A,,people,people
N/A,good,average,good,0,14394369,0,,good,5,HINDI202,"AMAZING, GREAT TEACHER.  Really outstanding, careful, clear, organized, etc.  She makes Hindi interesting and she makes class worth coming to.",05/03/2008,3,3.0,,5,Meh,5,5.0,1,No,N/A,1112,N/A,,N/A,,people,people
N/A,good,average,good,0,14084303,0,,good,4,HINDI201,No Comments,02/10/2008,3,3.0,,5,Sorta interested,4.5,4.5,1,No,N/A,1112,N/A,,N/A,,people,people
N/A,good,poor,good,0,13041567,0,,good,4,HINDI202,I think for a TA she is a very good teacher. Takes extra time to explain things and gives extra time. Her accent is not that bad and seems like a very caring teacher. What shocked me the most was the amount she knows about the topics she teaches.,04/20/2007,1,1.0,,5,Low,4.5,4.5,1,No,N/A,1112,N/A,,N/A,,people,people
