attendance,clarityColor,easyColor,helpColor,helpCount,id,notHelpCount,onlineClass,quality,rClarity,rClass,rComments,rDate,rEasy,rEasyString,rErrorMsg,rHelpful,rInterest,rOverall,rOverallString,rStatus,rTextBookUse,rWouldTakeAgain,sId,takenForCredit,teacher,teacherGrade,teacherRatingTags,unUsefulGrouping,usefulGrouping
N/A,average,average,average,0,11873478,0,,good,3,ME300,"Good guy, but classes can be dull.",05/11/2006,2,2.0,,4,Sorta interested,3.5,3.5,1,N/A,N/A,1112,N/A,,N/A,,people,people
N/A,good,average,good,0,11224475,0,,good,4,ME360,"He made this class far easier than I thought it could be.  Easy, easy test grading and he wrote out most of our homework and lab reports for us.  And those suspenders are just awesome.",12/20/2005,2,2.0,,5,Low,4.5,4.5,1,N/A,N/A,1112,N/A,,N/A,,people,people
N/A,good,good,good,0,11136198,0,,good,5,ME360,"THIS GUY IS AWESOME!!!GOTTA LOVE THOSE SUSPENDERS AND THAT NEED FOR A TUPE.  When he walks, it looks like he's about to fart.  He is funny and great. Just be sure you don't cheat on an exam like 3/4 of the class this past semester...OoooOOoo he gets angry!",12/13/2005,4,4.0,,4,Low,4.5,4.5,1,N/A,N/A,1112,N/A,,N/A,,people,people
N/A,poor,average,average,0,10043110,0,,average,1,ECE329,"Hardest working TA ever, unfortunately poor course design (due to course director) makes this coruse useless and not very educatonal.  Eric is a great person but spends too much time on concepts and not on problem solving examples.",07/20/2005,3,3.0,,4,Sorta interested,2.5,2.5,3,N/A,N/A,1112,N/A,,N/A,,people,people
N/A,good,average,good,0,3938396,0,,good,5,ME300,"Tests got harder as the class progressed, but considering they were True/False I don't know how you could fail this class.  Dunn has your typically boring proffesor look and voice, but he is actually quite interesting.",05/29/2005,2,2.0,,4,It's my life,4.5,4.5,1,N/A,N/A,1112,N/A,,N/A,,people,people
N/A,good,poor,good,0,3663805,0,,good,5,ME300,This dude is a bad ass.  t/f tests with notes and example problems.  doesnt have wast time deriving everything just tells you what you need to know.  if you have a choice make sure to pick this guy.,04/19/2005,1,1.0,,5,Sorta interested,5,5.0,1,N/A,N/A,1112,N/A,,N/A,,people,people
