attendance,clarityColor,easyColor,helpColor,helpCount,id,notHelpCount,onlineClass,quality,rClarity,rClass,rComments,rDate,rEasy,rEasyString,rErrorMsg,rHelpful,rInterest,rOverall,rOverallString,rStatus,rTextBookUse,rWouldTakeAgain,sId,takenForCredit,teacher,teacherGrade,teacherRatingTags,unUsefulGrouping,usefulGrouping
N/A,good,good,good,0,26648045,0,,good,5,MATH447,"(SP16) Prof. Li is a strong lecturer. The 2 midterms and final were challenging but fair. There's a lot of homework, including graded sets due on exam days. No email use nor use of a grade-tracking system like Compass or Math Score Reports. Text (Ross, Analysis, 2ed) is comprehensive, making attendance optional.",05/25/2016,4,4.0,,3,N/A,4,4.0,1,Yes,N/A,1112,Yes,,N/A,,people,people
Not Mandatory,average,average,average,0,24341655,0,,poor,3,MATH285,"His class is easy overall; as long as you do the homework and understand it, you'll get an A. The tests are very similar to the problems he does in class. However, if you need help, go to a tutor or ask a friend, because he is absolutely no help in office hours. He is very well prepared during lectures, but is unable to answer students' questions.",01/28/2015,3,3.0,,1,Sorta interested,2,2.0,1,Yes,N/A,1112,Yes,,N/A,,people,people
Not Mandatory,good,average,good,0,23256422,0,,good,5,MATH461,The lecture is clear and the exam is closely related to the problem he did in class. And he is a kind teacher really.,05/15/2014,2,2.0,,5,Really into it,5,5.0,1,Yes,N/A,1112,N/A,,B+,,people,people
N/A,good,average,good,1,21642857,0,,good,5,MATH545,His homework is very helpful.,05/01/2013,2,2.0,,5,It's my life,5,5.0,1,Yes,N/A,1112,N/A,,N/A,,people,person
N/A,good,poor,good,0,21005921,0,,good,5,MATH285,"At first I was skeptical of Professor Li, but after the first weeks I warmed up to him. He is purely a lecturer so if you ask him how he got an answer, he will just look at you and say ""Verify"" His rests are just like homework problems and are curved very heavily. If you do the homework and learn the methods rather than the formulas, an A is easy.",12/10/2012,1,1.0,,5,It's my life,5,5.0,1,Yes,N/A,1112,N/A,,N/A,,people,people
N/A,good,average,average,1,17439249,0,,average,4,MATH285,"After taking many different math courses at the university, I have to say he is the best prof I have ever had.  His examples in the notes are extremely helpful and prepare you well for the exams which are very fair (difficult, but fair). However, he isn't that helpful during office hours. If you go to class and do the work, you're guaranteed an A.",07/21/2010,3,3.0,,2,Really into it,3,3.0,1,Yes,N/A,1112,N/A,,N/A,,people,person
N/A,good,average,average,1,15894285,0,,average,4,MATH285,"Professor Li is the best math professor I have had at UIUC.  If you can get past his accent, you will find a professor who slowly goes over all the details in an example and focuses on a few examples only. His exams are fair, and his homework prepares you for them.  I wish more professors at this institution were like him.",05/25/2009,2,2.0,,2,Really into it,3,3.0,1,Yes,N/A,1112,N/A,,N/A,,people,person
N/A,average,average,average,0,15213461,2,,average,2,MATH347,"Awesome teacher! I was really nervous to take Math 347 because of all the bad things i had heard about it.  The material is difficult, but he teaches it really well.  He prepares you for his exams very well, but you have to go to class and take good notes.  If you have to take math 347, i definitely recommend taking it with xiaochun li!",12/16/2008,3,3.0,,4,Sorta interested,3,3.0,1,No,N/A,1112,N/A,,N/A,,people,people
N/A,good,average,good,0,14985260,1,,good,5,MATH347,"He is a fantastic professor.  His notes are extremely clear! Homework is hard, but exams are fair IF YOU STUDY and go to class!  You have to go to class to get the notes, but other than that it's not bad.  I've heard horror stories about other Math 347 classes, but I promise this one is not bad at all!",11/12/2008,2,2.0,,5,Sorta interested,5,5.0,1,Yes,N/A,1112,N/A,,N/A,,person,people
