attendance,clarityColor,easyColor,helpColor,helpCount,id,notHelpCount,onlineClass,quality,rClarity,rClass,rComments,rDate,rEasy,rEasyString,rErrorMsg,rHelpful,rInterest,rOverall,rOverallString,rStatus,rTextBookUse,rWouldTakeAgain,sId,takenForCredit,teacher,teacherGrade,teacherRatingTags,unUsefulGrouping,usefulGrouping
N/A,good,poor,good,0,20646892,0,,good,4,ENGLCHP,"I took Professor Sullivan's ENGL 274 class.  I entered her class with very little interest in the subject matter, but I found that her passion for the material made the class very interesting.  At times I felt that she was overly critical of ideas with which she did not agree, but overall I believe that the class was taught very well.",09/17/2012,1,1.0,,4,Low,4,4.0,1,Yes,N/A,1112,N/A,,N/A,,people,people
N/A,good,average,good,0,20646827,0,,good,4,ENGL274,"Professor Sullivan is an extremely charismatic speaker and is one of those rare teachers who not only helped me ""read the world,"" but also greatly increased my analytical reading skills with her engaging material on globalization and the relevance it still has today. Definitely an interested class to take.",09/16/2012,3,3.0,,5,Really into it,4.5,4.5,1,Yes,N/A,1112,N/A,,N/A,,people,people
N/A,good,good,good,0,20646769,0,,good,5,ENGL274,"If there's one word to describe professor Sullivan, it would be passionate. Part of what makes this course so interesting is the excellent assortment of literature she has compiled, along with her deep knowledge in the subject. I went into the class not even knowing what ""diaspora"" meant, and left feeling incredibly educated.",09/16/2012,4,4.0,,5,Really into it,5,5.0,1,No,N/A,1112,N/A,,N/A,,people,people
N/A,good,average,good,0,17669126,0,,good,5,ENG112,I took professor Sullivan's poetry class in the early 1970's.  I knew little about poetry before taking her class. She made inscrutable poetry meaningful and interesting. I still love her interpretation of Yeats' &quot;Sailing to Byzantium&quot; and TS Eliot's &quot;Lovesong of J. Alfred Prufrock&quot;. I am glad to discover that she is still teaching.Thanks Zohreh!,10/18/2010,3,3.0,,4,Low,4.5,4.5,1,Yes,N/A,1112,N/A,,N/A,,people,people
N/A,average,average,average,0,16628853,0,,average,2,ENG112,She is very nice and means well. The class is extremely boring and dull. Quizzes are easy but unexpected so be sure to always do the readings. As long as you do the work in this class you will be fine!,12/23/2009,2,2.0,,4,Meh,3,3.0,1,Yes,N/A,1112,N/A,,N/A,,people,people
N/A,good,poor,good,0,15406362,0,,good,5,ENGL112,"A great professor who is always willing to help students. She always put off the deadlines=) She makes ENGL112 more interesting and enjoyable. If you do all the readings and writings, you will get an A. (PS. In fact there is not much work to do. She even cancels assignments to help students.)",01/23/2009,1,1.0,,5,Meh,5,5.0,1,No,N/A,1112,N/A,,N/A,,people,people
N/A,good,average,good,0,15232234,0,,good,5,ENG112,"Great teacher.  Very interesting.  The assignments are pretty easy if you listen in class, so attendance is really important.  Overall, a great class.  Take her classes if they're offered.  She's semi-retired though, so I don't know how long they'll be offered.",12/18/2008,3,3.0,,5,Really into it,5,5.0,1,Yes,N/A,1112,N/A,,N/A,,people,people
N/A,average,average,average,0,14959612,0,,poor,3,ENGL211,"Although I received a good grade in the only class I took with her, she told me that I would be better off applying for a masters degree elsewhere since my work would not be &quot;up to par&quot; with what get me into that particular university.  I assumed she would be the first to encourage any of her students to apply anywhere.",11/08/2008,3,3.0,,1,It's my life,2,2.0,1,Yes,N/A,1112,N/A,,N/A,,people,people
N/A,good,poor,good,0,14238928,0,,good,4,ENGL112,"She has a very interesting background and her accent is adorable! Overall, I think the class did not allow for in-depth discussion of the texts, since it was mainly a lecture, but the political and historical knowledge of world events that came from this class is invaluable.",04/03/2008,1,1.0,,5,Really into it,4.5,4.5,1,Yes,N/A,1112,N/A,,N/A,,people,people
N/A,good,average,good,0,12952738,0,,good,4,ENGL112,Great Teacher!,03/30/2007,3,3.0,,5,Really into it,4.5,4.5,1,Yes,N/A,1112,N/A,,N/A,,people,people
N/A,average,average,good,0,12861611,0,,good,3,ENGL112,"She is a great teacher! She loves what she's doing and is very passionate...which makes it more interesting for the students. Although I hated reading Kim, the rest of the books were very interesting and not alot of hmk was required besides readings. It's a freshman only class, and a great lit to start off with.",02/13/2007,2,2.0,,5,Sorta interested,4,4.0,1,Yes,N/A,1112,N/A,,N/A,,people,people
N/A,average,average,average,0,12523553,0,,good,3,ENG112,"She seems to care about her students, so she'll change due dates and give extra assignments (for points) if you bring it up.  Also, I love British accents... the only bad thing is that all she did was summarize the books in class.  Minimal analysis and not much room for interpretation/creativity : (",12/05/2006,3,3.0,,4,It's my life,3.5,3.5,1,Yes,N/A,1112,N/A,,N/A,,people,people
N/A,good,average,good,0,11386400,0,,good,5,ENGLISH112,"Professor Sullican was extremely nice, very funny, and did everything in her power to try to make class interesting. (she succeeded). She was always more than willing to help and was very accomodating. Also, the work was very little...read and push some effort into the homework and you will get an A.",01/18/2006,3,3.0,,5,Sorta interested,5,5.0,1,N/A,N/A,1112,N/A,,N/A,,people,people
N/A,average,average,average,0,11381034,0,,average,2,ENGL112,"Professor Sullivan is a sweet, witty, and extremely intelligent woman who loves to work her students.  Lots and lots of reading that you MUST keep up with to get a good grade in the course, as all of her quizzes and tests are based on readings and movies we watch in class.",01/18/2006,3,3.0,,4,Sorta interested,3,3.0,1,N/A,N/A,1112,N/A,,N/A,,people,people
N/A,good,good,good,0,10442644,0,,good,5,ENGL3XX,"Took several classes with Prof. Sullivan, several years ago. She is one of the best teachers I have ever had, brilliant, knowledgeable, into the material, witty. Definitely not for those who are unwilling to work. 
 
 And she used to be very attractive in a kind of a British upper class way, but as I said, this was some years ago.",09/23/2005,4,4.0,,4,It's my life,4.5,4.5,1,N/A,N/A,1112,N/A,,N/A,,people,people
N/A,poor,good,average,0,3904857,0,,average,1,ENG112,"She's so intelligent that she doesn't really know how to speak to students. She's so confusing, but if you do the readings you'll be fine. If you don't like lit., definately don't take this class with her.",05/22/2005,4,4.0,,4,Really into it,2.5,2.5,1,N/A,N/A,1112,N/A,,N/A,,people,people
N/A,good,good,good,0,3322289,0,,good,5,ENGLISH112,Great! funny too,02/04/2005,4,4.0,,5,Sorta interested,5,5.0,1,N/A,N/A,1112,N/A,,N/A,,people,people
N/A,good,good,good,0,2925499,0,,good,4,ENG112,She's a very smart professor. Tries very hard to accomodate students. Be prepared to use compass and if you plan on sleeping you may as well stay home and sleep there because she'll embarass you.,12/06/2004,4,4.0,,5,It's my life,4.5,4.5,1,N/A,N/A,1112,N/A,,N/A,,people,people
N/A,good,good,good,0,2838409,0,,good,5,112,Professor Sullivan is a great teacher.  Her passion in both her subject matter and students engage the students.,11/26/2004,4,4.0,,4,Really into it,4.5,4.5,1,N/A,N/A,1112,N/A,,N/A,,people,people
N/A,poor,average,poor,0,2783375,0,,poor,1,ENG112,"Very smart, but it is difficult to understand her.  And she has a hard time keeping my interest in what she is saying.",11/18/2004,2,2.0,,2,Really into it,1.5,1.5,1,N/A,N/A,1112,N/A,,N/A,,people,people
